original_index,arxiv_id,extracted_authors,extracted_affiliations,extracted_countries,first_author_country
56,2501.12168,"[""G. F. Paraschos"", ""L. C. Debbrecht"", ""J. A. Kramer"", ""E. Traianou"", ""I. Liodakis"", ""T. Krichbaum"", ""J.-Y. Kim"", ""M. Janssen"", ""D. G. Nair"", ""T. Savolainen"", ""E. Ros"", ""U Bach"", ""J. A. Hodgson"", ""M. Lisakov"", ""N. R. MacDonald"", ""J. A. Zensus""]","[""Max-Planck-Institut f\u00fcr Radioastronomie, Auf dem H\u00fcgel 69, D-53121 Bonn, Germany"", ""Max-Planck-Institut f\u00fcr Radioastronomie, Auf dem H\u00fcgel 69, D-53121 Bonn, Germany"", ""Theoretical Division, Los Alamos National Laboratory, Los Alamos, NM 87545, USA; Max-Planck-Institut f\u00fcr Radioastronomie, Auf dem H\u00fcgel 69, D-53121 Bonn, Germany"", ""Instituto de Astrof\u00edsica de Andaluc\u00eda-CSIC, Glorieta de la Astronom\u00eda s/n, E-18008 Granada, Spain; Max-Planck-Institut f\u00fcr Radioastronomie, Auf dem H\u00fcgel 69, D-53121 Bonn, Germany"", ""NASA Marshall Space Flight Center, Huntsville, AL 35812, USA; Institute of Astrophysics, Foundation for Research and Technology, Hellas, Heraklion 7110, Greece"", ""Max-Planck-Institut f\u00fcr Radioastronomie, Auf dem H\u00fcgel 69, D-53121 Bonn, Germany"", ""Department of Physics, Ulsan National Institute of Science and Technology (UNIST), 50 UNIST-gil, Eonyang-eup, Ulju-gun, Ulsan 44919, Republic of Korea; Max-Planck-Institut f\u00fcr Radioastronomie, Auf dem H\u00fcgel 69, D-53121 Bonn, Germany"", ""Department of Astrophysics, Institute for Mathematics, Astrophysics and Particle Physics (IMAPP), Radboud University, PO Box 9010, 6500 GL Nijmegen, The Netherlands; Max-Planck-Institut f\u00fcr Radioastronomie, Auf dem H\u00fcgel 69, D-53121 Bonn, Germany"", ""Astronomy Department, Universidad de Concepci\u00f3n, Casilla 160-C, Concepci\u00f3n, Chile"", ""Aalto University Department of Electronics and Nanoengineering, PL 15500, 00076 Aalto, Finland; Aalto University Mets\u00e4hovi Radio Observatory, Mets\u00e4hovintie 114, 02540 Kylm\u00e4l\u00e4, Finland; Max-Planck-Institut f\u00fcr Radioastronomie, Auf dem H\u00fcgel 69, D-53121 Bonn, Germany"", ""Max-Planck-Institut f\u00fcr Radioastronomie, Auf dem H\u00fcgel 69, D-53121 Bonn, Germany"", ""Max-Planck-Institut f\u00fcr Radioastronomie, Auf dem H\u00fcgel 69, D-53121 Bonn, Germany"", ""Dept. of Physics & Astronomy, Sejong University, Guangjin-gu, Seoul 05006, Republic of Korea"", ""Max-Planck-Institut f\u00fcr Radioastronomie, Auf dem H\u00fcgel 69, D-53121 Bonn, Germany; Instituto de F\u00edsica, Pontificia Universidad Cat\u00f3lica de Valpara\u00edso, Casilla 4059, Valpara\u00edso, Chile"", ""Department of Physics and Astronomy, The University of Mississippi, University, Mississippi 38677, USA"", ""Max-Planck-Institut f\u00fcr Radioastronomie, Auf dem H\u00fcgel 69, D-53121 Bonn, Germany""]","[""Germany"", ""Germany"", ""USA; Germany"", ""Spain; Germany"", ""USA; Greece"", ""Germany"", ""South Korea; Germany"", ""Netherlands; Germany"", ""Chile"", ""Finland; Germany"", ""Germany"", ""Germany"", ""South Korea"", ""Germany; Chile"", ""USA"", ""Germany""]",Germany
57,2501.12143,"[""M. Rigoselli""]","[""INAF OA-Brera, via Brera, 28, Milano 20121, Italy; INAF IASF-Milano, via A. Corti, 15, Milano 20133, Italy""]","[""Italy; Italy""]",Italy
58,2501.12138,"[""Mark Gieles"", ""Paolo Padoan"", ""Corinne Charbonnel"", ""Jorick S. Vink"", ""Laura Ram\u00edrez-Galeano""]","[""ICREA, Pg. Llu\u00eds Companys 23, E08010 Barcelona, Spain; Institut de Ci\u00e8ncies del Cosmos (ICCUB), Universitat de Barcelona (UB), c. Mart\u00ed i Franqu\u00e8s, 1, 08028 Barcelona, Spain"", ""Institut de Ci\u00e8ncies del Cosmos (ICCUB), Universitat de Barcelona (UB), c. Mart\u00ed i Franqu\u00e8s, 1, 08028 Barcelona, Spain; Department of Physics and Astronomy, Dartmouth College, 6127 Wilder Laboratory, Hanover, 03755, NH, USA"", ""Department of Astronomy, University of Geneva, Chemin des Maillettes 51, CH-1290 Versoix, Switzerland; IRAP, Universit\u00e9 de Toulouse, CNRS, Observatoire Midi Pyr\u00e9n\u00e9es, 57 Avenue d\u2019Azereix, 65008 Tarbes, France"", ""Armagh Observatory, College Hill, Armagh, BT61 9DG, Northern Ireland, UK"", ""Department of Astronomy, University of Geneva, Chemin des Maillettes 51, CH-1290 Versoix, Switzerland""]","[""Spain; Spain"", ""Spain; USA"", ""Switzerland; France"", ""UK"", ""Switzerland""]",Spain
59,2501.12065,"[""Sovan Boxi"", ""Saptarshi Ghosh"", ""Nayantara Gupta""]","[""Raman Research Institute, C. V. Raman Avenue, 5th Cross Road, Sadashivanagar, Bengaluru, Karnataka 560080, India"", ""Astroparticule et Cosmologie, Universit\u00e9 Paris Cit\u00e9, Paris 75013, France"", ""Raman Research Institute, C. V. Raman Avenue, 5th Cross Road, Sadashivanagar, Bengaluru, Karnataka 560080, India""]","[""India"", ""France"", ""India""]",India
60,2501.12383,"[""Greg Olmschenk"", ""Emily Broadbent"", ""Constantinos Kalapotharakos"", ""Wendy F. Wallace"", ""Thibault Lechien"", ""Zorawar Wadiasingh"", ""Demosthenes Kazanas"", ""Alice Harding""]","[""NASA Goddard Space Flight Center, Greenbelt, MD 20771, USA; Department of Astronomy, University of Maryland, College Park, MD 20742, USA"", ""NASA Goddard Space Flight Center, Greenbelt, MD 20771, USA; Center for Research and Exploration in Space Science and Technology, NASA/GSFC, Greenbelt, MD 20771, USA; Southeastern Universities Research Association, Washington, DC 20005 USA; Department of Astronomy and Astrophysics, University of California San Diego, La Jolla, CA 92093, USA"", ""NASA Goddard Space Flight Center, Greenbelt, MD 20771, USA"", ""NASA Goddard Space Flight Center, Greenbelt, MD 20771, USA; Center for Research and Exploration in Space Science and Technology, NASA/GSFC, Greenbelt, MD 20771, USA; Southeastern Universities Research Association, Washington, DC 20005 USA"", ""NASA Goddard Space Flight Center, Greenbelt, MD 20771, USA; Center for Research and Exploration in Space Science and Technology, NASA/GSFC, Greenbelt, MD 20771, USA; Southeastern Universities Research Association, Washington, DC 20005 USA; Max Planck Institute for Astrophysics, Karl-Schwarzschild-Stra\u00dfe 1, 85748 Garching bei M\u00fcnchen, Germany"", ""NASA Goddard Space Flight Center, Greenbelt, MD 20771, USA"", ""NASA Goddard Space Flight Center, Greenbelt, MD 20771, USA; Department of Astronomy, University of Maryland, College Park, MD 20742, USA"", ""Theoretical Division, Los Alamos National Laboratory, Los Alamos, NM 87545, USA""]","[""USA"", ""USA"", ""USA"", ""USA"", ""USA; Germany"", ""USA"", ""USA"", ""USA""]",USA
61,2501.12621,"[""Michael J. Schwarz"", ""August E. Evrard"", ""Klaus Honscheid"", ""Ramon Miquel"", ""J. A. Newman"", ""Mehmet Alpaslan"", ""David Brooks"", ""David L. Burke"", ""Yutong Duan"", ""Daniel J. Eisenstein"", ""J. E. Forero-Romero"", ""Satya Gontcho A Gontcho"", ""Klaus Honscheid"", ""David Kirkby"", ""Theodore Kisner"", ""Anthony Kremin"", ""Martin Landriau"", ""Laurent Le Guillou"", ""Michael E. Levi"", ""Paul Martini"", ""Aaron M. Meisner"", ""Ram\u00f3n Miquel"", ""Jordi Miralda-Escud\u00e9"", ""Adam D. Myers"", ""J. A. Newman"", ""Nathalie Palanque-Delabrouille"", ""Will J. Percival"", ""Francisco Prada"", ""Anand Raichoor"", ""Alexie Leauthaud"", ""Sergey E. Koposov"", ""H\u00e9lion du Mas des Bourboux"", ""Julien Guy"", ""Graziano Rossi"", ""Donald P. Schneider"", ""Arman Shafieloo"", ""Michael J. Wilson"", ""Christophe Y\u00e8che"", ""Zhimin Zhou""]","[""Department of Astronomy, University of California, Berkeley, CA 94720, USA"", ""Department of Physics, University of Michigan, Ann Arbor, MI 48109, USA"", ""Center for Cosmology and AstroParticle Physics, The Ohio State University, Columbus, OH 43210, USA"", ""Institut de F\u00edsica d\u2019Altes Energies (IFAE), The Barcelona Institute of Science and Technology, 08193 Bellaterra, Barcelona, Spain"", ""Department of Physics and Astronomy, University of Pittsburgh, Pittsburgh, PA 15260, USA"", ""Department of Physics, University of California, Davis, CA 95616, USA"", ""Department of Physics & Astronomy, University College London, Gower Street, London WC1E 6BT, UK"", ""Kavli Institute for Particle Astrophysics & Cosmology, P. O. Box 20450, MS29, Stanford, CA 94309, USA"", ""Department of Astronomy, University of California, Berkeley, CA 94720, USA"", ""Center for Astrophysics | Harvard & Smithsonian, 60 Garden Street, Cambridge, MA 02138, USA"", ""Departamento de F\u00edsica, Universidad de los Andes, Cra. 1 No. 18A-10, Edificio Ip, CP 111711, Bogot\u00e1, Colombia"", ""Lawrence Berkeley National Laboratory, 1 Cyclotron Road, Berkeley, CA 94720, USA"", ""Center for Cosmology and AstroParticle Physics, The Ohio State University, Columbus, OH 43210, USA"", ""Department of Physics and Astronomy, University of California, Irvine, CA 92697, USA"", ""Lawrence Berkeley National Laboratory, 1 Cyclotron Road, Berkeley, CA 94720, USA"", ""Lawrence Berkeley National Laboratory, 1 Cyclotron Road, Berkeley, CA 94720, USA"", ""Lawrence Berkeley National Laboratory, 1 Cyclotron Road, Berkeley, CA 94720, USA"", ""Sorbonne Universit\u00e9, CNRS/IN2P3, Laboratoire de Physique Nucl\u00e9aire et de Hautes Energies (LPNHE), FR-75005 Paris, France"", ""Lawrence Berkeley National Laboratory, 1 Cyclotron Road, Berkeley, CA 94720, USA"", ""Department of Astronomy, The Ohio State University, Columbus, OH 43210, USA"", ""NSF\u2019s National Optical-Infrared Astronomy Research Laboratory, 950 N. Cherry Ave., Tucson, AZ 85719, USA"", ""Institut de F\u00edsica d\u2019Altes Energies (IFAE), The Barcelona Institute of Science and Technology, 08193 Bellaterra, Barcelona, Spain"", ""Institut de Ci\u00e8ncies del Cosmos, Universitat de Barcelona, Mart\u00ed i Franqu\u00e8s 1, 08028 Barcelona, Spain"", ""Department of Physics and Astronomy, University of Wyoming, Laramie, WY 82071, USA"", ""Department of Physics and Astronomy, University of Pittsburgh, Pittsburgh, PA 15260, USA"", ""Lawrence Berkeley National Laboratory, 1 Cyclotron Road, Berkeley, CA 94720, USA"", ""Department of Physics and Astronomy, University of Waterloo, Waterloo, ON N2L 3G1, Canada"", ""Instituto de Astrof\u00edsica de Andaluc\u00eda (CSIC), Glorieta de la Astronom\u00eda, E-18008 Granada, Spain"", ""Lawrence Berkeley National Laboratory, 1 Cyclotron Road, Berkeley, CA 94720, USA"", ""Department of Astronomy and Astrophysics, University of California, Santa Cruz, CA 95064, USA"", ""McWilliams Center for Cosmology, Department of Physics, Carnegie Mellon University, Pittsburgh, PA 15213, USA"", ""Department of Physics and Astronomy, University of Utah, Salt Lake City, UT 84112, USA"", ""Lawrence Berkeley National Laboratory, 1 Cyclotron Road, Berkeley, CA 94720, USA"", ""Department of Physics and Astronomy, Sejong University, Seoul 05006, Republic of Korea"", ""Department of Astronomy and Astrophysics, The Pennsylvania State University, University Park, PA 16802, USA"", ""Korea Astronomy and Space Science Institute, Daejeon 34055, Republic of Korea"", ""Department of Physics and Astronomy, University of Utah, Salt Lake City, UT 84112, USA"", ""IRFU, CEA, Universit\u00e9 Paris-Saclay, F-91191 Gif-sur-Yvette, France"", ""National Astronomical Observatories, Chinese Academy of Sciences, Beijing 100012, China""]","[""USA"", ""USA"", ""USA"", ""Spain"", ""USA"", ""USA"", ""UK"", ""USA"", ""USA"", ""USA"", ""Colombia"", ""USA"", ""USA"", ""USA"", ""USA"", ""USA"", ""USA"", ""France"", ""USA"", ""USA"", ""USA"", ""Spain"", ""Spain"", ""USA"", ""USA"", ""USA"", ""Canada"", ""Spain"", ""USA"", ""USA"", ""USA"", ""USA"", ""USA"", ""South Korea"", ""USA"", ""South Korea"", ""USA"", ""France"", ""China""]",USA
62,2501.12436,"[""Tetsuro Asano"", ""Michiko S. Fujii"", ""Junichi Baba"", ""Simon Portegies Zwart"", ""Jeroen B\u00e9dorf""]","[""Departament de F\u00edsica Qu\u00e0ntica i Astrof\u00edsica (FQA), Universitat de Barcelona (UB), c. Mart\u00ed i Franqu\u00e8s, 1, 08028 Barcelona, Spain; Institut de Ci\u00e8ncies del Cosmos (ICCUB), Universitat de Barcelona (UB), c. Mart\u00ed i Franqu\u00e8s, 1, 08028 Barcelona, Spain; Institut d\u2019Estudis Espacials de Catalunya (IEEC), c. Gran Capit\u00e0, 2-4, 08034 Barcelona, Spain; Department of Astronomy, Graduate School of Science, The University of Tokyo, 7-3-1 Hongo, Bunkyo-ku, Tokyo 113-0033, Japan"", ""Department of Astronomy, Graduate School of Science, The University of Tokyo, 7-3-1 Hongo, Bunkyo-ku, Tokyo 113-0033, Japan"", ""Amanogawa Galaxy Astronomy Research Center, Kagoshima University, 1-21-35 Korimoto, Kagoshima 890-0065, Japan; National Astronomical Observatory of Japan, Mitaka-shi, Tokyo 181-8588, Japan"", ""Leiden Observatory, Leiden University, NL-2300RA Leiden, the Netherlands"", ""Leiden Observatory, Leiden University, NL-2300RA Leiden, the Netherlands; Minds.ai, Inc., Santa Cruz, CA 95060, USA""]","[""Spain; Japan"", ""Japan"", ""Japan"", ""Netherlands"", ""Netherlands; USA""]",Spain; Japan
63,2501.12444,"[""Ashley P. Tarrant"", ""Jason T. Hinkle"", ""Benjamin J. Shappee"", ""Christopher S. Kochanek"", ""Daniel R. Hey"", ""Connor Auge"", ""Anna V. Payne"", ""Michael J. Bolish"", ""Heechan Yuk"", ""Xinyu Dai"", ""Katie Auchettl"", ""Todd A. Thompson"", ""Helena Treiber""]","[""Department of Astronomy, Ohio State University, 140 W. 18th Ave, Columbus, OH 43210; Department of Physics, Ohio State University, 191 W. Woodruff Ave, Columbus, OH 43210"", ""Institute for Astronomy, University of Hawai'i, 2680 Woodlawn Dr, Honolulu, HI 96822; NASA FINESST FI"", ""Institute for Astronomy, University of Hawai'i, 2680 Woodlawn Dr, Honolulu, HI 96822"", ""Department of Astronomy, Ohio State University, 140 W. 18th Ave, Columbus, OH 43210; Center for Cosmology and Astro-Particle Physics, Ohio State University, 140 W. 18th Ave, Columbus, OH 43210"", ""Institute for Astronomy, University of Hawai'i, 2680 Woodlawn Dr, Honolulu, HI 96822"", ""Eureka Scientific, 2452 Delmer Street, Suite 100, Oakland, CA 94602-3017"", ""Space Telescope Science Institute, 3700 San Martin Drive, Baltimore, MD 21218"", ""Institute for Astronomy, University of Hawai'i, 2680 Woodlawn Dr, Honolulu, HI 96822"", ""Homer L. Dodge Department of Physics and Astronomy, University of Oklahoma, 440 W. Brooks St., Norman, OK 73019"", ""Homer L. Dodge Department of Physics and Astronomy, University of Oklahoma, 440 W. Brooks St., Norman, OK 73019"", ""School of Physics, The University of Melbourne, Parkville, VIC 3010, Australia; Department of Astronomy and Astrophysics, University of California, Santa Cruz, CA, 95064, USA"", ""Department of Astronomy, Ohio State University, 140 W. 18th Ave, Columbus, OH 43210; Center for Cosmology and Astro-Particle Physics, Ohio State University, 140 W. 18th Ave, Columbus, OH 43210"", ""Department of Astrophysical Sciences, Princeton University, 4 Ivy Lane, Princeton, NJ 08544""]","[""USA; USA"", ""USA; USA"", ""USA"", ""USA; USA"", ""USA"", ""USA"", ""USA"", ""USA"", ""USA"", ""USA"", ""Australia; USA"", ""USA; USA"", ""USA""]",USA
