original_index,arxiv_id,extracted_authors,extracted_affiliations,extracted_countries,first_author_country
77,2501.12460,"[""Jun-Qiang Lu"", ""Lu-Lu Fan"", ""Min-Xuan Cai"", ""Shao-Han Wang"", ""Bing-Xue Fu"", ""Xu Kong"", ""Qing-Feng Zhu""]","[""Department of Astronomy, University of Science and Technology of China, Hefei 230026, China; School of Astronomy and Space Science, University of Science and Technology of China, Hefei 230026, China"", ""Department of Astronomy, University of Science and Technology of China, Hefei 230026, China; School of Astronomy and Space Science, University of Science and Technology of China, Hefei 230026, China; Institute of Deep Space Sciences, Deep Space Exploration Laboratory, Hefei 230026, China"", ""Department of Astronomy, University of Science and Technology of China, Hefei 230026, China; School of Astronomy and Space Science, University of Science and Technology of China, Hefei 230026, China"", ""Department of Astronomy, University of Science and Technology of China, Hefei 230026, China; School of Astronomy and Space Science, University of Science and Technology of China, Hefei 230026, China"", ""Department of Astronomy, University of Science and Technology of China, Hefei 230026, China; School of Astronomy and Space Science, University of Science and Technology of China, Hefei 230026, China"", ""Department of Astronomy, University of Science and Technology of China, Hefei 230026, China; School of Astronomy and Space Science, University of Science and Technology of China, Hefei 230026, China; Institute of Deep Space Sciences, Deep Space Exploration Laboratory, Hefei 230026, China"", ""Department of Astronomy, University of Science and Technology of China, Hefei 230026, China; School of Astronomy and Space Science, University of Science and Technology of China, Hefei 230026, China""]","[""China; China"", ""China; China; China"", ""China; China"", ""China; China"", ""China; China"", ""China; China; China"", ""China; China""]",China
78,2501.12458,"[""Neslihan Alan"", ""Fahri Ali\u00e7avu\u015f"", ""Mehmet Alpsoy""]","[""Fatih Sultan Mehmet Vakif University, Department of History of Science, 34664, Istanbul, Turkiye"", ""Canakkale Onsekiz Mart University, Faculty of Science, Department of Physics, 17100, Canakkale, Turkiye; Canakkale Onsekiz Mart University, Astrophysics Research Center and Ulup\u0131nar Observatory, 17100, Canakkale, Turkiye"", ""Akdeniz University, Institute of Graduate Studies in Science, Department of Space Sciences and Technologies, 07258, Antalya, Turkiye""]","[""Turkiye"", ""Turkiye; Turkiye"", ""Turkiye""]",Turkiye
79,2501.12449,"[""F. Vito"", ""W. N. Brandt"", ""A. Comastri"", ""R. Gilli"", ""F. Bauer"", ""S. Belladitta"", ""G. Chartas"", ""K. Iwasawa"", ""G. Lanzuisi"", ""B. Luo"", ""S. Marchesi"", ""M. Mignoli"", ""F. Ricci"", ""O. Shemmer"", ""C. Spingola"", ""C. Vignali"", ""W. Boschin"", ""F. Cusano"", ""D. Paris""]","[""INAF -- Osservatorio di Astrofisica e Scienza dello Spazio di Bologna, Via Gobetti 93/3, I-40129 Bologna, Italy"", ""Department of Astronomy & Astrophysics, 525 Davey Lab, The Pennsylvania State University, University Park, PA 16802, USA; Institute for Gravitation and the Cosmos, The Pennsylvania State University, University Park, PA 16802, USA; Department of Physics, The Pennsylvania State University, University Park, PA 16802, USA"", ""INAF -- Osservatorio di Astrofisica e Scienza dello Spazio di Bologna, Via Gobetti 93/3, I-40129 Bologna, Italy"", ""INAF -- Osservatorio di Astrofisica e Scienza dello Spazio di Bologna, Via Gobetti 93/3, I-40129 Bologna, Italy"", ""Instituto de Astrof\u00edsica, Facultad de F\u00edsica, Pontificia Universidad Cat\u00f3lica de Chile, Campus San Joaqu\u00edn, Av. Vicu\u00f1a Mackenna 4860, Macul Santiago, Chile, 7820436; Centro de Astroingenier\u00eda, Facultad de F\u00edsica, Pontificia Universidad Cat\u00f3lica de Chile, Campus San Joaqu\u00edn, Av. Vicu\u00f1a Mackenna 4860, Macul Santiago, Chile, 7820436; Millennium Institute of Astrophysics, Nuncio Monse\u00f1or S\u00f3tero Sanz 100, Of 104, Providencia, Santiago, Chile; Space Science Institute, 4750 Walnut Street, Suite 205, Boulder, Colorado 80301"", ""Max Planck Institut f\u00fcr Astronomie, K\u00f6nigstuhl 17, D-69117, Heidelberg, Germany; INAF -- Osservatorio di Astrofisica e Scienza dello Spazio di Bologna, Via Gobetti 93/3, I-40129 Bologna, Italy"", ""Department of Physics and Astronomy, College of Charleston, Charleston, SC 29424, USA"", ""Institut de Ci\u00e8ncies del Cosmos (ICCUB), Universitat de Barcelona (IEEC-UB), Mart\u00ed i Franqu\u00e8s, 1, 08028 Barcelona, Spain; ICREA, Pg. Llu\u00eds Companys 23, 08010 Barcelona, Spain"", ""INAF -- Osservatorio di Astrofisica e Scienza dello Spazio di Bologna, Via Gobetti 93/3, I-40129 Bologna, Italy"", ""School of Astronomy and Space Science, Nanjing University, Nanjing 210093, PR China; Key Laboratory of Modern Astronomy and Astrophysics, Nanjing University, Ministry of Education, Nanjing, Jiangsu 210093, PR China"", ""Dipartimento di Fisica e Astronomia (DIFA), Universit\u00e0 di Bologna, via Gobetti 93/2, I-40129 Bologna, Italy; Department of Physics and Astronomy, Clemson University, Kinard Lab of Physics, Clemson, SC 29634, USA; INAF -- Osservatorio di Astrofisica e Scienza dello Spazio di Bologna, Via Gobetti 93/3, I-40129 Bologna, Italy"", ""INAF -- Osservatorio di Astrofisica e Scienza dello Spazio di Bologna, Via Gobetti 93/3, I-40129 Bologna, Italy"", ""Dipartimento di Matematica e Fisica, Universit\u00e1 Roma Tre, Via della Vasca Navale 84, I-00146 Roma, Italy; INAF -- Osservatorio Astronomico di Roma, via di Frascati 33, 00078 Monte Porzio Catone, Italy"", ""Department of Physics, University of North Texas, Denton, TX 76203, USA"", ""INAF -- Istituto di Radioastronomia, via Gobetti 101, I-40129 Bologna, Italy"", ""Dipartimento di Fisica e Astronomia (DIFA), Universit\u00e0 di Bologna, via Gobetti 93/2, I-40129 Bologna, Italy; INAF -- Osservatorio di Astrofisica e Scienza dello Spazio di Bologna, Via Gobetti 93/3, I-40129 Bologna, Italy"", ""Fundaci\u00f3n Galileo Galilei \u2013 INAF (Telescopio Nazionale Galileo), Rambla Jos\u00e9 Ana Fern\u00e1ndez Perez 7, 38712 Bre\u00f1a Baja (La Palma), Canary Islands, Spain; Instituto de Astrof\u00edsica de Canarias, C/V\u00eda L\u00e1ctea s/n, E-38205 La Laguna (Tenerife), Canary Islands, Spain; Departamento de Astrof\u00edsica, Univ. de La Laguna, Av. del Astrof\u00edsico Francisco S\u00e1nchez s/n, E-38205 La Laguna (Tenerife), Canary Islands, Spain"", ""INAF -- Osservatorio di Astrofisica e Scienza dello Spazio di Bologna, Via Gobetti 93/3, I-40129 Bologna, Italy"", ""INAF -- Osservatorio Astronomico di Roma, via di Frascati 33, 00078 Monte Porzio Catone, Italy""]","[""Italy"", ""USA"", ""Italy"", ""Italy"", ""Chile; USA"", ""Germany; Italy"", ""USA"", ""Spain"", ""Italy"", ""China"", ""Italy; USA"", ""Italy"", ""Italy"", ""USA"", ""Italy"", ""Italy"", ""Spain"", ""Italy"", ""Italy""]",Italy
80,2501.12448,"[""Andrew Chael""]","[""Princeton Gravity Initiative, Princeton University, Princeton NJ, 08540""]","[""United States""]",United States
81,2501.12439,"[""Giulia Despali"", ""Lauro Moscardini"", ""Dylan Nelson"", ""Annalisa Pillepich"", ""Volker Springel"", ""Mark Vogelsberger""]","[""Dipartimento di Fisica e Astronomia \""Augusto Righi\"", Alma Mater Studiorum Universit\u00e0 di Bologna, via Gobetti 93/2, I-40129 Bologna, Italy; INAF-Osservatorio di Astrofisica e Scienza dello Spazio di Bologna, Via Piero Gobetti 93/3, I-40129 Bologna, Italy; INFN-Sezione di Bologna, Viale Berti Pichat 6/2, I-40127 Bologna, Italy"", ""Dipartimento di Fisica e Astronomia \""Augusto Righi\"", Alma Mater Studiorum Universit\u00e0 di Bologna, via Gobetti 93/2, I-40129 Bologna, Italy; INAF-Osservatorio di Astrofisica e Scienza dello Spazio di Bologna, Via Piero Gobetti 93/3, I-40129 Bologna, Italy; INFN-Sezione di Bologna, Viale Berti Pichat 6/2, I-40127 Bologna, Italy"", ""Universit\u00e4t Heidelberg, Zentrum f\u00fcr Astronomie, ITA, Albert-Ueberle-Str. 2, 69120 Heidelberg, Germany"", ""Max-Planck-Institut f\u00fcr Astronomie, K\u00f6nigstuhl 17, 69117 Heidelberg, Germany"", ""Max-Planck-Institut f\u00fcr Astrophysik, Karl-Schwarzschild-Stra\u00dfe 1, D-85740, Garching bei M\u00fcnchen, Germany"", ""Department of Physics, Kavli Institute for Astrophysics and Space Research, Massachusetts Institute of Technology, Cambridge, MA 02139, USA""]","[""Italy; Italy; Italy"", ""Italy; Italy; Italy"", ""Germany"", ""Germany"", ""Germany"", ""USA""]",Italy
82,2501.12026,"[""Nguyen Chau Giang"", ""V. J. M. Le Gouellec"", ""Thiem Hoang"", ""A. J. Maury"", ""P. Hennebelle""]","[""Korea Astronomy and Space Science Institute, Daejeon 34055, Republic of Korea; Department of Astronomy and Space Science, University of Science and Technology, 217 Gajeong-ro, Yuseong-gu, Daejeon, 34113, Republic of Korea"", ""NASA Ames Research Center, Space Science and Astrobiology Division M.S. 245-6 Moffett Field, CA 94035, US; NASA Postdoctoral Program Fellow"", ""Korea Astronomy and Space Science Institute, Daejeon 34055, Republic of Korea; Department of Astronomy and Space Science, University of Science and Technology, 217 Gajeong-ro, Yuseong-gu, Daejeon, 34113, Republic of Korea"", ""Institute of Space Sciences (ICE), CSIC, Campus UAB, Barcelona, Spain; ICREA, Pg. Llu\u00eds Companys 23, Barcelona, Spain"", ""AIM, CEA, CNRS, Universit\u00e9 Paris-Saclay, Universit\u00e9 Paris Diderot, Sorbonne Paris Cit\u00e9, F-91191 Gif-sur-Yvette, France""]","[""Republic of Korea; Republic of Korea"", ""US; US"", ""Republic of Korea; Republic of Korea"", ""Spain; Spain"", ""France""]",Republic of Korea
83,2501.13147,"[""H. Treiber"", ""G. Vasilopoulos"", ""C. D. Bailyn"", ""F. Haberl"", ""A. Udalski""]","[""Department of Astronomy, Yale University, PO Box 208101, New Haven, CT 06520-8101, USA; Department of Physics and Astronomy, Amherst College, C025 New Science Center, 25 East Dr., Amherst, MA 01002-5000, USA; Department of Astrophysical Sciences, Princeton University, 4 Ivy Lane, Princeton, NJ 08544, USA"", ""Department of Physics, National and Kapodistrian University of Athens, University Campus Zografos, GR 15784, Athens, Greece; Institute of Accelerating Systems & Applications, University Campus Zografos, Athens, Greece"", ""Department of Astronomy, Yale University, PO Box 208101, New Haven, CT 06520-8101, USA"", ""Max-Planck-Institut f\u00fcr extraterrestrische Physik, Gie\u00dfenbachstra\u00dfe 1, D-85748 Garching, Germany"", ""Astronomical Observatory, University of Warsaw, Al. Ujazdowskie 4, 00-478, Warszawa, Poland""]","[""USA; USA; USA"", ""Greece; Greece"", ""USA"", ""Germany"", ""Poland""]",USA
84,2501.13149,"[""Jenny Wagner"", ""David Benisty""]","[""Helsinki Institute of Physics, P.O. Box 64, FI-00014 University of Helsinki, Finland; Academia Sinica Institute of Astronomy and Astrophysics, 11F of AS/NTU Astronomy-Mathematics Building, No.1, Sec.~4, Roosevelt Rd, Taipei 106216, Taiwan, R.O.C; Bahamas Advanced Study Institute and Conferences, 4A Ocean Heights, Hill View Circle, Stella Maris, Long Island, The Bahamas"", ""Leibniz-Institut f\u00fcr Astrophysik Potsdam (AIP), An der Sternwarte 16, 14482 Potsdam, Germany""]","[""Finland; Taiwan; The Bahamas"", ""Germany""]",Finland; Taiwan; The Bahamas
86,2501.14019,"[""C. Giocoli"", ""G. Despali"", ""M. Meneghetti"", ""E. Rasia"", ""L. Moscardini"", ""S. Borgani"", ""G. F. Lesci"", ""F. Marulli"", ""W. Cui"", ""G. Yepes""]","[""INAF-Osservatorio di Astrofisica e Scienza dello Spazio di Bologna, Via Piero Gobetti 93/3, 40129 Bologna, Italy; INFN -- Sezione di Bologna, viale Berti Pichat 6/2, I-40127 Bologna, Italy"", ""Dipartimento di Fisica e Astronomia \""Augusto Righi\"", Alma Mater Studiorum Universit\u00e0 di Bologna, via Gobetti 93/2, I-40129 Bologna, Italy; INAF-Osservatorio di Astrofisica e Scienza dello Spazio di Bologna, Via Piero Gobetti 93/3, 40129 Bologna, Italy; INFN -- Sezione di Bologna, viale Berti Pichat 6/2, I-40127 Bologna, Italy"", ""INAF-Osservatorio di Astrofisica e Scienza dello Spazio di Bologna, Via Piero Gobetti 93/3, 40129 Bologna, Italy; INFN -- Sezione di Bologna, viale Berti Pichat 6/2, I-40127 Bologna, Italy"", ""INAF -- Osservatorio Astronomico di Trieste, via Tiepolo 11, I-34131, Trieste, Italy; IFPU, Institute for Fundamental Physics of the Universe, Via Beirut 2, 34014 Trieste, Italy; Department of Physics; University of Michigan, Ann Arbor, MI 48109, USA"", ""Dipartimento di Fisica e Astronomia \""Augusto Righi\"", Alma Mater Studiorum Universit\u00e0 di Bologna, via Gobetti 93/2, I-40129 Bologna, Italy; INAF-Osservatorio di Astrofisica e Scienza dello Spazio di Bologna, Via Piero Gobetti 93/3, 40129 Bologna, Italy; INFN -- Sezione di Bologna, viale Berti Pichat 6/2, I-40127 Bologna, Italy"", ""Dipartimento di Fisica, Universit\u00e0 di Trieste, Sez. di Astronomia, via Tiepolo 11, I-34131 Trieste, Italy; INAF -- Osservatorio Astronomico di Trieste, via Tiepolo 11, I-34131, Trieste, Italy; IFPU, Institute for Fundamental Physics of the Universe, Via Beirut 2, 34014 Trieste, Italy; ICSC - Italian Research Center on High Performance Computing, Big Data and Quantum Computing, via Magnanelli 2, 40033, Casalecchio di Reno, Italy; INFN -- Instituto Nazionale di Fisica Nucleare, Via Valerio 2, I-34127, Trieste, Italy"", ""Dipartimento di Fisica e Astronomia \""Augusto Righi\"", Alma Mater Studiorum Universit\u00e0 di Bologna, via Gobetti 93/2, I-40129 Bologna, Italy; INAF-Osservatorio di Astrofisica e Scienza dello Spazio di Bologna, Via Piero Gobetti 93/3, 40129 Bologna, Italy"", ""Dipartimento di Fisica e Astronomia \""Augusto Righi\"", Alma Mater Studiorum Universit\u00e0 di Bologna, via Gobetti 93/2, I-40129 Bologna, Italy; INAF-Osservatorio di Astrofisica e Scienza dello Spazio di Bologna, Via Piero Gobetti 93/3, 40129 Bologna, Italy; INFN -- Sezione di Bologna, viale Berti Pichat 6/2, I-40127 Bologna, Italy"", ""Departamento de F\u00edsica Te\u00f3rica, M\u00f3dulo 15, Facultad de Ciencias, Universidad Aut\u00f3noma de Madrid, E-28049, Madrid, Spain; Centro de Investigaci\u00f3n Avanzada en F\u00edsica Fundamental (CIAFF), Facultad de Ciencias, Universidad Aut\u00f3noma de Madrid, E-28049, Madrid, Spain; Institute for Astronomy, University of Edinburgh, Royal Observatory, Edinburgh EH9 3HJ, UK"", ""Departamento de F\u00edsica Te\u00f3rica, M\u00f3dulo 15, Facultad de Ciencias, Universidad Aut\u00f3noma de Madrid, E-28049, Madrid, Spain; Centro de Investigaci\u00f3n Avanzada en F\u00edsica Fundamental (CIAFF), Facultad de Ciencias, Universidad Aut\u00f3noma de Madrid, E-28049, Madrid, Spain""]","[""Italy"", ""Italy"", ""Italy"", ""Italy; USA"", ""Italy"", ""Italy"", ""Italy"", ""Italy"", ""Spain; UK"", ""Spain""]",Italy
87,2501.14016,"[""Louis-Philippe Coulombe"", ""Michael Radica"", ""Bj\u00f6rn Benneke"", ""\u00c9lyse D'Aoust"", ""Lisa Dang"", ""Nicolas B. Cowan"", ""Vivien Parmentier"", ""Lo\u00efc Albert"", ""David Lafreni\u00e8re"", ""Jake Taylor"", ""Pierre-Alexis Roy"", ""Stefan Pelletier"", ""Romain Allart"", ""\u00c9tienne Artigau"", ""Ren\u00e9 Doyon"", ""Ray Jayawardhana"", ""Doug Johnstone"", ""Lisa Kaltenegger"", ""Adam B. Langeveld"", ""Ryan J. MacDonald"", ""Jason F. Rowe"", ""Jake D. Turner""]","[""Department of Physics, Universit\u00e9 de Montr\u00e9al, Montr\u00e9al, QC, Canada; Trottier Institute for Research on Exoplanets, Montr\u00e9al, QC, Canada"", ""Department of Physics, Universit\u00e9 de Montr\u00e9al, Montr\u00e9al, QC, Canada; Trottier Institute for Research on Exoplanets, Montr\u00e9al, QC, Canada"", ""Department of Physics, Universit\u00e9 de Montr\u00e9al, Montr\u00e9al, QC, Canada; Trottier Institute for Research on Exoplanets, Montr\u00e9al, QC, Canada; Department of Earth, Planetary, and Space Sciences, University of California, Los Angeles, Los Angeles, CA, USA"", ""Trottier Institute for Research on Exoplanets, Montr\u00e9al, QC, Canada; Department of Physics, University of Ottawa, Ottawa, ON, Canada"", ""Department of Physics, Universit\u00e9 de Montr\u00e9al, Montr\u00e9al, QC, Canada; Trottier Institute for Research on Exoplanets, Montr\u00e9al, QC, Canada"", ""Department of Physics, McGill University, Montr\u00e9al, QC, Canada; Department of Earth & Planetary Sciences, McGill University, Montr\u00e9al, QC, Canada; Trottier Institute for Research on Exoplanets, Montr\u00e9al, QC, Canada"", ""Universit\u00e9 C\u00f4te d'Azur, Observatoire de la C\u00f4te d'Azur, CNRS, Laboratoire Lagrange, Nice, France"", ""Department of Physics, Universit\u00e9 de Montr\u00e9al, Montr\u00e9al, QC, Canada; Trottier Institute for Research on Exoplanets, Montr\u00e9al, QC, Canada"", ""Department of Physics, Universit\u00e9 de Montr\u00e9al, Montr\u00e9al, QC, Canada; Trottier Institute for Research on Exoplanets, Montr\u00e9al, QC, Canada"", ""Department of Physics, University of Oxford, Oxford, Oxfordshire, UK; Trottier Institute for Research on Exoplanets, Montr\u00e9al, QC, Canada"", ""Department of Physics, Universit\u00e9 de Montr\u00e9al, Montr\u00e9al, QC, Canada; Trottier Institute for Research on Exoplanets, Montr\u00e9al, QC, Canada"", ""Department of Physics, Universit\u00e9 de Montr\u00e9al, Montr\u00e9al, QC, Canada; Trottier Institute for Research on Exoplanets, Montr\u00e9al, QC, Canada"", ""Department of Physics, Universit\u00e9 de Montr\u00e9al, Montr\u00e9al, QC, Canada; Trottier Institute for Research on Exoplanets, Montr\u00e9al, QC, Canada"", ""Department of Physics, Universit\u00e9 de Montr\u00e9al, Montr\u00e9al, QC, Canada; Trottier Institute for Research on Exoplanets, Montr\u00e9al, QC, Canada"", ""Department of Physics, Universit\u00e9 de Montr\u00e9al, Montr\u00e9al, QC, Canada; Trottier Institute for Research on Exoplanets, Montr\u00e9al, QC, Canada"", ""Carl Sagan Institute and Department of Astronomy, Cornell University, Ithaca, NY, USA"", ""NRC Herzberg Astronomy and Astrophysics, Victoria, BC, Canada; Department of Physics and Astronomy, University of Victoria, Victoria, BC, Canada"", ""Carl Sagan Institute and Department of Astronomy, Cornell University, Ithaca, NY, USA"", ""Carl Sagan Institute and Department of Astronomy, Cornell University, Ithaca, NY, USA; Department of Physics and Astronomy, Johns Hopkins University, Baltimore, MD, USA"", ""Department of Astronomy, University of Michigan, Ann Arbor, MI, USA"", ""Department of Physics and Astronomy, Bishop's University, Sherbrooke, QC, Canada; Trottier Institute for Research on Exoplanets, Montr\u00e9al, QC, Canada"", ""Carl Sagan Institute and Department of Astronomy, Cornell University, Ithaca, NY, USA""]","[""Canada; Canada"", ""Canada; Canada"", ""Canada; Canada; USA"", ""Canada; Canada"", ""Canada; Canada"", ""Canada; Canada; Canada"", ""France"", ""Canada; Canada"", ""Canada; Canada"", ""UK; Canada"", ""Canada; Canada"", ""Canada; Canada"", ""Canada; Canada"", ""Canada; Canada"", ""Canada; Canada"", ""USA"", ""Canada; Canada"", ""USA"", ""USA; USA"", ""USA"", ""Canada; Canada"", ""USA""]",Canada
88,2501.13937,"[""Susmita Das"", ""L\u00e1szl\u00f3 Moln\u00e1r"", ""R\u00f3bert Szab\u00f3"", ""Harinder P. Singh"", ""Shashi M. Kanbur"", ""Anupam Bhardwaj"", ""Marcella Marconi"", ""Radoslaw Smolec""]","[""Konkoly Observatory, HUN-REN Research Centre for Astronomy and Earth Sciences, Konkoly-Thege Mikl\u00f3s \u00fat 15-17, H-1121, Budapest, Hungary; CSFK, MTA Centre of Excellence, Budapest, Konkoly Thege Mikl\u00f3s \u00fat 15-17., H-1121, Hungary; Inter-University Center for Astronomy and Astrophysics (IUCAA), Post Bag 4, Ganeshkhind, Pune 411007, India"", ""Konkoly Observatory, HUN-REN Research Centre for Astronomy and Earth Sciences, Konkoly-Thege Mikl\u00f3s \u00fat 15-17, H-1121, Budapest, Hungary; CSFK, MTA Centre of Excellence, Budapest, Konkoly Thege Mikl\u00f3s \u00fat 15-17., H-1121, Hungary; ELTE E\u00f6tv\u00f6s Lor\u00e1nd University, Institute of Physics and Astronomy, 1117, P\u00e1zm\u00e1ny P\u00e9ter s\u00e9t\u00e1ny 1/A, Budapest, Hungary"", ""Konkoly Observatory, HUN-REN Research Centre for Astronomy and Earth Sciences, Konkoly-Thege Mikl\u00f3s \u00fat 15-17, H-1121, Budapest, Hungary; CSFK, MTA Centre of Excellence, Budapest, Konkoly Thege Mikl\u00f3s \u00fat 15-17., H-1121, Hungary; ELTE E\u00f6tv\u00f6s Lor\u00e1nd University, Institute of Physics and Astronomy, 1117, P\u00e1zm\u00e1ny P\u00e9ter s\u00e9t\u00e1ny 1/A, Budapest, Hungary"", ""Department of Physics & Astrophysics, University of Delhi, Delhi 110007, India"", ""Department of Physics, State University of New York Oswego, Oswego, NY 13126, USA"", ""Inter-University Center for Astronomy and Astrophysics (IUCAA), Post Bag 4, Ganeshkhind, Pune 411007, India"", ""INAF-Osservatorio Astronomico di Capodimonte, Salita Moiariello 16, 80131, Naples, Italy"", ""Nicolaus Copernicus Astronomical Center, Polish Academy of Sciences, Bartycka 18, PL-00-716 Warsaw, Poland""]","[""Hungary; Hungary; India"", ""Hungary; Hungary; Hungary"", ""Hungary; Hungary; Hungary"", ""India"", ""USA"", ""India"", ""Italy"", ""Poland""]",Hungary; India
89,2501.13931,"[""Jo\u00e3o Alves"", ""Marco Lombardi"", ""Charles J. Lada""]","[""University of Vienna, Department of Astrophysics, T\u00fcrkenschanzstrasse 17, 1180 Vienna, Austria"", ""University of Milan, Department of Physics, via Celoria 16, I-20133, Milan, Italy"", ""Harvard-Smithsonian Center for Astrophysics, Mail Stop 72, 60 Garden Street, Cambridge, MA 02138, USA""]","[""Austria"", ""Italy"", ""USA""]",Austria
90,2501.13929,"[""Janosz W. Dewberry"", ""Yanqin Wu""]","[""Canadian Institute for Theoretical Astrophysics, 60 St. George Street, Toronto, ON M5S 3H8, Canada"", ""Department of Astronomy & Astrophysics, University of Toronto, Canada""]","[""Canada"", ""Canada""]",Canada
