title,pdf_link
Testing the Hypothesis that the Quasar J0950+5128 Harbors a Supermassive Black Hole Binary,arxiv.org/pdf/2505.06221
Isotropy Test with Quasars Using Method of Smoothed Residuals,arxiv.org/pdf/2505.07439
Modeling the Multiwavelength Emission of 3C 279 during the 14 years of Fermi-LAT Era,arxiv.org/pdf/2507.03913
The Influence of Magnetic Fields on Second-Generation Star Formation in Globular Clusters,arxiv.org/pdf/2507.12528
Illuminating Dark Energy with Bright Standard Sirens from Future Detectors,arxiv.org/pdf/2507.06340
Large Cold Dust Reservoir Revealed in Transitional SN Ib 2014C by James Webb Space Telescope Mid-Infrared Spectroscopy,arxiv.org/pdf/2504.14009
The SPHEREx Target List of Ice Sources (SPLICES),arxiv.org/pdf/2501.17797
Stellar properties indicating the presence of hyperons in neutron stars,arxiv.org/pdf/2507.10372
Classification of HI Galaxy Profiles Using Unsupervised Learning and Convolutional Neural Networks: A Comparative Analysis and Methodological Cases of Studies,arxiv.org/pdf/2501.11657
"OpenUniverse2024: A shared, simulated view of the sky for the next generation of cosmological surveys",arxiv.org/pdf/2501.05632
Einstein Probe Discovery of EP J182730.0-095633: A New Black Hole X-ray Binary Candidate in Faint Outburst?,arxiv.org/pdf/2507.12876
Tracing high-z Galaxies in X-rays with JWST and Chandra,arxiv.org/pdf/2502.09705
The role of Trees of Fragmenting Granules (TFG) in the formation of the solar supergranular pattern from Hinode observations,arxiv.org/pdf/2503.09161
Revealing the baryon cycle in Galaxy Clusters: connecting galaxy dynamics and gas thermodynamics using (sub-)mm-wave and optical IFU surveys,arxiv.org/pdf/2512.14238
ALMAGAL I. The ALMA evolutionary study of high-mass protocluster formation in the Galaxy. Presentation of the survey and early results,arxiv.org/pdf/2503.05555
Earliest Galaxy Evolution in the CANUCS+Technicolor fields: Galaxy Properties at $z\sim10-16$ seen with the Full NIRCam Medium and Broad Band Filters,arxiv.org/pdf/2507.03124
High angular resolution evidence of dust traps from deep ALMA Band 3 observations of LkCa15,arxiv.org/pdf/2503.03336
A Search for Astrophysical Neutrinos from Flaring X-ray Binaries with IceCube,arxiv.org/pdf/2507.06807
VHE $γ$-ray observations of bright BL Lacs with the Large-Sized Telescope prototype (LST-1) of the CTAO,arxiv.org/pdf/2510.03702
Superfluid Dark Matter,arxiv.org/pdf/2505.23900
The AGEL Survey Data Release 2: A Gravitational Lens Sample for Galaxy Evolution and Cosmology,arxiv.org/pdf/2503.08041
The Telescope Calibration of the Imaging X-ray Polarimetry Explorer,arxiv.org/pdf/2505.00851
Stellar CoRGI in MaNGA: Stellar Counter-Rotation Galaxies Identified in MaNGA Survey,arxiv.org/pdf/2504.02925
The CIELO Project: The Chemo-dynamical properties of gaLaxies and the cosmic web,arxiv.org/pdf/2501.05978
Alleviating the Hubble tension with Torsion Condensation (TorC),arxiv.org/pdf/2507.09228
Sagittarius A* near-infrared flares polarization as a probe of space-time I: Non-rotating exotic compact objects,arxiv.org/pdf/2506.23931
Convolutional Autoencoders for Data Compression and Anomaly Detection in Small Satellite Technologies,arxiv.org/pdf/2505.00040
Coronal and chromospheric activity of Teegarden's star,arxiv.org/pdf/2504.02338
The properties of X-ray selected AGN in protoclusters pinpointed by Enormous Lya Nebulae,arxiv.org/pdf/2507.03078
The Bayesian Global Sky Model (B-GSM): A Calibrated Low Frequency Sky Model for EoR Applications,arxiv.org/pdf/2504.04503
Giant Outer Transiting Exoplanet Mass (GOTEM) Survey.VII. TOI-6041: a multi-planet system including a warm Neptune exhibiting strong TTVs,arxiv.org/pdf/2512.01911
Specification for the Siril HEALpixel Catalog Format,arxiv.org/pdf/2501.12466
On the effects of radiation on mass transfer in binary stars,arxiv.org/pdf/2505.10616
Sensitivity of BEACON to Ultra-High Energy Diffuse and Transient Neutrinos,arxiv.org/pdf/2504.13271
Satellite Underflight Utility for Thermal Sensor Harmonization,arxiv.org/pdf/2510.20248
Constraints on Neutrino Physics from DESI DR2 BAO and DR1 Full Shape,arxiv.org/pdf/2503.14744
A Hybrid Algorithm for Drift-Kinetic Particle Dynamics within General Relativistic Magnetohydrodynamics Simulations of Black Holes Accretion Flows,arxiv.org/pdf/2507.11616
Multiplicity of young isolated planetary mass objects in Taurus and Upper Scorpius,arxiv.org/pdf/2506.14380
The final WaZP galaxy cluster catalog of the Dark Energy Survey and comparison with SZE data,arxiv.org/pdf/2507.05360
Clues for Solar System Formation from Meteorites and their Parent Bodies,arxiv.org/pdf/2506.02721
A Machine Learning-Ready Data Processing Tool for Near Real-Time Forecasting,arxiv.org/pdf/2502.08555
XRISM insights for interstellar Sulfur,arxiv.org/pdf/2506.08751
An updated list of target sources for IceCube neutrino cluster alerts,arxiv.org/pdf/2507.06312
"Asteroseismology of the G8 subgiant beta Aquilae with SONG-Tenerife, SONG-Australia and TESS",arxiv.org/pdf/2506.00493
Designing a Potential NASA Fermi Orbit Change,arxiv.org/pdf/2505.15732
"A 43 day transiting Neptune and two 25 day Saturns from TESS, NGTS and ASTEP",arxiv.org/pdf/2512.07716
Freeze-out and spectral running of primordial gravitational waves in viscous cosmology,arxiv.org/pdf/2512.04011
21 years of Astronomy at Warwick: celebrating the legacy of Prof. Tom Marsh,arxiv.org/pdf/2504.20954
SYMPHANY- SYnergy of Molecular PHase And Neutral hYdrogen in galaxies in A2626,arxiv.org/pdf/2505.15060
From Redshift to Real Space: Combining Linear Theory With Neural Networks,arxiv.org/pdf/2507.11462
Developments on LLNL's high contrast testbed and Lick/ShaneAO,arxiv.org/pdf/2508.11114
Comprehensive Radio Monitoring of the Black Hole X-ray Binary Swift J1727.8$-$1613 during its 2023$-$2024 Outburst,arxiv.org/pdf/2506.07798
The search for dark matter axions from neutron stars in the inner parsecs of the Milky Way with AtLAST,arxiv.org/pdf/2512.13861
Spectropolarimetric Evolution of SN 2023ixf: an Asymmetric Explosion in a Confined Aspherical Circumstellar Medium,arxiv.org/pdf/2505.03975
Polarization aberration modeling of internal occulters for coronagraphs,arxiv.org/pdf/2508.19397
A method for statistical research on binary stars using radial velocities,arxiv.org/pdf/2502.18577
Signal Model and Energy Reconstruction for the Radio Detection of Inclined Air Showers in the 50-200 MHz Frequency Band,arxiv.org/pdf/2507.06698
Euclid Quick Data Release (Q1): First visual morphology catalogue,arxiv.org/pdf/2503.15310
\texttt{BrahMap}: A scalable and modular map-making framework for the CMB experiments,arxiv.org/pdf/2501.16122
Surface brightness-colour relations of Cepheids calibrated by optical interferometry,arxiv.org/pdf/2504.13581
Neural Deprojection of Galaxy Stellar Mass Profiles,arxiv.org/pdf/2511.20746
ASKAP and VLASS search for a radio-continuum counterpart of ultra-high-energy neutrino event KM3-230213A,arxiv.org/pdf/2503.09108
Photometric Redshift Estimation for Rubin Observatory Data Preview 1 with Redshift Assessment Infrastructure Layers (RAIL),arxiv.org/pdf/2510.07370
A multi-frequency global view of Callisto's thermal properties from ALMA,arxiv.org/pdf/2507.12671
"MIRI-LRS spectrum of a cold exoplanet around a white dwarf: water, ammonia, and methane measurements",arxiv.org/pdf/2503.04531
SN 2024aecx: A double-peaked rapidly evolving Type IIb supernova at 11 Mpc,arxiv.org/pdf/2505.19831
Evidence for Hydrostatic Equilibrium in the Extragalactic Molecular Clouds of M31,arxiv.org/pdf/2506.06118
Bilateral collaboration between Mexico and the United Kingdom for the construction of technical equipment (CHARM) for the Large Millimeter Telescope (LMT/GTM),arxiv.org/pdf/2506.11489
Multi-Model Framework for Reconstructing Gamma-Ray Burst Light Curves,arxiv.org/pdf/2506.23681
Bayesian reconstruction of primordial perturbations from induced gravitational waves,arxiv.org/pdf/2505.22534
"Asteroseismology of WD J004917.14-252556.81, the Most Massive Pulsating White Dwarf",arxiv.org/pdf/2505.17177
The Potential of the SPHEREx Mission for Characterizing PAH 3.3 μm Emission in Nearby Galaxies,arxiv.org/pdf/2503.21876
Simulation based inference of the ionization history from the 2D 21 cm power spectrum,arxiv.org/pdf/2508.16329
Deep survey of millimeter RRLs towards the planetary nebulae IC 418 and NGC 7027,arxiv.org/pdf/2506.23256
Seasonal Variations of the Atmospheric Muon Neutrino Spectrum measured with IceCube,arxiv.org/pdf/2502.17890
"Discovery of Ancient Globular Cluster Candidates in The Relic, a Quiescent Galaxy at z=2.5",arxiv.org/pdf/2501.07627
HD 35843: A Sun-like star hosting a long period sub-Neptune and inner super-Earth,arxiv.org/pdf/2505.00898
Natural experiments from Earth Hour reveal urban night sky being drastically lit up by few decorative buildings,arxiv.org/pdf/2507.02019
Short-Period Small Planets with High Mutual Inclinations are more Common around Metal-Rich Stars,arxiv.org/pdf/2502.00442
Escaping Helium and a Highly Muted Spectrum Suggest a Metal-Enriched Atmosphere on Sub-Neptune GJ3090b from JWST Transit Spectroscopy,arxiv.org/pdf/2504.20428
Sodium and Potassium Linewidths as an Atmospheric Escape Diagnostic at Mercury,arxiv.org/pdf/2505.23915
The Dark Ages Explorer (DEX): a filled-aperture ultra-long wavelength radio interferometer on the lunar far side,arxiv.org/pdf/2504.03418
"A ""Black Hole Star"" Reveals the Remarkable Gas-Enshrouded Hearts of the Little Red Dots",arxiv.org/pdf/2503.16596
Corotating Interaction Regions (CIRs): impacts with exoplanets,arxiv.org/pdf/2508.01267
Redshift Assessment Infrastructure Layers (RAIL): Rubin-era photometric redshift stress-testing and at-scale production,arxiv.org/pdf/2505.02928
Resolving the S8 tension with the Lambda Prime ($Λ'$) model,arxiv.org/pdf/2504.14609
Inferring CSM Properties of Type II SNe Using a Magnitude-Limited ZTF Sample,arxiv.org/pdf/2503.19969
Charged Particle Oscillations around a Black Hole Surrounded by CDM Halos,arxiv.org/pdf/2507.11139
Limiting on ALP-photon Coupling through GRB221009A,arxiv.org/pdf/2503.18653
"PIRATES -- a machine-learning framework for polarized, interferometric image reconstruction",arxiv.org/pdf/2505.11950
H$β$ line shape and radius-luminosity relation in 2.5D FRADO,arxiv.org/pdf/2506.01159
K2 observations of five pulsating subdwarf B stars with white dwarf companions,arxiv.org/pdf/2506.05033
"Gas-phase Elemental abundances in Molecular cloudS (GEMS) XI. The evolution of HCN, HNC, and N2H+ isotopic ratios in starless cores",arxiv.org/pdf/2507.10380
A Ground-Based Transit Observation of the Long-Period Extremely Low-Density Planet HIP 41378 f,arxiv.org/pdf/2506.20907
Tracing the Milky Way: Calibrating chemical ages with high-precision Kepler data,arxiv.org/pdf/2506.15546
Subgiants in NGC 188 Reveal that Rotationally Induced Mixing Creates the Main Sequence Li-Dip,arxiv.org/pdf/2507.04266
The Discovery of Little Red Dots in the Local Universe: Signatures of Cool Gas Envelopes,arxiv.org/pdf/2507.10659
The TESS-Keck Survey XXIV: Outer Giants may be More Prevalent in the Presence of Inner Small Planets,arxiv.org/pdf/2501.06342
Can galactic magnetic fields diffuse into the voids?,arxiv.org/pdf/2510.26918
"The SWAN view of dense gas in the Whirlpool -- A cloud-scale comparison of N2H+, HCO+, HNC and HCN emission in M51",arxiv.org/pdf/2507.19439
The Double-Episode Jet Genesis of the eROSITA and Fermi Bubbles,arxiv.org/pdf/2507.13665
Cosmic ray and plasma coupling for isothermal supersonic turbulence in the magnetized interstellar medium,arxiv.org/pdf/2506.03768
Revisiting $Λ$CDM extensions in light of re-analyzed CMB data,arxiv.org/pdf/2506.13537
Discovery of a years-delayed radio flare from an unusually slow-evolved tidal disruption event,arxiv.org/pdf/2501.08812
The gas streamer G1-2-3 in the Galactic Center,arxiv.org/pdf/2510.00897
An Optimal In-Situ Multipole Algorithm for the Isotropic Three-Point Correlation Functions,arxiv.org/pdf/2507.15209
OSIRIS-REx Operational Key Decision Points: A Retrospective,arxiv.org/pdf/2505.14632
JADES reveals a large population of low mass black holes at high redshift,arxiv.org/pdf/2506.22147
Measuring the Neutrino Flux in Segments along the Galactic Plane with IceCube,arxiv.org/pdf/2507.08097
"The SPHERE infrared survey for exoplanets (SHINE). V. Complete observations, data reduction and analysis, detection performances, and final results",arxiv.org/pdf/2501.12002
"exoALMA. VI. Rotating under Pressure: Rotation curves, azimuthal velocity substructures, and pressure variations",arxiv.org/pdf/2504.20036
Robust non-minimal attractors in many-field inflation,arxiv.org/pdf/2504.12406
The Evolution of Pop III.1 Protostars Powered by Dark Matter Annihilation. I. Fiducial model and first results,arxiv.org/pdf/2507.00870
Subaru High-z Exploration of Low-Luminosity Quasars (SHELLQs) XXII. Chandra observations of narrow-line quasar candidates at z>6,arxiv.org/pdf/2505.04826
A luminous and hot infrared through X-ray transient at a 5 kpc offset from a dwarf galaxy,arxiv.org/pdf/2505.11597
Continuum optical-UV and X-ray variability of AGN: current results and future challenges,arxiv.org/pdf/2506.23899
DESI DR2 Results I: Baryon Acoustic Oscillations from the Lyman Alpha Forest,arxiv.org/pdf/2503.14739
Exploring future synergies for large-scale structure between gravitational waves and radio sources,arxiv.org/pdf/2505.15645
The Luminosity of the Darkness: Schechter function in dark sirens,arxiv.org/pdf/2505.13568
Search for the Optical Counterpart of Einstein Probe Discovered Fast X-ray Transients from Lulin Observatory,arxiv.org/pdf/2504.21096
First JWST/NIRSpec Spectroscopy of O Stars in the Small Magellanic Cloud,arxiv.org/pdf/2505.10721
The project of a ground-based wide-angle EAS Cherenkov light imaging detector for PCR mass composition study in the 1-1000 PeV energy range,arxiv.org/pdf/2507.16097
"Improvements to SHINS, the SHARK-NIR Instrument Software, during the AIT phase",arxiv.org/pdf/2501.08010
A Terminology and Quantitative Framework for Assessing the Habitability of Solar System and Extraterrestrial Worlds,arxiv.org/pdf/2505.22808
AstroQ: Automated Scheduling of Cadenced Astronomical Observations,arxiv.org/pdf/2506.08195
EP250108a/SN 2025kg: A Broad-Line Type Ic Supernova Associated with a Fast X-ray Transient Showing Evidence of Extended CSM Interaction,arxiv.org/pdf/2504.17516
Preliminary Analysis into the Feasibility of Missions to Asteroid 2024 YR$_4$,arxiv.org/pdf/2502.19346
Formation of the Little Red Dots from the Core-collapse of Self-interacting Dark Matter Halos,arxiv.org/pdf/2503.23710
An H$α$ Cloud in the HI Tail: Recent Star Formation in the Outskirts of NGC 4258 Revealed by Nanshan 1-m Telescope,arxiv.org/pdf/2506.21321
Pushing JWST to the extremes: search and scrutiny of bright galaxy candidates at z$\simeq$15-30,arxiv.org/pdf/2504.05893
Precursor Activity Preceding Interacting Supernovae I: Bridging the Gap with SN 2022mop,arxiv.org/pdf/2503.08768
KiDS-Legacy: Redshift distributions and their calibration,arxiv.org/pdf/2503.19440
IXPE Observations of the Blazar Mrk 501 in 2022: A Multiwavelength View,arxiv.org/pdf/2507.07232
Asteroseismology with PBjam 2.0: measuring dipole mode frequencies in coupling regimes from main sequence to low-luminosity red giant stars,arxiv.org/pdf/2506.20382
"L1448 IRS3B: Dust Polarization Aligned with Spiral Features, Tracing Gas Flows",arxiv.org/pdf/2503.07787
White dwarfs as probes of extrasolar planet compositions and fundamental astrophysics,arxiv.org/pdf/2507.03029
"Global properties, fractality, and mass segregation in single, paired, and grouped open clusters",arxiv.org/pdf/2505.14788
Voyager 1 Data Reveals Signatures of the Local Gas and Cosmic-Ray Source Distributions,arxiv.org/pdf/2512.03385
A Generative Model for Disentangling Galaxy Photometric Parameters,arxiv.org/pdf/2507.15898
Constraining cosmic ray transport models using circumgalactic medium properties and observables,arxiv.org/pdf/2505.13597
Modelling shadows in scattered light observations as signals from companions in protoplanetary discs,arxiv.org/pdf/2506.04415
The eROSITA Final Equatorial Depth Survey (eFEDS): SDSS spectroscopic observations of X-ray sources,arxiv.org/pdf/2505.03872
Design and Scientific Prospects of the POLAR-2 Mission,arxiv.org/pdf/2510.02016
The SPHEREx Sky Simulator: Science Data Modeling for the First All-Sky Near-Infrared Spectral Survey,arxiv.org/pdf/2505.24856
Converging on the Cepheid Metallicity Dependence: Implications of Non-Standard Gaia Parallax Recalibration on Distance Measures,arxiv.org/pdf/2507.15936
Broken Expectations: The Effects of Modelling Assumptions on the Inferred Dark Matter Distribution in the Milky Way's Satellites,arxiv.org/pdf/2504.18617
WALLABY Pilot Survey: kNN identification of perturbed galaxies through HI morphometrics,arxiv.org/pdf/2501.10563
Confirmation of four hot Jupiters detected by TESS using follow-up spectroscopy from MaHPS at Wendelstein together with NEID and TRES,arxiv.org/pdf/2501.04383
Coriolis force acting on near-surface horizontal flows during simulations of flux emergence produces a tilt angle consistent with Joy's law on the Sun,arxiv.org/pdf/2506.15935
A systematic search for AGN obscuration variability in the Chandra archive,arxiv.org/pdf/2506.04457
Deciphering the Nature of Virgil: An Obscured AGN Lurking Within an Apparently Normal Lyman-α Emitter During Cosmic Reionization,arxiv.org/pdf/2504.01852
Fisher Score Matching for Simulation-Based Forecasting and Inference,arxiv.org/pdf/2507.07833
Optical and Near-infrared Observations of SN 2023ixf for over 600 days after the Explosion,arxiv.org/pdf/2504.03856
[C II]-deficit caused by self-absorption in an ionized carbon-filled bubble in RCW79,arxiv.org/pdf/2504.08976
A Late-Time Rise in Planet Occurrence Reproduces the Galactic Height Trend in Planet Occurrence,arxiv.org/pdf/2507.21250
Stray and Scattered Light Considerations in a Non-contiguous Array of Commercial CMOS Sensors in a Space Mission,arxiv.org/pdf/2508.21245
Can a multi-tracer approach improve the constraints on the turnover scale?,arxiv.org/pdf/2507.11823
MASTER OT J072007.30+451611.6: A Polar with Strong Optical Variability and Suppressed He II Emission,arxiv.org/pdf/2507.08907
Sloan Digital Sky Survey-V: Pioneering Panoptic Spectroscopy,arxiv.org/pdf/2507.06989
Planet-induced Gas and Dust Substructure Feedbacks on Disk Thermal Structure,arxiv.org/pdf/2507.01336
Clumps as multiscale structures in cosmic noon galaxies,arxiv.org/pdf/2501.03328
Dark matter signatures in cosmic rays,arxiv.org/pdf/2506.17676
Parsec-scale jet precession and a putative supermassive binary black hole system in the blazar AO 0235+164,arxiv.org/pdf/2508.14178
Disk-Star Alignment I: Pre-Main-Sequence Stellar Parameters and the Statistical Alignment Between Disks and Stellar Rotation,arxiv.org/pdf/2504.02990
The DESI Y1 RR Lyrae catalog I: Empirical modeling of the cyclic variation of spectroscopic properties and a chemodynamical analysis of the outer halo,arxiv.org/pdf/2504.02924
Learning the Universe: physically-motivated priors for dust attenuation curves,arxiv.org/pdf/2502.13240
The ALMA Survey of Gas Evolution of PROtoplanetary Disks (AGE-PRO): XII. Extreme millimetre variability detected in a Class II disc,arxiv.org/pdf/2506.10752
"Refined classification of YSOs and AGB stars by IR magnitudes, colors, and time-domain analysis with machine learning",arxiv.org/pdf/2511.21012
JWST NIRCam Imaging of NGC 4258: I. Observation Overview,arxiv.org/pdf/2508.11044
Neural-Network Chemical Emulator for First-Star Formation: Robust Iterative Predictions over a Wide Density Range,arxiv.org/pdf/2508.16114
Multi-Parameter Transitions in Cosmological Calibrators: A Resolution to the Hubble Tension from SH0ES Data Analysis,arxiv.org/pdf/2504.19807
CHEX-MATE: New detections and properties of the radio diffuse emission in massive clusters with MeerKAT,arxiv.org/pdf/2507.00133
GRB 241105A: A test case for GRB classification and rapid r-process nucleosynthesis channels,arxiv.org/pdf/2507.15940
Testing Origin-of-Life Theories with the Habitable Worlds Observatory (HWO),arxiv.org/pdf/2507.00164
"Closing the Evidence Gap: reddemcee, a Fast Adaptive Parallel Tempering Sampler",arxiv.org/pdf/2509.24870
Cosmic-ray acceleration and escape from supernova remnant W44 as probed by Fermi-LAT and MAGIC,arxiv.org/pdf/2501.03889
JWST Observations of SN 2024ggi I: Interpretation and Model Comparison of the Type II Supernova 2024ggi at 55 days Past Explosion,arxiv.org/pdf/2507.18753
Euclid: Early Release Observations -- Interplay between dwarf galaxies and their globular clusters in the Perseus galaxy cluster,arxiv.org/pdf/2503.16367
"Cloud-scale gas properties, depletion times, and star formation efficiency per free-fall time in PHANGS--ALMA",arxiv.org/pdf/2502.04481
Shape and spin state model of contact binary (388188) 2006 DP14 using combined radar and optical observations,arxiv.org/pdf/2503.01499
GMIMS-DRAGONS: A Faraday Depth Survey of the Northern Sky Covering 350 to 1030 MHz,arxiv.org/pdf/2510.09759
Interstellar comet 3I/ATLAS: discovery and physical description,arxiv.org/pdf/2507.05252
A Virgo Environmental Survey Tracing Ionised Gas Emission (VESTIGE). XIX. The discovery of a spectacular 230 kpc Halpha tail following NGC 4569 in the Virgo cluster,arxiv.org/pdf/2507.02527
Multidisciplinary Science in the Multimessenger Era,arxiv.org/pdf/2502.03577
RESOLVE: Rare Event Surrogate Likelihood for Gravitational Wave Paleontology Parameter Estimation,arxiv.org/pdf/2506.00757
The GHOSDT Simulations: II. Missing Molecules in Simulations of a Self-Regulated Interstellar Medium,arxiv.org/pdf/2507.16700
Shockingly Effective: Cluster Winds as Engines of Feedback in Starburst Galaxy VV 114,arxiv.org/pdf/2506.16624
When relics were made: vigorous stellar rotation and low dark matter content in the massive ultra-compact galaxy GS-9209 at z=4.66,arxiv.org/pdf/2505.06349
Quantum estimation of cosmological parameters,arxiv.org/pdf/2507.12228
Blue Stragglers prefer peaceful environments because binaries do the same,arxiv.org/pdf/2506.07692
"Evidence for an Instability-Induced Binary Merger in the Double-Peaked, Helium-Rich Type IIn Supernova 2023zkd",arxiv.org/pdf/2502.19469
A direct black hole mass measurement in a Little Red Dot at the Epoch of Reionization,arxiv.org/pdf/2508.21748
The intermediate-mass black hole 2XMM J123103.2+110648: a varying disc accretion rate during possible X-ray quasi-periodic eruptions?,arxiv.org/pdf/2506.09603
RIOJA. Merger-induced Clumps in a Galaxy at Redshift 6.81 Revealed by JWST,arxiv.org/pdf/2507.02053
"MINDS. Anatomy of a water-rich, inclined, brown dwarf disk: lack of abundant hydrocarbons",arxiv.org/pdf/2504.11424
ExoMiner++ on TESS with Transfer Learning from Kepler: Transit Classification and Vetting Catalog for 2-min Data,arxiv.org/pdf/2502.09790
Numerical Validation of the Yarkovsky Effect in Super-Fast Rotating Asteroids,arxiv.org/pdf/2507.05789
New full-sky studies of the distribution of ultra-high-energy cosmic-ray arrival directions,arxiv.org/pdf/2507.10441
Estimating the spins of supermassive black holes in distant ultraluminous quasars,arxiv.org/pdf/2505.08310
Identifying the contributors to cosmic reionization with the Habitable World Observatory: LyC escape calibration in faint galaxies,arxiv.org/pdf/2507.03171
In pursuit of the low-energy Solar neutron flux,arxiv.org/pdf/2506.17985
FRB 20250316A: A Brilliant and Nearby One-Off Fast Radio Burst Localized to 13 parsec Precision,arxiv.org/pdf/2506.19006
Near-infrared characterization of evolved massive stars in M31 and M33,arxiv.org/pdf/2507.19249
A double dipole geometry for PSR~J0740+6620,arxiv.org/pdf/2507.10197
The Atacama Cosmology Telescope: High-redshift measurement of structure growth from the cross-correlation of Quaia quasars and CMB lensing from ACT DR6 and $\textit{Planck}$ PR4,arxiv.org/pdf/2507.08798
Volatile-rich evolution of molten super-Earth L 98-59 d,arxiv.org/pdf/2507.02656
"X-ray, optical, and radio follow-up of five thermally emitting isolated neutron star candidates",arxiv.org/pdf/2511.19591
An Eccentric Sub-Neptune Moving Into the Evaporation Desert,arxiv.org/pdf/2505.10324
Spotting Stasis in Cosmological Perturbations,arxiv.org/pdf/2503.19959
WALLABY pilot survey: properties of HI-selected dark sources and low surface brightness galaxies,arxiv.org/pdf/2505.04299
No evidence for Keplerian taper of far-out galactic rotation,arxiv.org/pdf/2507.12120
LCDC: Bridging Science and Machine Learning for Light Curve Analysis,arxiv.org/pdf/2504.10550
DESI EDR: Calibrating the Tully-Fisher Relationship with the DESI Peculiar Velocity Survey,arxiv.org/pdf/2507.11765
"A wide-field, multi-line survey of CO in the Magellanic Clouds at parsec-scale resolution: characterising the molecular gas content with a 50-m single-dish submillimeter telescope",arxiv.org/pdf/2512.13911
Dynamic Imprints of Colliding-wind Dust Formation from WR140,arxiv.org/pdf/2502.02738
Six binary brown dwarf candidates identified by microlensing,arxiv.org/pdf/2510.23933
New X-ray Supernova Remnants in NGC 7793,arxiv.org/pdf/2506.09120
Chasing Serendipity: Tackling Transient Sources with Neutrino Telescopes,arxiv.org/pdf/2505.24652
The Diversity of Cold Worlds: a blended-light binary straddling the T/Y transition in brown dwarfs,arxiv.org/pdf/2503.02025
Nebular spectra of kilonovae with detailed recombination rates -- I. Light r-process composition,arxiv.org/pdf/2501.18345
Nebular emission from composite star-forming galaxies -- I. A novel modelling approach,arxiv.org/pdf/2501.05424
Free Floating or Merely Detached?,arxiv.org/pdf/2507.08968
Probing Ultralight Axion-like Dark Matter $-$ A PTA-PPA Synergy,arxiv.org/pdf/2506.04871
Surveying Galaxy Clusters (in formation) in the Distant Universe,arxiv.org/pdf/2512.14372
Discovery and study of the eclipsing variable star Grigoriev 1,arxiv.org/pdf/2507.01005
