title,month,id
Distribution of regularized three-body phase-volume,2025-01,2501.02013
"Magnetic Field Data Calibration with Transformer Model Using Physical Constraints: A Scalable Method for Satellite Missions, Illustrated by Tianwen-1",2025-01,2501.00020
"Scalar, Vector Perturbations and Effective Hawking Radiation of Cylindrical Black Holes in $f(\mathcal{R})$ and Ricci-Inverse Gravity",2025-01,2501.00060
Scattering of wave dark matter by supermassive black holes,2025-01,2501.00090
Bayesian analysis of hybrid neutron star EOS constraints within an instantaneous nonlocal chiral quark matter model,2025-01,2501.00115
Reexamination of nuclear structure properties and shape coexistence of nuclei around A70,2025-01,2501.00387
Topological Leptogenesis,2025-01,2501.00607
Uncertainties in tellurium-based dark matter searches stemming from nuclear structure uncertainties,2025-01,2501.00621
Astrophysical Black holes: An Explanation for the Galaxy Quenching,2025-01,2501.00899
Forecast constraints on the axion-photon coupling from interstellar medium heating,2025-01,2501.00992
Prediction of Geoeffective CMEs Using SOHO Images and Deep Learning,2025-01,2501.01011
Impact of QCD sum rules coupling constants on neutron stars structure,2025-01,2501.01234
Gravitational waves from color restoration in a leptoquark model of radiative neutrino masses,2025-01,2501.01286
Influence of Quantum Correction on Kerr Black Hole in Effective Loop Quantum Gravity via Shadows and EHT Results,2025-01,2501.01308
Post-adiabatic waveform-generation framework for asymmetric precessing binaries,2025-01,2501.01413
The Effects of Anthropogenic Air and Light Pollution on Astrophysics and Society,2025-01,2501.01452
Sub-MHz Radio Background from Ultralight Dark Photon Dark Matter,2025-01,2501.01489
Gravitational Waves of GUT Phase Transition during Inflation,2025-01,2501.01491
Maximum force conjecture in curved spacetimes of stable self-gravitating matter configurations,2025-01,2501.01497
Gravitational Wave Mountains: current-carrying domain walls,2025-01,2501.01542
Gravitational Wave Scattering From the Sun and Planets,2025-01,2501.01585
Constraining eV-scale axion-like particle dark matter: insights from the M87 Galaxy,2025-01,2501.01860
QCD Phase Diagram and Astrophysical Implications,2025-01,2501.01907
Constraining the Gravitational Wave Speed in the Early Universe via Gravitational Cherenkov Radiation,2025-01,2501.01910
Enabling Strong Neutrino Self-interaction with an Unparticle Mediator,2025-01,2501.02049
Search for continuous gravitational wave signals from luminous dark photon superradiance clouds with LVK O3 observations,2025-01,2501.02052
A sufficient condition for the development of superradiant instabilities in charged black-hole spacetimes,2025-01,2501.02053
Parity-doubled nucleons can rapidly cool neutron stars,2025-01,2501.02055
Role of internal space correlations in the dynamics of a higher-dimensional Bianchi type-I universe: shear scalar and Hubble parameter perspectives,2025-01,2501.02109
The Massive Flat Space Limit of Cosmological Correlators,2025-01,2501.02119
Dynamical de Sitter conjecture and quintessence,2025-01,2501.02258
Constraining electromagnetic couplings of ultralight scalars from compact stars,2025-01,2501.02286
Proton Radiation Damage and Annealing of COSI p-type Cross-strip HPGe Detectors,2025-01,2501.02412
Evolutions of in-medium baryon-baryon scattering cross sections and stiffness of dense nuclear matter from Bayesian analyses of FOPI proton flow excitation functions,2025-01,2501.02579
First result from tetrafluoroethane (C$_2$H$_2$F$_4$) superheated emulsion detector for dark matter search at JUSL,2025-01,2501.02833
Cosmological perturbation theory with trinity of scalar fields,2025-01,2501.02991
Eastward Transients in the Dayside Ionosphere II: A Parallel-plate Capacitor-Like Effect,2025-01,2501.03174
Neutrino energy and momentum emission from magnetized dense quark matter,2025-01,2501.03318
Complementarity between Cosmic String Gravitational Waves and long-lived particle searches in a laboratory,2025-01,2501.03326
Effective field theories for dark matter pairs in the early universe: Debye mass effects,2025-01,2501.03327
Observations of Turbulence and Particle Transport at Interplanetary Shocks: Transition of Transport Regimes,2025-01,2501.03648
Generally relativistic description of fast magnetic reconnection induced by thermal electromotive force,2025-01,2501.04019
Axion misalignment with memory-burdened PBH,2025-01,2501.04076
Scalable Discovery of Fundamental Physical Laws: Learning Magnetohydrodynamics from 3D Turbulence Data,2025-01,2501.04094
A Characteristic Signature of Magnetospheric Wave-Particle Interactions Found in the Turbulent E-region,2025-01,2501.04107
"Galaxy dynamics, gravitational Vlasov-Poisson system, Landau damping, and scattering theory",2025-01,2501.04175
Corrections to the Black hole entropy from a Bose Einstein condensate: a semi-classical phenomenological approach,2025-01,2501.04358
Periodic orbits and their gravitational wave radiations around the Schwarzschild-MOG black hole,2025-01,2501.04367
Eccentricity Effects on Modeling Dynamic Quantities and Their Correlations in Binary Black Hole Mergers,2025-01,2501.04495
Cosmological scalar perturbations in Horndeski-like gravity,2025-01,2501.04524
The MBTA Pipeline for Detecting Compact Binary Coalescences in the Fourth LIGO-Virgo-KAGRA Observing Run,2025-01,2501.04598
Kerr black hole parameters and its distance from the Earth in terms of directly measurable quantities of accretion disk,2025-01,2501.04677
Cosmic deceptions due to peculiar motions,2025-01,2501.04680
Dark Matter Ultraviolet Freeze-in in General Reheating Scenarios,2025-01,2501.04774
Using Data Science in High School Astronomy,2025-01,2501.04856
Coherence DeepClean: Toward autonomous denoising of gravitational-wave detector data,2025-01,2501.04883
Many body gravity and the bullet cluster,2025-01,2501.05126
Rigorous analytic solution to the gravitational-wave overlapping event rates,2025-01,2501.05218
AstronomyCalc: A python toolkit for teaching Astronomical Calculations and Data Analysis methods,2025-01,2501.05491
Piezoelectric Bulk Acoustic Resonators For Dark Photon Detection,2025-01,2501.05504
Towards a Non-singular Paradigm of Black Hole Physics,2025-01,2501.05505
A Bright Future? Prospects for Cosmological Tests of GR with Multimessenger Gravitational Wave Events,2025-01,2501.05560
Development of SQUID Array Amplifiers for the LiteBIRD CMB Satellite,2025-01,2501.05592
Thin and thick bubble walls III: wall energy,2025-01,2501.05612
Relativistic magnetohydrodynamics in the early Universe,2025-01,2501.05732
Bound-State Beta Decay of $\mathbf{\mathrm{^{205}{Tl}^{81+}}}$ Ions and the LOREX Project,2025-01,2501.06029
Memory time fluctuations and instabilities in random media,2025-01,2501.06036
The Spectre of Underdetermination in Modern Cosmology,2025-01,2501.06095
Scalable Cosmic AI Inference using Cloud Serverless Computing,2025-01,2501.06249
Resolution Limiting Factors in Low-Energy Cascade Zenith Angle Reconstruction with the IceCube Upgrade,2025-01,2501.06257
Soft Error Rate in Space: A Unified Analytical Approach,2025-01,2501.06260
Impact of memory-burdened primordial black holes on high-scale leptogenesis,2025-01,2501.06298
Maximum Likelihood Detection of Instrumental Glitches in LISA TDI Data,2025-01,2501.06315
No-go Theorem for Cosmological Parity Violation,2025-01,2501.06383
Realizability-Preserving Discontinuous Galerkin Method for Spectral Two-Moment Radiation Transport in Special Relativity,2025-01,2501.06388
On Legacy of Starobinsky Inflation,2025-01,2501.06451
Efficient Framework for Solving Plasma Waves with Arbitrary Distributions,2025-01,2501.06477
Astronomy and Society: The Road Ahead,2025-01,2501.06538
Gravitational collapse in the expanding Universe,2025-01,2501.06631
Constraining the curvature-induced quantum gravity scales via gamma-ray bursts,2025-01,2501.06874
Gravitational signatures beyond Newton: exploring hierarchical three-body dynamics,2025-01,2501.06947
Constraints on extended axion structures from the lensing of fast radio bursts,2025-01,2501.07176
The I-Love universal relation for polytropic stars under Newtonian gravity,2025-01,2501.07184
Gravitational-wave memory effects in the Damour-Esposito-Farèse extension of Brans-Dicke theory,2025-01,2501.07488
Characterization of Multiple Channels Room Temperature Readout Electronics for Large Transition-Edge Sensor Array,2025-01,2501.07603
Widen the Resonance: Probing a New Regime of Neutrino Self-Interactions with Astrophysical Neutrinos,2025-01,2501.07624
Primordial Non-Gaussianity from Light Compact Scalars,2025-01,2501.07672
In-flight positron annihilation as a probe of feebly interacting particles,2025-01,2501.07725
New Constraints on Axion Mediated Dipole-Dipole Interactions,2025-01,2501.07865
Pressure and chemical potentials in the inner crust of a cold neutron star within Hartree-Fock and extended Thomas-Fermi methods,2025-01,2501.08075
New Limits on Ultralight Axionlike Dark Matter from Reanalyzed Data,2025-01,2501.08117
Birefringence in fermion-attenuated gravitational wave power spectrum,2025-01,2501.08240
GPU-accelerated LISA parameter estimation with full time domain response,2025-01,2501.08261
Inflationary scenarios beyond the Standard Model,2025-01,2501.08380
Polarimetric searches for axion dark matter and high-frequency gravitational waves using optical cavities,2025-01,2501.08382
Revolutionizing Gravitational Potential Analysis: From Clairaut to Lie Groups,2025-01,2501.08488
The Physics of Life: Exploring Information as a Distinctive Feature of Living Systems,2025-01,2501.08683
Helicity effect on turbulent passive and active scalar diffusivities,2025-01,2501.08879
Searches for ultralight vector and axion dark matter with KAGRA,2025-01,2501.08930
Impact of correlated noise on the reconstruction of the stochastic gravitational wave background with Einstein Telescope,2025-01,2501.09057
Scalar Rayleigh Dark Matter: current bounds and future prospects,2025-01,2501.09073
Remarks on brane-antibrane inflation,2025-01,2501.09074
Updated BBN Bounds on Hadronic Injection in the Early Universe: The Gravitino Problem,2025-01,2501.09120
Cosmological Interactions with Phantom Scalar Field: Revisiting Background Phase-Space Analysis with Compactified Variables,2025-01,2501.09177
Observable Signatures of RN Black Holes with Dark Matter Halos via Strong Gravitational Lensing and Constraints from EHT Observations,2025-01,2501.09439
The flux of electron antineutrinos from supernova SN1987A data,2025-01,2501.09445
Gravitational waves and dark matter with Witten effect,2025-01,2501.09596
Cosmic voids and the kinetic analysis. IV. Hubble tension and the cosmological constant,2025-01,2501.09598
Scattering meets absorption in dark matter detection,2025-01,2501.09642
Constraining the Secluded and Catalyzed Annihilation Dark Matter with Fermi-LAT and Planck Data,2025-01,2501.09647
Optical gravitational waves as signals of Gravitationally-Decaying Particles,2025-01,2501.09794
Environmental effects in extreme mass ratio inspirals: perturbations to the environment in Kerr,2025-01,2501.09806
Black hole with global monopole charge in self-interacting Kalb-Ramond field,2025-01,2501.09899
Infrared Behavior of Induced Gravitational Waves from Isocurvature Perturbations,2025-01,2501.09939
Solar neutrinos,2025-01,2501.09971
Fully viable DHOST bounce with extra scalar,2025-01,2501.09985
Collapsing domain walls with $\mathbb{Z}_2$-violating coupling to thermalized fermions and their impact on gravitational wave detections,2025-01,2501.10059
Leptogenesis in the presence of density perturbations,2025-01,2501.10148
Primordial Black Holes Formed during Magneto-Hydrodynamic Turbulence in The Early Universe as Dominant Part of Dark Matter,2025-01,2501.10158
Excess of $^{236}$U in the northwest Mediterranean Sea,2025-01,2501.10215
Data-driven approach for extracting tidal information from neutron star binary mergers observed with the Einstein Telescope,2025-01,2501.10272
Modular global-fit pipeline for LISA data analysis,2025-01,2501.10277
(H)ALPing the 511 keV line: A thermal DM interpretation of the 511 keV emission,2025-01,2501.10504
Classical waves and instabilities using the minimalist approach,2025-01,2501.10708
Black holes immersed in polytropic scalar field gas,2025-01,2501.10874
Super-critical primordial black hole formation via delayed first-order electroweak phase transition,2025-01,2501.11040
Probing Spin-2 Ultralight Dark Matter with Space-based Gravitational Wave Detectors in Millihertz,2025-01,2501.11071
"Below the Schwinger critical magnetic field value, quantum vacuum and gamma-ray bursts delay",2025-01,2501.11080
Exploring the universal $\bar{\mathcal{I}}-\mathcal{C}$ relations for relativistic stars in $f(Q)$ gravity,2025-01,2501.11296
Spectrum of third-order tensor perturbations induced by excited scalar fields,2025-01,2501.11337
Kinetic-Scale Physics of a Multi-Species Solar Wind,2025-01,2501.11479
Tunable coherence laser interferometry: demonstrating 40dB of straylight suppression and compatibility with resonant optical cavities,2025-01,2501.11528
A Realistic Projection for Constraining Neutron Star Equation of State with the LIGO-Virgo-KAGRA Detector Network in the A+ Era,2025-01,2501.11585
Sky localization of gravitational waves from eccentric binaries,2025-01,2501.11601
QCD Equation of State with $N_f=3$ Flavors up to the Electroweak Scale,2025-01,2501.11603
Black Holes Rule Out Heavy Tachyons,2025-01,2501.11606
Supercooled phase transitions in conformal dark sectors explain NANOGrav data,2025-01,2501.11619
Rising Stargirls: Benefits of a Creative Arts-Based Approach to Astronomy Education for Middle-School Girls from Underrepresented Groups,2025-01,2501.11682
Modelling the Sgr A$^*$ and M87$^*$ shadows by using the Kerr-Taub-NUT metrics in the presence of a scalar field,2025-01,2501.11692
Axion-like-particle dark matter beyond the standard paradigm,2025-01,2501.11717
Challenges and Opportunities of Gravitational Wave Searches above 10 kHz,2025-01,2501.11723
Strong and weak dynamo regimes in Taylor-Couette flows,2025-01,2501.11761
Black holes in thermal bath live shorter: implications for primordial black holes,2025-01,2501.11925
Light clusters as a possible source of crustal impurities: a quasi-particle approach,2025-01,2501.12064
Supernova constraints on lepton flavor violating ALPs,2025-01,2501.12075
Inverse cascade from helical and nonhelical decaying columnar magnetic fields,2025-01,2501.12200
A new dark matter direct search based on archaeological Pb,2025-01,2501.12409
Pulse and Polarization Structures in Axion-Converted X-rays from Pulsars,2025-01,2501.12440
Extending Israel-Stewart theory: Causal bulk viscosity at large gradients,2025-01,2501.12543
On Equation of State of Dark Matter around Massive Black Holes,2025-01,2501.12574
"Analysis of the cosmological evolution parameters, energy conditions, and linear matter perturbations of an exponential-type model in $f(Q)$ gravity",2025-01,2501.12585
Constraints on flavor-dependent long-range interactions of high-energy astrophysical neutrinos,2025-01,2501.12662
GRTresna: An open-source code to solve the initial data constraints in numerical relativity,2025-01,2501.13046
Electromagnetic leptogenesis with light-heavy sterile neutrinos,2025-01,2501.13150
"Neutrinophilic $\mathbfΛ$CDM Extension for EMPRESS, DESI and Hubble Tension",2025-01,2501.13153
Searching for Dark Matter with MeVCube,2025-01,2501.13162
CosmiXs: Improved spectra for dark matter indirect detection,2025-01,2501.13281
Can we hear beats with pulsar timing arrays?,2025-01,2501.13450
Orbital Motion in Spacetimes Influenced by the Presence of Scalar and Electromagnetic Fields,2025-01,2501.13538
Analysis of inflationary models in higher-dimensional uniform inflation,2025-01,2501.13581
Exploring gravitational impulse via quantum Boltzmann equation,2025-01,2501.13678
Optical Images of Mini Boson Stars in Palatini $f(R)$ Gravity,2025-01,2501.13764
Theory of the kinetic helicity effect on turbulent diffusion of magnetic and scalar fields,2025-01,2501.13807
Redshift leverage for the search of GRB neutrinos affected by quantum properties of spacetime,2025-01,2501.13840
Identifying and Mitigating Machine Learning Biases for the Gravitational Wave Detection Problem,2025-01,2501.13846
SIDDA: SInkhorn Dynamic Domain Adaptation for Image Classification with Equivariant Neural Networks,2025-01,2501.14048
Revisiting purely kinetic k-essence,2025-01,2501.14177
Detection of the stochastic gravitational wave background with the space-borne gravitational-wave detector network,2025-01,2501.14292
On the Stability of Non-Singular Solutions in Effective Theory from Kaluza-Klein Unimodular Gravity,2025-01,2501.14398
Dynamical features and shadows of quantum Schwarzschild black hole in effective field theories of gravity,2025-01,2501.14516
On Formation of Primordial Naked Singularities,2025-01,2501.14695
A causal learning approach to in-orbit inertial parameter estimation for multi-payload deployers,2025-01,2501.14824
Theoretical Predictions for the Inner Dark Matter Distribution in the Milky Way Informed by Simulations,2025-01,2501.14868
Ephemeral Oscillons in Scalar-Tensor Theories: The Higgs-like case,2025-01,2501.14869
Probing small-scale power spectrum with gravitational-wave diffractive lensing,2025-01,2501.14904
Comparing strange and non-strange quark stars within resummed QCD at NLO,2025-01,2501.14935
Supercooled Phase Transitions: Why Thermal History of Hidden Sector Matters in Analysis of Pulsar Timing Array Signals,2025-01,2501.14986
Model-Independent Probe of Cosmic Distance Duality Relation,2025-01,2501.15086
Elementary considerations on possible entropy-driven cosmological evolutions,2025-01,2501.15146
Explainable autoencoder for neutron star dense matter parameter estimation,2025-01,2501.15222
VacuumTunneling: A package to solve bounce equation with renormalization factor,2025-01,2501.15236
Microscopic composite systems bound by strong gravity in extra dimensions as candidates for dark matter,2025-01,2501.15476
Gravity as emergent phenomena for spherically symmetric black hole accretion of multi-component flow with relativistic equation of state,2025-01,2501.15676
Towards constraining QCD phase transitions in neutron star interiors: Bayesian Inference with TOV linear response analysis,2025-01,2501.15810
Recent Developments in Stochastic Inflation,2025-01,2501.15843
Axion-like Particle Conversion in the Solar Magnetic Field,2025-01,2501.15960
Neutrino reheating predictions with non-thermal leptogenesis,2025-01,2501.16114
PRINCESS: Prediction of compact binaries observations with gravitational waves,2025-01,2501.16127
Dangerous dust clouds above lunar surface,2025-01,2501.16402
Cosmological Consequences of Domain Walls Biased by Quantum Gravity,2025-01,2501.16414
Geometrical origin of inflation in Weyl-invariant Einstein-Cartan gravity,2025-01,2501.16416
Theory of neutrino slow flavor evolution. Part II. Space-time evolution of linear instabilities,2025-01,2501.16423
"Greybody factors, reflectionless scattering modes, and echoes of ultracompact horizonless objects",2025-01,2501.16433
Optimizing Neural Network Surrogate Models: Application to Black Hole Merger Remnants,2025-01,2501.16462
The thermal index of neutron-star matter in the virial approximation,2025-01,2501.16795
First Axion-Like Particle Results from a Broadband Search for Wave-Like Dark Matter in the 44 to 52 $μ$eV Range with a Coaxial Dish Antenna,2025-01,2501.17119
Observing Hot Holographic Quark Star With Gravitational Waves,2025-01,2501.17121
A universal bound on the duration of a kination era,2025-01,2501.17226
Cosmological Moduli and Non-perturbative Production of Axions,2025-01,2501.17229
Dynamical Shortcomings in the Generalized SU(2) Proca Theory: Challenges for Cosmic Acceleration,2025-01,2501.17280
Innermost Stable Circular Orbits of a Kerr-like Metric with Quadrupole,2025-01,2501.17283
The highest energy cosmic rays from superheavy dark matter particles,2025-01,2501.17321
Nonparametric Smoothing of Directional and Axial Data,2025-01,2501.17463
"Reflections on ""Can AI Understand Our Universe?""",2025-01,2501.17507
Ion-kinetic-energy sampling in a 22-pole trap using ring-electrode evaporation,2025-01,2501.17530
Two-Step Procedure to Detect Cosmological Gravitational Wave Backgrounds with Next-Generation Terrestrial Gravitational-Wave Detectors,2025-01,2501.17717
Single versus multifield scalar potentials from string theory,2025-01,2501.17775
Significant increase in sensitive volume of a gravitational wave search upon including higher harmonics,2025-01,2501.17939
Ringdown nonlinearities in the eikonal regime,2025-01,2501.17950
"Unifying Inflation, dark energy and dark matter with a scalar field and exotic fermions",2025-01,2501.17966
Nonlocal gravity in a proper tetrad frame: traversable wormholes,2025-01,2501.18007
There is Room at the Top: Fundamental Quantum Limits for Detecting Ultra-high Frequency Gravitational Waves,2025-01,2501.18146
A general upper bound on the light dark matter scattering rate in materials,2025-01,2501.18261
Squeezing at the normal-mode splitting frequency of a nonlinear coupled cavity,2025-01,2501.18316
Gravity-Bench-v1: A Benchmark on Gravitational Physics Discovery for Agents,2025-01,2501.18411
DeepExtractor: Time-domain reconstruction of signals and glitches in gravitational wave data with deep learning,2025-01,2501.18423
"Non-singular bounce solutions in Myrzakulov $f(R,T)$ gravity",2025-01,2501.18524
Magnetically assisted vorticity production in decaying acoustic turbulence,2025-01,2501.18525
The Resolution of the Gauge Problem of Cosmology provides Insight into the Formation of the First Structures in the Universe,2025-01,2501.18658
Running Love Numbers and the Effective Field Theory of Gravity,2025-01,2501.18684
Electroweak clouds supported by magnetically charged black holes: Analytic treatment along the existence-line,2025-01,2501.18702
Systematic Uncertainties in the Measurement of Neutron lifetime Using Lunar Prospector Neutron Spectrometer,2025-01,2501.18831
"Effective theory for stochastic particle acceleration, with application to magnetized turbulence",2025-01,2501.19136
Spin oscillations of neutrinos scattered by the supermassive black hole in the galactic center,2025-01,2501.19404
Bound Domains,2025-02,2502.17180
How to make a Universe,2025-02,2502.00081
Reconstructing FHDE with Scalar and Gauge Fields,2025-02,2502.00292
Novel charged black hole solutions in conformal Killing gravity,2025-02,2502.00589
One-loop corrections to the E-type $α$-attractor models of inflation and primordial black hole production,2025-02,2502.00628
Starobinsky Inflation with T-Model Kaehler Geometries,2025-02,2502.00636
Can Q-balls describe cosmological and galactic dark matter?,2025-02,2502.00821
A $χ^2$ statistic for the identification of strongly lensed gravitational waves from compact binary coalescences,2025-02,2502.00844
Numerical evolution of the resistive relativistic magnetohydrodynamic equations: a minimally implicit Runge-Kutta scheme,2025-02,2502.00990
A practical Bayesian method for gravitational-wave ringdown analysis with multiple modes,2025-02,2502.01093
Magnetic Field Amplification and Reconstruction in Rotating Astrophysical Plasmas: Verifying the Roles of $α$ and $β$ in Dynamo Action,2025-02,2502.01300
LearningMatch: Siamese Neural Network Learns the Match Manifold,2025-02,2502.01361
Cooling the Shock: New Supernova Constraints on Dark Photons,2025-02,2502.01731
Direct Dark Matter searches with Metal Halide Perovskites,2025-02,2502.01732
Resonant Locking Between Binary Systems Induced by Gravitational Waves,2025-02,2502.01733
Signatures of cubic gravity in the strong regime,2025-02,2502.01747
Dynamical Solution to the Eta Problem in Spectator Field Models,2025-02,2502.01898
Probing New Physics with Multi-Messenger Astronomy,2025-02,2502.02166
A Compact theorem on the compactness of ultra-compact objects with monotonically decreasing matter fields,2025-02,2502.02375
The Spectrum of Global Axion Strings,2025-02,2502.02398
Extended Effective Field Theory of Dark Energy: Ghost Condensate Dark Energy with Sextic Dispersion Relation in de Sitter Spacetime,2025-02,2502.02401
On the Convergence of Strong Cylindrical and Spherical Shock Waves in Solid Materials,2025-02,2502.02609
Classical 1/3 Nusselt number scaling in highly turbulent compressible convection,2025-02,2502.02611
Ball Lightning as a profound manifestation of the Dark Matter physics,2025-02,2502.02653
Cherenkov emission by a fast-moving uncharged Schwarzschild black hole,2025-02,2502.02811
Structure formation in the local Universe and the cosmological constant,2025-02,2502.02864
Turbulent transport in a non-Markovian velocity field,2025-02,2502.02946
Electronic structure of liquid xenon in the context of light dark matter direct detection,2025-02,2502.02965
Multimode ringdown modelling with $\texttt{qnmfits}$ and $\texttt{KerrRingdown}$,2025-02,2502.03155
Exploring Hubble Tension Alleviation through Neutrino-Coupled Perturbed $f(R)$ Gravity,2025-02,2502.03190
Percolation of Domain Walls in the Two-Higgs Doublet Model,2025-02,2502.03209
Soft gravitons as Goldstone modes of spontaneously broken asymptotic symmetries in de Sitter spacetimes,2025-02,2502.03520
Primordial Gravitational Waves in Quadratic Gravity,2025-02,2502.03543
"Complementary Probes of Warped Extra Dimension: Colliders, Gravitational Waves and Primordial Black Holes from Phase Transitions",2025-02,2502.03588
Higgs Thermal Nonequilibrium in Primordial QGP,2025-02,2502.03598
Optimizing Bayesian model selection for equation of state of cold neutron stars,2025-02,2502.03831
Improved post-Newtonian waveform model for inspiralling precessing-eccentric compact binaries,2025-02,2502.03929
