title,month,id
A mass invariant in a compressible turbulent medium,2025-04,2504.05469
Hyperons and $Δ$'s in rotating protoneutron stars: Global properties,2025-04,2504.05495
Parameter Estimation Precision with Geocentric Gravitational Wave Interferometers: Monochromatic Signals,2025-04,2504.05548
Conformal form-invariant parametrization of scalar-tensor gravity theories: A critical analysis,2025-04,2504.05572
Klein-Gordon particles in a nonuniform external magnetic field in Bonnor-Melvin rainbow gravity background,2025-04,2504.05717
Scalar-assisted magnetogenesis during the radiation-dominated epoch,2025-04,2504.05835
Autoencoder-Based Detection of Anomalous Stokes V Spectra in the Flare-Producing Active Region 13663 Using Hinode/SP Observations,2025-04,2504.05962
"NQG III -- Two-Centre Problems, Whirlpool Galaxy and Toy Neutron Stars",2025-04,2504.06030
Cosmic inflation in non-perturbative quantum gravity,2025-04,2504.06035
Black hole quasinormal mode resonances,2025-04,2504.06072
Interface modes in inspiralling neutron stars: A gravitational-wave probe of first-order phase transitions,2025-04,2504.06181
Nonlinear Tails of Gravitational Waves in Schwarzschild Black Hole Ringdown,2025-04,2504.06224
High-Precision Lunar Corner-Cube Retroreflectors: A Wave-Optics Perspective,2025-04,2504.06409
One-Dimensional Relativistic Self-Gravitating Systems,2025-04,2504.06515
Graviton stimulated emission in squeezed vacuum states,2025-04,2504.06539
Hunting axion dark matter signatures in low-frequency terrestrial magnetic fields,2025-04,2504.06653
A post-Newtonian approach to neutron star oscillations,2025-04,2504.06918
Broadband Optical Modulation and Control at Millikelvin Temperatures,2025-04,2504.06995
A Robust Determination of Antinuclei Production from Dark Matter via Weakly Decaying Beauty Hadrons,2025-04,2504.07172
Primordial neutrinos fade to gray: constraints from cosmological observables,2025-04,2504.07178
Jupiter's ultraviolet auroral bridge: the influence of the solar wind on polar auroral morphology,2025-04,2504.07222
Search for Axion Dark Matter from 1.1 to 1.3 GHz with ADMX,2025-04,2504.07279
Gravitational wave signals from primordial black holes orbiting solar-type stars,2025-04,2504.07517
Axion dark matter search from terrestrial magnetic fields at extremely low frequencies,2025-04,2504.07559
Parameter extraction of the stochastic gravitational wave background with peak-like templates in millihertz,2025-04,2504.07602
Tidal heating in binary inspiral of strange quark stars,2025-04,2504.07659
Singularity resolution and inflation from an infinite tower of regularized curvature corrections,2025-04,2504.07692
Symmetry energy dependence of the bulk viscosity of nuclear matter,2025-04,2504.07805
The effect of background matter on the spin oscillations of neutrinos scattered by the supermassive black hole,2025-04,2504.07816
"Horizons, throats and bounces in hybrid metric-Palatini gravity with a non-zero potential",2025-04,2504.07861
Resummation of Universal Tails in Gravitational Waveforms,2025-04,2504.07862
"Biased domain walls: faster annihilation, weaker gravitational waves",2025-04,2504.07902
"Deflection angle in the strong deflection limit for static axisymmetric spacetimes: local curvature, matter fields, and quasinormal modes",2025-04,2504.07906
From kinetic gases to an exponentially expanding universe - The Finsler-Friedmann equation,2025-04,2504.08062
How much spin wandering can continuous gravitational wave search algorithms handle?,2025-04,2504.08163
Numerical evolution of Maxwell's equations for wavefronts propagating through a spherical gravitational potential,2025-04,2504.08286
Asteroid-mass soliton as the dark matter-baryon coincidence solution,2025-04,2504.08304
Sunward Flows in the Magnetosheath Associated with Magnetic Pressure Gradient and Magnetosheath Expansion,2025-04,2504.08521
Multi-MeV electron occurrence and lifetimes in the outer radiation belt and slot region during the maximum of solar cycle 22,2025-04,2504.08559
"Scale separation, rolling solutions and entropy bounds",2025-04,2504.08634
Enhancing Neutrino Reconstruction in Water-Cherenkov Air Shower Arrays Using Multi-Photosensors,2025-04,2504.08652
Non zero Coriolis field in Ehlers' Frame Theory,2025-04,2504.08797
Refining the sensitivity of new physics searches with ancient minerals,2025-04,2504.08885
Late-time acceleration and structure formation in interacting $α$-attractor dark energy models,2025-04,2504.09050
Superheavy Metastable Strings in SO(10),2025-04,2504.09055
A Prototype Atom Interferometer to Detect Dark Matter and Gravitational Waves,2025-04,2504.09158
Analogue of Chern-Simons invariant in non-metricity gravity and axion cosmology,2025-04,2504.09218
Black holes with electroweak hair -- the detailed derivation,2025-04,2504.09304
aweSOM: a CPU/GPU-accelerated Self-organizing Map and Statistically Combined Ensemble Framework for Machine-learning Clustering Analysis,2025-04,2504.09449
Advancing RFI-Detection in Radio Astronomy with Liquid State Machines,2025-04,2504.09796
Axion-like Dark Matter Search with Space-based Gravitational Wave Detectors,2025-04,2504.10083
Probing Binary Lens Caustics with Gravitational Waves: A Uniform Approximation Approach,2025-04,2504.10128
Magneto-Hydrodynamic Simulations of Eccentric Binary Neutron Star Mergers,2025-04,2504.10228
Bumblebee cosmology: The FLRW solution and the CMB temperature anisotropy,2025-04,2504.10297
Why Cold BGK Modes Are So Cool: Dispersion Relations from Orbit-Constrained Distribution Functions,2025-04,2504.10382
Holographic Entanglement Entropy in the FLRW Universe,2025-04,2504.10457
False and genuine decoherence in the early universe: a local observer and time-averaged observables,2025-04,2504.10472
Independent connection in ACTion during inflation,2025-04,2504.10488
Cosmogenic neutrinos as probes of new physics,2025-04,2504.10576
Mitigating Eddington and Malmquist Biases in Latent-Inclination Inference of the Tully-Fisher Relation,2025-04,2504.10589
Dark matter phase-in: producing feebly-interacting particles after a first-order phase transition,2025-04,2504.10593
t-channel dark matter at the LHC -- a whitepaper,2025-04,2504.10597
Searching for the QCD Dark Matter Axion,2025-04,2504.10607
PALACE v1.0: Paranal Airglow Line And Continuum Emission model,2025-04,2504.10683
Effective Field Theories in Magnetohydrodynamics,2025-04,2504.10763
Investigating the light curve variation of magnetic white dwarfs induced by the axion-photon conversion,2025-04,2504.10965
Analytical coordinate time at the second post-Newtonian order,2025-04,2504.11029
Testing Non-Coincident $f(Q)$-gravity with DESI DR2 BAO and GRBs,2025-04,2504.11132
Evidence of Nonlinear Signatures in Solar Wind Proton Density at the L1 Lagrange point,2025-04,2504.11265
Relic gravitational waves from primordial gravitational collapses,2025-04,2504.11275
Fast detection and reconstruction of merging Massive Black Hole Binary signals,2025-04,2504.11322
Domain wall evolution beyond quartic potentials: The Sine-Gordon and Christ-Lee potentials,2025-04,2504.11323
Detecting Ultralight Dark Matter with Matter Effect,2025-04,2504.11522
Gravitational wave signatures of non-singular matter bouncing cosmology in NANOGrav and beyond,2025-04,2504.11641
Gravitational entropy in black hole transformations,2025-04,2504.11649
Polarisation-Inclusive Spiking Neural Networks for Real-Time RFI Detection in Modern Radio Telescopes,2025-04,2504.11720
Entropy bounds from quantum thermodynamics,2025-04,2504.11807
Light WIMPs and MeV Gamma-ray Detection with COSI,2025-04,2504.11810
Anharmonic infrared spectra of cationic pyrene and superhydrogenated derivatives,2025-04,2504.11898
Sound waves from primordial black hole formations,2025-04,2504.12243
QSHS: An Axion Dark Matter Resonant Search Apparatus,2025-04,2504.12257
How Accidental was Inflation?,2025-04,2504.12283
Compared analysis of DInSAR data from ascending and descending orbits of Sentinel-1: the Cazzaso case study,2025-04,2504.12306
dSphobic Dark Matter,2025-04,2504.12372
Search for Axions in Magnetic White Dwarf Polarization at Lick and Keck Observatories,2025-04,2504.12377
"Data-driven extraction, phenomenology and modeling of eccentric harmonics in binary black hole merger waveforms",2025-04,2504.12469
Taming systematics in distance and inclination measurements with gravitational waves: role of the detector network and higher-order modes,2025-04,2504.12473
Precision mass measurements around ${}^{84}$Mo rule out ZrNb cycle formation in the rapid proton-capture process at type I X-ray bursts,2025-04,2504.12639
Why $w \ne -1$? Anthropic Selection in a $Λ$ + Axion Dark Energy Model,2025-04,2504.12852
"On the Inner Crusts of Neo-Neutron Stars: exotic light nuclei, diffusional and thermodynamical stability",2025-04,2504.12887
Palatini Linear Attractors Are Back in ACTion,2025-04,2504.12937
Detecting light dark matter with prompt-delayed events in neutrino experiments,2025-04,2504.13007
"Darkness in the Crust: Searching for the truly ""Dark"" Subhalos with Paleo-detectors",2025-04,2504.13247
Superheavy Dark Matter from the String Theory Axiverse,2025-04,2504.13256
A species scale-driven breakdown of effective field theory in time-dependent string backgrounds,2025-04,2504.13260
Geometric and Thermodynamic Properties of Frolov Black Holes with Topological Defects,2025-04,2504.13357
Q-balls Under Spontaneously Broken U(1) Symmetry,2025-04,2504.13509
Decay rate of PQ-ball,2025-04,2504.13510
Bubble wall dynamics from nonequilibrium quantum field theory,2025-04,2504.13725
Modeling transport in weakly collisional plasmas using thermodynamic forcing,2025-04,2504.14000
Estimating Soil Electrical Parameters in the Canadian High Arctic from Impedance Measurements of the MIST Antenna Above the Surface,2025-04,2504.14444
An interstellar mission to test astrophysical black holes,2025-04,2504.14576
Interdisciplinary Integration of Remote Sensing -- A Review with Four Examples,2025-04,2504.14590
Gravitational wave signatures of dark sector portal leptogenesis,2025-04,2504.14671
Detecting Dark Matter with Neutron Stars,2025-04,2504.14799
Superheavy dark matter from the natural inflation in light of the highest-energy astroparticle events,2025-04,2504.15272
Exploring non-perturbative effects on quasi-topological black hole thermodynamics,2025-04,2504.15318
Inflationary Gravitational Waves and Laboratory Searches as Complementary Probes of Right-handed Neutrinos,2025-04,2504.15374
Scale-dependent alignment in compressible magnetohydrodynamic turbulence,2025-04,2504.15538
Warm multi natural inflation,2025-04,2504.15606
Monte Carlo simulation of GRB data to test Lorentz-invariance violation,2025-04,2504.15685
Plasma Mechanism of Radio Emission Generation at the Bow Shock of the Exoplanet HD 189733b,2025-04,2504.15787
Bounce Cosmologies in Generalized Coupling Theories,2025-04,2504.15825
Eccentric or circular? A reanalysis of binary black hole gravitational wave events for orbital eccentricity signatures,2025-04,2504.15833
Temperature anisotropy instabilities of solar wind electrons with regularized Kappa-halos resolved with ALPS,2025-04,2504.15955
Unveiling the electrodynamic nature of spacetime collisions,2025-04,2504.15978
Linking the KM3-230213A Neutrino Event to Dark Matter Decay and Gravitational Wave signals,2025-04,2504.16040
Testing models for angular power spectra: A distribution-free approach,2025-04,2504.16079
Extreme mass ratio inspirals around topological stars,2025-04,2504.16156
"Turbulent heating in collisionless low-beta plasmas: imbalance, Landau damping, and electron-ion energy partition",2025-04,2504.16177
Brazilian Report on Dark Matter 2024,2025-04,2504.16228
How gravitational waves change photon orbital angular momentum quantum states,2025-04,2504.16452
Gravitational Equilibrium with Steady Flow and Relativistic Local Thermodynamics,2025-04,2504.16517
Detecting Cosmological Phase Transitions with Taiji: Sensitivity Analysis and Parameter Estimation,2025-04,2504.16712
Matter-antimatter asymmetry in generalized coupling theories,2025-04,2504.16751
Self-interacting dark matter with observable $ΔN_{\rm eff}$,2025-04,2504.16910
Prospects for gravitational wave and ultra-light dark matter detection with binary resonances beyond the secular approximation,2025-04,2504.16988
Stamps of state on structure: Probing the state of ultralight dark matter via its density fluctuations,2025-04,2504.16990
Prospects of detecting cosmic ray up-scattered dark matter with DUNE,2025-04,2504.16996
Ringdown mode amplitudes of precessing binary black holes,2025-04,2504.17021
Generalized neutrino isocurvature,2025-04,2504.17047
Conditional Diffusion-Based Retrieval of Atmospheric CO2 from Earth Observing Spectroscopy,2025-04,2504.17074
Explosive production of Higgs particles and implications for heavy dark matter,2025-04,2504.17127
Relic gravitational waves from cosmological horizon radiation during de Sitter period: as zero-order approximation of inflation,2025-04,2504.17533
Atemporality from Conservation Laws of Physics in Lorentzian-Euclidean Black Hole,2025-04,2504.17570
Enhancing gravitational-wave detection: a machine learning pipeline combination approach with robust uncertainty quantification,2025-04,2504.17587
"Modular Cosmic Ray Detector (MCORD) and its Potential Use in Various Physics Experiments, Astrophysics and Geophysics",2025-04,2504.17631
The Discriminant Power of Bubble Wall Velocities: Gravitational Waves and Electroweak Baryogenesis,2025-04,2504.17841
Insights into the highest natural scale: Finite naturalness challenges inflationary dynamics,2025-04,2504.17846
Updated Constraints on Omnipotent Dark Energy: A Comprehensive Analysis with CMB and BAO Data,2025-04,2504.17859
PowerSensor3: A Fast and Accurate Open Source Power Measurement Tool,2025-04,2504.17883
Teleportation-based Speed Meter for Precision Measurement,2025-04,2504.18111
Phenomenology of Schwarzschild-like Black Holes with a Generalized Compton Wavelength,2025-04,2504.18226
Equation of state and Fermi liquid properties of dense matter based on chiral effective field theory interactions,2025-04,2504.18259
COSINUS model-independent sensitivity to the DAMA/LIBRA dark matter signal,2025-04,2504.18263
Generalizing the relativistic precession model of quasi-periodic oscillations through anharmonic corrections,2025-04,2504.18403
Inflationary background renormalization,2025-04,2504.18514
Constraining Population III stellar demographics with next-generation gravitational-wave observatories,2025-04,2504.18615
Gravitational waves from eccentric binary neutron star mergers: Systematic biases and inadequacy of quasicircular templates,2025-04,2504.18622
Waveform models for the gravitational-wave memory effect: II. Time-domain and frequency-domain models for nonspinning binaries,2025-04,2504.18635
"Recoherence, adiabaticity, and Markovianity in Gaussian maps",2025-04,2504.18648
Symmetry Energy Expansion with Strange Dense Matter,2025-04,2504.18764
Search for high energy 5.5 MeV solar axions with the complete Borexino dataset,2025-04,2504.19135
Explosive growth of large-scale magnetic fluctuations due to particle scattering on developed small-scale Weibel turbulence in magnetoactive plasma,2025-04,2504.19202
Stability analysis of dilaton-inspired scalar field within the geometrical trinity of gravity,2025-04,2504.19245
Exploring Ultralight Dark Matter Self-Coupling via the Gravitational Wave Background,2025-04,2504.19505
Polarized pulse pair observations during a long duration interstellar communication experiment,2025-04,2504.19765
Cosmic strings in the complex symmetron model,2025-04,2504.19830
Approximating neutron-star radii using gravitational-wave only measurements with symbolic regression,2025-04,2504.19962
How Charged Can Neutrinos Be?,2025-04,2504.20044
Interaction of domain walls with scalar particles in the early Universe,2025-04,2504.20120
Induced Gravitational Waves as Cosmic Tracers of Leptogenesis,2025-04,2504.20135
How black hole mimickers and Shapiro-free lenses signal effective dark matter,2025-04,2504.20144
Implications of the KM3NeT Ultrahigh-energy Event on Neutrino Self-interactions,2025-04,2504.20163
Are gravitational waves consistent with other probes of gravity and dark energy?,2025-04,2504.20182
Probing the quantum speed limit and entanglement in flavor oscillations of neutrino-antineutrino system in curved spacetime,2025-04,2504.20236
Growth of a Black Hole in a Scalar Field Cosmology,2025-04,2504.20272
"F-Term Hybrid Inflation, Metastable Cosmic Strings and Low Reheating in View of ACT",2025-04,2504.20273
High-resolution geostationary satellite observations of free tropospheric NO2 over North America: implications for lightning emissions,2025-04,2504.20337
Radial Oscillations of the HESS J1731-347 Compact Object via the Karmarkar Condition in Gravity,2025-04,2504.20347
Evolution of precessing binary black holes on eccentric orbits using orbit-averaged evolution equations,2025-04,2504.20543
Static horizons in cosmology,2025-04,2504.20701
Instability and Information Production Around Kerr Black Holes: Effects on Entropy and the Shadow,2025-04,2504.20876
Viability of warm inflation with standard model interactions,2025-04,2504.20943
An Alternative to Axion,2025-04,2504.21078
Neutrino-antineutrino synchrotron emission from magnetized dense quark matter,2025-04,2504.21083
Probing the Axion-Nucleon Coupling with Supergiant Stars,2025-04,2504.21107
The frozen vanilla model: Exploring dark sector interactions with delta effective theories,2025-04,2504.21110
A Hybrid Mixture of $t$-Factor Analyzers for Clustering High-dimensional Data,2025-04,2504.21120
An improved parametrized test of general relativity using the IMRPhenomX waveform family: Including higher harmonics and precession,2025-04,2504.21147
Electroweak Phase Transition and Bubble Wall Velocity in Local Thermal Equilibrium,2025-04,2504.21213
Searching beyond the fiducial stochastic gravitational wave background in pulsar timing array data using likelihood reweighting,2025-04,2504.21267
Towards model-independent identification of lensed gravitational waves using Kramers-Kronig relation,2025-04,2504.21320
Plausible Indication of Gamma-Ray Absorption by Dark Matter in NGC 1068,2025-04,2504.21560
No Evidence of Anomalous Diffusion in Yukawa Crystals,2025-04,2504.21608
"New {\em ab initio} constrained extended Skyrme equations of state for simulations of neutron stars, supernovae and binary mergers: I. Subsaturation density domain",2025-04,2504.21725
Results from Hubble parameter data: oscillating dark energy?,2025-05,2505.00058
Discovering the Dispersion of Gravitational Waves using Multi-Band Observation including Deci-Hertz: A Unique Probe to Cosmic Acceleration,2025-05,2505.00084
"superB/NRPy: Scalable, Task-Based Numerical Relativity for 3G Gravitational Wave Science",2025-05,2505.00097
Slowly rotating covariant anisotropic objects,2025-05,2505.00139
Emergence of wind ripples controlled by mechanics of grain-bed impacts,2025-05,2505.00154
Neutron Star Radii from Laboratory Experiments,2025-05,2505.00390
Can We Probe Spacetime Non-commutativity Through Tidal Deformability of Compact Objects?,2025-05,2505.00498
Unified QMF equation of state for neutron star matter: Static and dynamic properties,2025-05,2505.00539
Dark matter as a vector field: an action principle for the Einstein cluster,2025-05,2505.00563
Joint inference for gravitational wave signals and glitches using a data-informed glitch model,2025-05,2505.00657
Charged Anisotropic Pulsar SAX J1748.9-2021 in Non-Riemannian Geometry,2025-05,2505.00758
Detecting gravitational signatures of dark matter with atom gradiometers,2025-05,2505.00781
Soft Oscillons,2025-05,2505.00890
Hubble-induced phase transitions in the Standard Model and beyond,2025-05,2505.00900
No-hair theorems in General Relativity and scalar-tensor theories,2025-05,2505.01038
Innermost stable circular orbit of arbitrary-mass compact binaries at fourth post-Newtonian order,2025-05,2505.01278
Spin Precession in magnetized Kerr spacetime,2025-05,2505.01367
Photo- and Hadrodisintegration constraints on massive relics decaying into neutrinos,2025-05,2505.01492
Evolution of a black hole cluster in full general relativity,2025-05,2505.01495
Morphological Regimes of Rotating Moist Convection,2025-05,2505.01626
Collisionless ablative plasma shocks,2025-05,2505.01690
Deflection Angle in the Strong Deflection Limit and Quasinormal Modes in Stationary Axisymmetric Spacetimes,2025-05,2505.01848
Dirac Singleton as a Relativistic Field Beyond Standard Model,2025-05,2505.01915
The Simplest Dark Matter Model at the Edge of Perturbativity,2025-05,2505.02408
DeepHMC : a deep-neural-network acclerated Hamiltonian Monte Carlo algorithm for binary neutron star parameter estimation,2025-05,2505.02589
Constraining the neutron star equation of state by including the isoscalar-vector and isovector-vector coupling using the Bayesian analysis,2025-05,2505.02618
"Earths composition: origin, evolution and energy budget",2025-05,2505.02641
Can Transformers help us perform parameter estimation of overlapping signals in gravitational wave detectors?,2025-05,2505.02773
Freely propagating flanks of wide coronal-mass-ejection-driven shocks: Modelling and observational insights,2025-05,2505.02794
Entanglement between pair-created twin universes with opposite time arrows should leave a birthmark on CMB spectrum,2025-05,2505.02807
"High-Frequency Gravitational Wave Search with ABRACADABRA-10\,cm",2025-05,2505.02821
Probing Boson Clouds with Supermassive Black Hole Binaries,2025-05,2505.02866
Constraining the Coexistence of Freeze-in Dark Matter and Primordial Black Holes,2025-05,2505.02935
Higgs-like inflation under ACTivated mass,2025-05,2505.03004
Axion effects on the non-radial oscillations of neutron stars,2025-05,2505.03142
The Tensor-Core Beamformer: A High-Speed Signal-Processing Library for Multidisciplinary Use,2025-05,2505.03269
Universal Cosmologies,2025-05,2505.03449
Development of a polarimetry method toward in-situ substrate birefringence characterization of ground-based gravitational wave detectors,2025-05,2505.03491
AnomalyMatch: Discovering Rare Objects of Interest with Semi-supervised and Active Learning,2025-05,2505.03509
Slowly Rotating Neutron Stars in Aether Scalar-Tensor Theory,2025-05,2505.03527
Cosmic strings and domain walls of the QCD quark condensate with and without a hidden axion,2025-05,2505.03542
Keeping the relation between the Starobinsky model and no-scale supergravity ACTive,2025-05,2505.03608
Consequences of non-minimal coupling for mass mixing in spontaneous baryogenesis,2025-05,2505.03644
Understanding large-scale dynamos in unstratified rotating shear flows,2025-05,2505.03660
Supermassive black hole in NGC 4649 (M60) with a dark matter halo: Impact on shadow measurements and thermodynamic properties,2025-05,2505.03661
Coverage Biases in High-Resolution Satellite Imagery,2025-05,2505.03842
Improved Dimensionality Reduction for Inverse Problems in Nuclear Fusion and High-Energy Astrophysics,2025-05,2505.03849
The Dark Matter Diffused Supernova Neutrino Background,2025-05,2505.03882
"Sufficient and Necessary Conditions for Collective Neutrino Instability: Fast, Slow, and Mixed",2025-05,2505.03886
Scalar-tensor theories at different scales: averaging the scalar sector,2025-05,2505.03909
Nonlinear dynamics in Horndeski gravity: a renormalized approach to effective gravitational coupling,2025-05,2505.03999
Galactic Spacetime Solutions with a Varying Newton's Coupling,2025-05,2505.04060
Relativistic structure of a supermassive black hole embedded in the dark matter halo of NGC 4649 (M60),2025-05,2505.04222
Topological regular black holes without Cauchy horizon,2025-05,2505.04427
Warming up the Fibres,2025-05,2505.04447
Hot Holographic 2-flavor Quark Star,2025-05,2505.04477
Attracting without being attracted: Dark Matter as an aether wind,2025-05,2505.04544
Testing Thermal-Relic Dark Matter with a Dark Photon Mediator,2025-05,2505.04626
Origin of cosmological density perturbations from quantum fluctuations of vacuum in General Relativity,2025-05,2505.04675
A Quantal Theory of Restoration of Strong CP Symmetry,2025-05,2505.04690
Antinuclei from Primordial Black Holes,2025-05,2505.04692
Improved cosmological limits on $Z^\prime$ models with light right-handed neutrinos,2025-05,2505.04695
Extreme mass ratio inspirals in rotating dark matter spikes,2025-05,2505.04697
Ultra-Relativistic Freeze-Out During Reheating,2025-05,2505.04703
PT2GWFinder: A Package for Cosmological First-Order Phase Transitions and Gravitational Waves,2025-05,2505.04744
Gravitational Wave Production and Baryogenesis in a Simple Left-Right model,2025-05,2505.04751
"Quantum-enabled optical large-baseline interferometry: applications, protocols and feasibility",2025-05,2505.04765
ORBIT-2: Scaling Exascale Vision Foundation Models for Weather and Climate Downscaling,2025-05,2505.04802
Initial conditions for Starobinsky inflation in general quadratic gravity,2025-05,2505.04805
Insights into Neutron Star Matter: EoS Models and Observations,2025-05,2505.05241
Hydrodynamic and Electromagnetic Discrepancies between Neutron Star and Black Hole Spacetimes,2025-05,2505.05299
Prospects for Probing Sub-GeV Leptophilic Dark Matter with the Future VLAST,2025-05,2505.05359
Theoretical modeling of approximate universality of tidally deformed neutron stars,2025-05,2505.05429
Screened Axio-dilaton Cosmology: Novel Forms of Early Dark Energy,2025-05,2505.05450
Primordial black-hole formation and heavy r-process element synthesis from the cosmological QCD transition. Two aspects of an inhomogeneous early Universe,2025-05,2505.05463
"Pattern-recognition techniques to search for gravitational waves from inspiraling, dark-dressed primordial black holes",2025-05,2505.05546
Fresh look at the diffuse ALP background from supernovae,2025-05,2505.05567
