title,month,id
Results from IceCube Searches for High-energy Neutrinos Coincident with Gravitational-Wave Alerts in LVK O4,2025-07,2507.08131
Enhancing searches for astrophysical neutrino sources in IceCube with machine learning and improved spatial modeling,2025-07,2507.08132
newASTROGAM -- The New MeV to GeV Gamma-ray Observatory,2025-07,2507.08133
Universal energy limits of radiation belts in planetary and brown dwarf magnetospheric systems,2025-07,2507.08146
"Analysis of the Diffuse Astrophysical Flux from the Galactic Plane with 12.1 Years of IceCube Starting Tracks, Throughgoing Tracks and Cascades",2025-07,2507.08152
A group of merging galaxies falling onto Abell 2142,2025-07,2507.08172
Development of a laser stabilized on an ultra-stable silicon cryogenic Fabry-Perot cavity for dark matter detection,2025-07,2507.08176
BASS XLVIII: [Ne v] λ3427 Emission in Powerful Nearby Active Galactic Nuclei,2025-07,2507.08179
Detecting Intermediate-mass Black Holes Using Miniature Pulsar Timing Arrays in Globular Clusters,2025-07,2507.08201
GW231123: a Binary Black Hole Merger with Total Mass 190-265 $M_{\odot}$,2025-07,2507.08219
Evidence of .Ia Supernova Detonations in 3D Hydrodynamical Simulations of Double Degenerate Mergers,2025-07,2507.08237
Time Variation in the TeV Cosmic Ray Anisotropy with IceCube and Energy Dependence of the Solar Dipole,2025-07,2507.08242
The JWST Spectroscopic Properties of Galaxies at $z=9-14$,2025-07,2507.08245
JVLA Measurement of Grain Size in the Compact Dust Ring around Class I Protostar WL 17,2025-07,2507.08246
Dynamo Confinement of a Radiatively Spreading Solar Tachocline Revealed by Self-consistent Global Simulations,2025-07,2507.08256
SDSS-V LVM: Collisionless Shocks in the Supernova Remnant RCW86,2025-07,2507.08257
Evaluating the Limits of Rotation Period Recovery through Gyrochronology Criteria,2025-07,2507.08266
Constraining decaying dark matter models with gravitational lensing and cosmic voids,2025-07,2507.08275
Obscured and unobscured X-ray AGNs I: Host galaxy properties,2025-07,2507.08298
Einstein Probe discovery of the short period intermediate polar EP J115415.8-501810,2025-07,2507.08304
On-axis afocal telescopes as framework for Cubesat based astronomical imagers and slit-less spectrographs,2025-07,2507.08323
Spectroscopic Observations of Four Candidates for Blue Large-Amplitude Pulsators. No BLAPs at High Galactic Latitudes,2025-07,2507.08372
How a Klein-Nishina Modified Eddington limited accretion explains rapid black hole growth in the early universe,2025-07,2507.08405
NuAncestor: an artificial satellite-borne star for accurate frequency calibration of ground-based EPRV spectrographs,2025-07,2507.08413
The Optical Sensor for IceCube-Gen2,2025-07,2507.08415
Astrophysical neutrino flux measurement and search for tau neutrino induced cascades with 11 years of IceCube data,2025-07,2507.08421
A co-deployed dust-logging instrument for the IceCube Upgrade and IceCube-Gen2,2025-07,2507.08430
The Rosetta Stone Project. I. A suite of radiative magnetohydrodynamics simulations of high-mass star-forming clumps,2025-07,2507.08436
Plasma instability in the front of ejected energetic electrons and Type III solar radiobursts,2025-07,2507.08437
Ion acceleration in Fermi-LAT behind-the-limb solar flares: the role of coronal shock waves,2025-07,2507.08452
An Earth-Sized Planet in a 5.4h Orbit Around a Nearby K dwarf,2025-07,2507.08464
Ion-rich acceleration during an eruptive flux rope event in a multiple null-point configuration,2025-07,2507.08469
Beyond LambdaCDM: How the Hubble tension challenges early universe physics,2025-07,2507.08479
Determination of the energy scale of cosmic ray measurements using the Auger Engineering Radio Array,2025-07,2507.08500
Expanding the Pierre Auger Observatory Open Data program,2025-07,2507.08504
Investigating field burial by magnetically confined accretion mounds on Neutron Stars,2025-07,2507.08509
Recent Highlights from the Auger Engineering Radio Array,2025-07,2507.08510
Geometric Considerations in Hot Jupiter Magnetic Drag Models,2025-07,2507.08511
Limits on WIMP-Scattering Cross Sections using Solar Neutrinos with Ten Years of IceCube Data,2025-07,2507.08519
Simulation and Performance Studies for the Tau Air-Shower Mountain-Based Observatory,2025-07,2507.08524
Anisotropic Diffusion of $e^\pm$ in Pulsar Halos over Multiple Coherence of Magnetic Fields,2025-07,2507.08526
A thermonuclear supernova interacting with hydrogen- and helium-deficient circumstellar material. SN 2020aeuh as a SN Ia-CSM-C/O?,2025-07,2507.08532
A survey for radio pulsars and transients in the 10 pc region around Sgr A*,2025-07,2507.08534
Update on the intermediate arrival-direction analyses of the Pierre Auger Observatory,2025-07,2507.08544
Euclid: Early Release Observations. A combined strong and weak lensing solution for Abell 2390 beyond its virial radius,2025-07,2507.08545
Event reconstruction with the Radio detector of the Pierre Auger Observatory,2025-07,2507.08556
Tracing Missing Baryons in the Cosmic Filaments with tSZ and CMB-Lensing Stacking,2025-07,2507.08561
A composition-informed search for large-scale anisotropy with the Pierre Auger Observatory,2025-07,2507.08564
Prospects for sub-GeV astrophysical neutrino detection with IceCube,2025-07,2507.08569
Measurement of the cosmic-ray energy spectrum above 2.5 EeV using 19 years of operation of the Pierre Auger Observatory,2025-07,2507.08573
"Observation of the Shadows of the Moon and Sun Using the Pierre Auger Observatory at an Average Energy of $7\times10^{17}\,$eV",2025-07,2507.08582
Classical Fluid Analogies for Schrödinger-Newton Systems,2025-07,2507.08583
A new type-1 transition in NGC 1346 revealed by (spectro)polarimetry,2025-07,2507.08589
XMM-Newton follow-up of two eROSITA X-ray binary candidates,2025-07,2507.08592
Spectra for the Vacuum Cherenkov Effect in Astrophysical Electromagnetic Cascades with Lorentz Invariance Violation,2025-07,2507.08593
"UNIONS Optical Identifications for VLASS Radio Sources in the Euclid Sky (UNVEIL) I. A Catalog of ~146,000 Radio Galaxies up to z~5",2025-07,2507.08604
Nature or Nurture: LMC-like Dust in the Solar Metallicity Galaxy M31,2025-07,2507.08612
First images of Antares photosphere from spectropolarimetry,2025-07,2507.08614
Metal-THINGS: gas metallicity gradients in nearby galaxies,2025-07,2507.08633
Precision spectral measurements of Chromium and Titanium from 10 to 250 GeV$/n$ and sub-Iron to Iron ratio with the Calorimetric Electron Telescope on the ISS,2025-07,2507.08643
Growth of Cosmic Structures in generalized mass-to-horizon relation Entropic Cosmology,2025-07,2507.08647
Chemical abundances and small-scale gas kinematics in the local star-forming galaxy NGC 2366,2025-07,2507.08651
Spectral analysis of two directly imaged benchmark L dwarf companions at the stellar-substellar boundary,2025-07,2507.08654
The IceCube Collaboration -- Contributions to the 39th International Cosmic Ray Conference (ICRC2025),2025-07,2507.08666
The IceCube-Gen2 Collaboration -- Contributions to the 39th International Cosmic Ray Conference (ICRC2025),2025-07,2507.08667
The role of dissipation distance on reconnection-driven multi-messenger signals from blazar jets,2025-07,2507.08680
Interpreting Hubble tension with a cascade decaying dark matter sector,2025-07,2507.08687
Advances in reconstructing the cosmic-ray energy spectrum with IceTop,2025-07,2507.08691
The optimal Padé polynomial for reconstruction of luminosity distance based on 10-fold cross-validation,2025-07,2507.08695
IceCube searches for GeV neutrino counterparts associated with high-energy starting events,2025-07,2507.08706
GeV Gamma-Rays from Molecular Clouds Illuminated by Particles Diffusing from the Adjacent Supernova Remnant G335.2+0.1 Confined in an Expanding Bubble,2025-07,2507.08709
Monitoring and performance of AugerPrime,2025-07,2507.08723
Constraining the survival of HCN during cometary impacts,2025-07,2507.08727
Statistical Analysis of Early Spectra in Type II and IIb Supernovae,2025-07,2507.08731
Performance and extensions of the central data acquisition system for Phase II of the Pierre Auger Observatory,2025-07,2507.08747
Low-latency neutrino follow-up combining diverse IceCube selections,2025-07,2507.08748
Measuring the Astrophysical Galactic Plane Neutrino Flux and Searching for Galactic PeVatrons using the IceCube Multi-Flavor Astrophysical Neutrino Sample,2025-07,2507.08753
Recent Advances in Understanding R-Process Nucleosynthesis in Metal-Poor Stars and Stellar Systems,2025-07,2507.08760
All-flavor Time-dependent Search for Transient Neutrino Sources,2025-07,2507.08775
Mining the Alerts: A Preliminary Catalog of Compact Binaries from the Fourth Observing Run,2025-07,2507.08778
Advancements in the IceAct Energy Spectrum Analysis,2025-07,2507.08779
Non-relativistic effective theories for fields with general potentials and their implications for cosmology,2025-07,2507.08786
The THESAN-ZOOM project: Mystery N/O more -- uncovering the origin of peculiar chemical abundances and a not-so-fundamental metallicity relation at $3<z<12$,2025-07,2507.08787
Triggering and quenching in the shadow of AGN: How does AGN proximity affect star formation in the EAGLE simulation?,2025-07,2507.08790
The Effective Field Theory of Large Scale Structure for Mixed Dark Matter Scenarios,2025-07,2507.08792
Multi-frequency analysis of the ALMA and VLA high resolution continuum observations of the substructured disc around CI Tau. Preference for sub-mm-sized low-porosity amorphous carbon grains,2025-07,2507.08797
The Atacama Cosmology Telescope: High-redshift measurement of structure growth from the cross-correlation of Quaia quasars and CMB lensing from ACT DR6 and $\textit{Planck}$ PR4,2025-07,2507.08798
Physics. Tasks With Solutions,2025-07,2507.00064
Test mass charge management in the detection of gravitational waves in space based on UV micro-LED,2025-07,2507.00086
Black-hole - neutron-star mergers: new numerical-relativity simulations and multipolar effective-one-body model with spin precession and eccentricity,2025-07,2507.00113
Modeling Gravitational Wave Modes from the Inspiral of Binaries with Arbitrary Eccentricity,2025-07,2507.00169
Preliminary analysis of the annual component of the polar motion over 180-year data interval,2025-07,2507.00197
Power-Law Bounces in $f(R)$ Gravity: Analysis of the Ekpyrosis and Accelerating Regimes,2025-07,2507.00242
Black Holes Immersed in Galactic Dark Matter Halo,2025-07,2507.00256
"Stability of Thin Shell and Wormhole Configurations: Schwarzschild, Schwarzschild -- (Anti-) de Sitter, and FLRW Spacetimes",2025-07,2507.00315
Earth-Scattering Induced Modulation in Low-Threshold Dark Matter Experiments,2025-07,2507.00344
"Uniform rate inflation in $f(T, \mathcal{T})$-gravity",2025-07,2507.00486
A waveform and time digitization mainboard prototype for the hybrid digital optical module of TRIDENT neutrino experiment,2025-07,2507.00548
Detection probability of light compact binary mergers in future observing runs of the current ground-based gravitational wave detector network,2025-07,2507.00588
Muffled Murmurs: Environmental effects in the LISA stochastic signal from stellar-mass black hole binaries,2025-07,2507.00694
A Non-Inflationary Axion and ALP Misalignment Mechanism,2025-07,2507.00785
Perturbative unitarity bounds on field-space curvature in de Sitter spacetime: purity vs scattering amplitude,2025-07,2507.00850
Gravitational Wave Signatures of Periodic Motion near Higher-Derivative Einstein-Æther Black Holes,2025-07,2507.00904
Khronon-Tensor theory reproducing MOND and the cosmological model,2025-07,2507.00912
New Constraints on Neutrino-Dark Matter Interactions: A Comprehensive Analysis,2025-07,2507.01000
PQ-ball and its Real Scalar Analogue in an Expanding Universe,2025-07,2507.01082
Searching for intermediate mass ratio binary black hole mergers in the third observing run of LIGO-Virgo-KAGRA,2025-07,2507.01083
Impact of a complex scalar spectator field on baryon asymmetry within spontaneous baryogenesis,2025-07,2507.01112
New avenues for the neutrino dipole portal exploration at the energy frontier,2025-07,2507.01130
Flux of Extragalactic Dark Matter in Direct Detection Experiments,2025-07,2507.01190
"Gravitational waves from a dilaton-induced, first-order QCD phase transition",2025-07,2507.01191
A Multimessenger Strategy for Downselecting the Orientations of Galactic Close White Dwarf Binaries,2025-07,2507.01250
A Gaussian process framework for testing general relativity with gravitational waves,2025-07,2507.01294
The axion signature of strange quark star in SGR 0501+4516,2025-07,2507.01373
"Symmetries of Hot SM, Magnetic Flux & Baryogenesis from Helicity Decay",2025-07,2507.01576
Quasinormal modes of nonlocal gravity black holes,2025-07,2507.01698
Freeze-In Dark Matter and Leptogenesis: a $ψ'$SM route,2025-07,2507.01895
Nonlinearities in Kerr Black Hole Ringdown from the Penrose Limit,2025-07,2507.01919
Sub-keV dark matter can strongly ionize molecular clouds,2025-07,2507.01962
Langmuir Wave Excitation in Solar-wind Magnetic Holes,2025-07,2507.02042
"From Fluctuation to Polarization: Imprints of $O(1-10)\, \mathrm{Mpc}^{-1}$ Curvature Perturbations in CMB B-modes from Scalar-Induced Gravitational Waves",2025-07,2507.02044
Primordial high energy neutrinos: theoretical/observational constraints and sharp spectral features,2025-07,2507.02063
Dangerous Questions in Astronomy Education,2025-07,2507.02162
ACT-Inspired Kaehler-Based Inflationary Attractors,2025-07,2507.02219
Inflation Model Based on Virasoro Squeezing,2025-07,2507.02236
Experimental demonstration of the clock asynchrony model in space-borne gravitational wave detection,2025-07,2507.02286
A search for extra polarisations using a Gaussian process in Gravitational-Wave Transient Catalogue 3,2025-07,2507.02335
Primordial regular black holes as all the dark matter. III. Covariant canonical quantum gravity models,2025-07,2507.02396
COSINUS -- a model-independent challenge of the DAMA/LIBRA dark matter claim with cryogenic NaI detectors operated in a new low-background facility,2025-07,2507.02429
Extended momentum-dependent interaction for transport models and neutron stars,2025-07,2507.02448
Optimisation of amplification and gas mixture for directional Dark Matter searches with the CYGNO/INITIUM project,2025-07,2507.02474
Primordial black hole formation in k-inflation models,2025-07,2507.02490
Dipolar dark matter theory based on a non-Abelian Yang-Mills field,2025-07,2507.02563
Gravitational Waves from Gauge Quanta Produced during Inflation,2025-07,2507.02611
Classification of $f(R)$ Theories Of Inflation And The Uniqueness of Starobinsky Model,2025-07,2507.02637
Cosmological constraints from UV/IR mixing,2025-07,2507.02738
Global Optimization of Multi-Flyby Trajectories for Multi-Orbital-Plane Constellations Inspection,2025-07,2507.02943
Lower bound on the proper lengths of stationary bound-state charged massive scalar clouds,2025-07,2507.03079
Heat-flux Instabilities of Regularized Kappa Distributed Strahl Electrons Resolved with ALPS,2025-07,2507.03084
Neural Dynamic Modes: Computational Imaging of Dynamical Systems from Sparse Observations,2025-07,2507.03094
An Open System Approach to Gravity,2025-07,2507.03103
Spherical Orbital Dynamics and Relativistic Precession in Kerr-MOG Spacetime,2025-07,2507.03443
Ring formation from black hole superradiance through repeated particle production on bound orbits,2025-07,2507.03490
Constraining the axiverse with reionization,2025-07,2507.03535
"CosmoBench: A Multiscale, Multiview, Multitask Cosmology Benchmark for Geometric Deep Learning",2025-07,2507.03707
Computational thinking in the teaching of Stellar Astrophysics: Analysis 4 from a teaching intervention,2025-07,2507.03735
Postsphaleron darkogenesis,2025-07,2507.03747
Impact of flavor condensate dark matter on accretion disk luminosity in spherical spacetimes,2025-07,2507.03758
"Black Hole Thermodynamics: Established Results, Unresolved Paradoxes, and Speculative Resolutions",2025-07,2507.03778
Stability and Thermodynamics of a Generalized Power-Law Dark Energy Model,2025-07,2507.03808
Bright ring features and polarization structures in Kerr-Sen black hole images illuminated by radiatively inefficient accretion flows,2025-07,2507.03857
The Study on Modified Theories of General Relativity: A Differential Geometric Approach,2025-07,2507.04031
Primordial Black Hole Ringdown: the Irreducible Stochastic Gravitational Wave Background,2025-07,2507.04083
Inflaton perturbations through an Ultra-Slow Roll transition and Hamilton-Jacobi attractors,2025-07,2507.04114
Self-Tracking Solutions for Asymptotic Scalar Fields,2025-07,2507.04161
The Milky Way is a Laboratory for New Ultra-long-baseline Neutrino Physics,2025-07,2507.04193
Periapsis shift in the Zipoy-Voorhees spacetime,2025-07,2507.04280
From $U(1) \times U(1)$ Symmetry Breaking to Majoron Cosmology: Insights from NANOGrav 15-year Data,2025-07,2507.04342
Astrophysical Quantum Matter Revisited: Flat-Band Topological States on a Zero-Flux Dipole Sphere,2025-07,2507.04363
Spinning black holes in astrophysical environments,2025-07,2507.04389
"Optimal Detection Bands for Intermediate-Mass Black Hole Binaries: Prospects for LISA and AMIGO in General Relativity and $f(R, T)$ Gravity",2025-07,2507.04392
A multi-parameter expansion for the evolution of asymmetric binaries in astrophysical environments,2025-07,2507.04471
Fluid approach of current-driven Langmuir waves associated with type III radiation and whistler waves: Relevance to PSP and other solar wind observations,2025-07,2507.04498
PIC simulation of current-driven solar type III radiation and whistler waves in an electron core-strahl plasma: Relevance to PSP and other space observations,2025-07,2507.04506
Effective Equation of State Oscillations at Matter-Radiation Equality and Primordial Gravitational Waves,2025-07,2507.04571
Improved Binary Black Hole Search Discriminator from the Singular Value Decomposition of Non-Gaussian Noise Transients,2025-07,2507.04628
From Nuclear Matter with Quenched $g_A$ to Compact-Star Matter with a Signal for Emergent Hidden Scale Symmetry,2025-07,2507.04939
Science of the LISA mission: A Summary for the European Strategy for Particle Physics,2025-07,2507.05130
Recasting Experimental Constraints on Relativistic Magnetic Monopoles,2025-07,2507.05136
Kerr black hole in a uniform Bertotti-Robinson magnetic field: An exact solution,2025-07,2507.05199
Hierarchical Subtraction with Neural Density Estimators as a General Solution to Overlapping Gravitational Wave Signals,2025-07,2507.05209
Cosmological dynamics of holographic dark energy with non-minimally coupled scalar field,2025-07,2507.05273
Causal Foundation Models: Disentangling Physics from Instrument Properties,2025-07,2507.05333
The Creation of Particles in an Expanding Universe,2025-07,2507.05372
Dynamical scheme for computing the mass parameter of a system in a medium,2025-07,2507.05746
Addressing the Hubble Tension: Insights from Reversible and Irreversible Thermodynamic Processes,2025-07,2507.05854
Gravitational waves in minimal Maxwell $f(R)$ gravity,2025-07,2507.06094
On the statistical nature of Betti numbers and Euler characteristic of smooth random fields,2025-07,2507.06255
On the stability of de Sitter inflationary solution in the Starobinsky-Bel-Robinson gravity,2025-07,2507.06270
Resonant Landau-Zener Conversion In Multi-Axion Systems,2025-07,2507.06287
Kilohertz Gravitational Waves from Binary Neutron Star Mergers: Full Spectrum Analyses and High-density Constraints on Neutron Star Matter,2025-07,2507.06293
"A flexible, GPU-accelerated approach for the joint characterization of LISA instrumental noise and Stochastic Gravitational Wave Backgrounds",2025-07,2507.06300
Dark Walker in the Early Universe: A Strongly Coupled Sector Model,2025-07,2507.06454
Linear and Regular Kepler-Manev Dynamics via Projective Transformations: A Geometric Perspective,2025-07,2507.06545
Asymptotic behavior of the Speed of Sound in Dense Matter,2025-07,2507.06741
Does HESS J1731-347 have a thick crust ?,2025-07,2507.06837
Early Warning From Eccentric Compact Binaries: Template Initialization And Sub-dominant Mode Effects,2025-07,2507.07021
Resolving the QCD Axion Domain Wall Problem with a Light Axion,2025-07,2507.07075
Open Source Planning & Control System with Language Agents for Autonomous Scientific Discovery,2025-07,2507.07257
Probing Axions via Spectroscopic Measurements of S-stars at the Galactic Center,2025-07,2507.07482
Moat hyperons in cold neutron stars,2025-07,2507.07556
Constraints on axionlike particles from 16.5 years of Fermi-LAT data and prospects for VLAST,2025-07,2507.07786
Gas of thin tubes of massless scalar field as a possible model of unified dark fluid,2025-07,2507.08054
"Dark, deep, deconfining: Phase transitions in neutron stars as powerful probes of hidden sectors",2025-07,2507.08076
Model-agnostic gravitational-wave background characterization algorithm,2025-07,2507.08095
Singularities in loop quantum cosmology,2025-07,2507.08116
Maneuver Detection via a Confidence Dominance Maneuver Indicator,2025-07,2507.08234
Improving gravitational wave search sensitivity with TIER: Trigger Inference using Extended strain Representation,2025-07,2507.08318
Defining eccentricity for spin-precessing binaries,2025-07,2507.08345
"Null geodesics, causal structure, and matter accretion in Lorentzian-Euclidean black holes",2025-07,2507.08431
Minimal Multi-Majoron Model,2025-07,2507.08645
Quantum production of gravitational waves after inflation,2025-07,2507.08737
Thermal Gravitons from Warm Inflation,2025-07,2507.08739
Potential science with GW250114 -- the loudest binary black hole merger detected to date,2025-07,2507.08789
Studying Ionospheric Phase Structure Functions Using Wide-Band uGMRT (Band-4) Interferometric Data,2025-07,2507.08823
On the relative humidity of the atmosphere,2025-07,2507.08824
Out of the darkness: probing the inflationary era with dark photon dark matter,2025-07,2507.08932
Electromagnetic Energy Extraction from Kerr Black Holes: Ab-Initio Calculations,2025-07,2507.08942
Muon Signal Charge in the Underground Muon Detector of AugerPrime,2025-07,2507.09006
A comprehensive dynamical and phenomenological analysis of structure growth in curvature-modulated coupled quintessence scenario,2025-07,2507.09169
Combining (post-)Newtonian ideas with quasi-equilibrium (QE) sequence analysis for black hole-neutron star (BHNS) gravitational wave events,2025-07,2507.09175
Distinguishing gravity theories with networks of space-based gravitational-wave detectors,2025-07,2507.09543
Compression and Reconnection Investigations of the MagnetoPause (CRIMP): A Mission Concept to Uncover the Impact of Mesoscale Reconnection and Plasma Outflow Processes at the Dayside Magnetopause,2025-07,2507.09722
Probing Right Handed Neutrino assisted Reheating with Gravitational Waves and Leptogenesis,2025-07,2507.09728
Primordial Gravitational Wave Background as a Probe of the Primordial Black Holes,2025-07,2507.10033
Composition of scalar mesons and their effects on nuclear matter properties in an extended linear sigma model,2025-07,2507.10049
Prospects for joint multiband detection of intermediate-mass black holes by LGWA and the Einstein Telescope,2025-07,2507.10165
The multiplicity distributions of the high frequency gravitons,2025-07,2507.10224
Investigating the Reliability of the AfriTEC Model During the Descending Phase of Solar Cycle 24 Across East Africa,2025-07,2507.10275
Overlapping signals in next-generation gravitational wave observatories: A recipe for selecting the best parameter estimation technique,2025-07,2507.10304
Waterfall phase in supersymmetric hybrid inflation,2025-07,2507.10460
Gravitational wave cosmology : an introduction,2025-07,2507.10597
Space-filling efficiency and optical properties of hemoglycin,2025-07,2507.10612
Asymgenesis,2025-07,2507.10655
Probing Non-Minimal Dark Sectors via the 21 cm Line at Cosmic Dawn,2025-07,2507.10664
Exploring ultra-high energy neutrino experiments through the lens of the transport equation,2025-07,2507.10665
Relativistic and Dynamical Love,2025-07,2507.10693
A New Method for the Discovery of the Distant Exoplanets II: Question of Signal-to-Noise Ratio,2025-07,2507.10764
Magnetic Monopoles: Theoretical Insights into the Cosmic Ray Conundrum,2025-07,2507.10765
Observation of a Knotted Electron Diffusion Region in Earth's Magnetotail Reconnection,2025-07,2507.10842
Demonstration of a 1820 channel multiplexer for transition-edge sensor bolometers,2025-07,2507.10929
Recent Advances in Simulation-based Inference for Gravitational Wave Data Analysis,2025-07,2507.11192
"GeV-scale thermal dark matter from dark photons: tightly constrained, yet allowed",2025-07,2507.11376
Why did the dark matter hypothesis supersede modified gravity in the 1980s?,2025-07,2507.11598
Making the Subdominant Dominant: Gravothermal Pile-Up of Collisional Dark Matter Around Compact Objects,2025-07,2507.11601
Electromagnetic Dirac Cogenesis,2025-07,2507.11607
"Learning Representations of Event Time Series with Sparse Autoencoders for Anomaly Detection, Similarity Search, and Unsupervised Classification",2025-07,2507.11620
Impacts and Ejecta in Natural Granular Material,2025-07,2507.11691
Multi-directional investigations on quiet time suprathermal ions measured by ASPEX-STEPS on-board Aditya L1,2025-07,2507.11952
Torsion induced current-scalaron coupling in Einstein-Cartan gravity,2025-07,2507.12151
Early release of low-frequency atlas of continuous gravitational waves,2025-07,2507.12161
Matter-antimatter asymmetry in a rotating universe: Dirac spinors in axisymmetric Bianchi IX cosmology,2025-07,2507.12164
Dark Matter Clumps as Sources of Gravitational-Wave Glitches in LIGO/Virgo/KAGRA data,2025-07,2507.12227
Bias with a Timer: Axion Domain Wall Decay and Dark Matter,2025-07,2507.12268
