title,month,id
Cosmic domain walls on a lattice: illusive effects of initial conditions,2025-09,2509.25367
Bridging Mid-IR and Terahertz Domains in a Single High-Resolution Dual-Comb Spectroscopy Measurement,2025-09,2509.25468
Extra Radiation Cosmologies: Implications of the Hubble Tension for eV-scale Neutrinos,2025-09,2509.25478
"Magnetic Helicity, Magnetic Monopoles, and Higgs Winding",2025-09,2509.25734
Gravitational wave experiments: achievements and plans,2025-09,2509.25952
Tidal disruption of a neutron star near naked singularity,2025-09,2509.26108
Agent-based code generation for the Gammapy framework,2025-09,2509.26110
Multi-strangeness matter from ab initio calculations,2025-09,2509.26148
Radiative and Jet Signatures of Regular Black Holes in Quantum-Corrected Gravity,2025-09,2509.26366
Restrictions on Initial Conditions in Cosmological Scenarios and Implications for Simulations of Primordial Black Holes and Inflation,2025-09,2509.26470
Chiral effects and Joule heating in hot and dense matter,2025-10,2510.00114
"Chase Orbits, not Time: A Scalable Paradigm for Long-Duration Eccentric Gravitational-Wave Surrogates",2025-10,2510.00116
Lectures on Open Effective Field Theories,2025-10,2510.00140
ELENA: a software for fast and precise computation of first order phase transitions and gravitational waves production in particle physics models,2025-10,2510.00289
Bayesian power spectral density estimation for LISA noise based on P-splines with a parametric boost,2025-10,2510.00533
Modified cosmology through generalized mass-to-horizon entropy: implications for structure growth and primordial gravitational waves,2025-10,2510.00673
Asymptotic Schwarzschild solutions in $f(R)$ gravity and their observable effects on the photon sphere of black holes,2025-10,2510.00702
Shadow of black holes with consistent thermodynamics,2025-10,2510.00708
Gluon Condensation as a Unifying Mechanism for Special Spectra of Cosmic Gamma Rays and Low-Momentum Pion Enhancement at the Large Hadron Collider,2025-10,2510.00847
Reducción de ruido por medio de autoencoders: caso de estudio con la señal GW150914,2025-10,2510.00873
"Novel very-high-frequency quasi-periodic oscillations of compact, non-singular objects",2025-10,2510.00986
Properties of Neutron Stars with Hyperons within a Relativistic Metamodel,2025-10,2510.00997
GW250114 reveals black hole horizon signatures,2025-10,2510.01001
Do plasmoids induce fast magnetic reconnection in well-resolved current sheets in 2D MHD simulations?,2025-10,2510.01060
WISPFI Experiment: Prototype Development,2025-10,2510.01221
Enhanced Matter Power Spectrum from Axion Kination after Big Bang Nucleosynthesis,2025-10,2510.01308
Robust bounds on MACHOs from the faintest galaxies,2025-10,2510.01310
Boltzmann Suppressed Ultraviolet Freeze-in,2025-10,2510.01311
Dark Drag Around Sagittarius A*,2025-10,2510.01320
Quasinormal ringing and Unruh-Verlinde temperature of the Frolov Black Hole,2025-10,2510.01376
Nonlinear causality and strong hyperbolicity of baryon-rich Israel-Stewart hydrodynamics,2025-10,2510.01512
Six-dimensional cosmological models with conformal extensions,2025-10,2510.01534
Suppression of inverse magnetic energy transfer in collisionless marginally magnetized plasmas,2025-10,2510.01573
Reducing Simulation Dependence in Neutrino Telescopes with Masked Point Transformers,2025-10,2510.01733
Resonant production of sterile neutrino dark matter with a refined numerical scheme,2025-10,2510.01907
Dark characterization of Ti/Al LEKIDs for the search of axions in the W-band,2025-10,2510.01913
The trichotomy of primordial black holes initial conditions,2025-10,2510.02006
Updating GUT-Scale Pole Higgs Inflation After ACT,2025-10,2510.02083
On the uncertainty in predicting the stochastic gravitational wave background from compact binary coalescences,2025-10,2510.02163
Astrophysical Consequences of an Electroweak $η_{\rm w}$ Pseudo-Scalar,2025-10,2510.02310
ArgoLOOM: agentic AI for fundamental physics from quarks to cosmos,2025-10,2510.02426
Extreme-mass-ratio inspirals in relativistic accretion discs,2025-10,2510.02433
A Limit on the Total Lepton Number in the Universe from BBN and the CMB,2025-10,2510.02438
Neural Post-Einsteinian Test of General Relativity with the Third Gravitational-Wave Transient Catalog,2025-10,2510.02515
Missing Beats: Dark Matter Silences Short-Period Cepheids in the Galactic Center,2025-10,2510.02641
Suppression of scalar perturbations due to a heavy axion,2025-10,2510.02828
PINNGraPE: Physics Informed Neural Network for Gravitational wave Parameter Estimation,2025-10,2510.02858
Neural Posterior Estimation with Autoregressive Tiling for Detecting Objects in Astronomical Images,2025-10,2510.03074
Nonmodal growth and optimal perturbations in magnetohydrodynamic shear flows,2025-10,2510.03141
Comprehensive \textsl{Ab Initio}~Calculations of \ce{CO2-H2} and \ce{CO2-He} Collisional Properties,2025-10,2510.03327
Mixed Stochastic-Deterministic Density Functional Theoretic Decomposition of Kubo-Greenwood Conductivities in the Projector Augmented Wave Formalism,2025-10,2510.03388
Surveying the State of Writing Education in Physics and Astronomy,2025-10,2510.03493
Cosmological Hydrodynamics at Exascale: A Trillion-Particle Leap in Capability,2025-10,2510.03557
Gravitomagnetic-Hydrodynamics and Turbulence in Early Universe,2025-10,2510.03711
Loop quantum inflation with inverse volume corrections in light of ACT data,2025-10,2510.03882
Effects of the ekpyrotic mechanism on inflationary phase in loop quantum cosmologies,2025-10,2510.03907
A quantum information method for early universe with non-trivial sound speed,2025-10,2510.04011
Ordinal Encoding as a Regularizer in Binary Loss for Solar Flare Prediction,2025-10,2510.04063
"Biased parameter inference of eccentric, spin-precessing binary black holes",2025-10,2510.04332
Testing black hole metrics with binary black hole inspirals,2025-10,2510.04703
Fisher-Bingham-like normalizing flows on the sphere,2025-10,2510.04762
The Wave Function of the Universe and Inflation,2025-10,2510.04775
Inspiring stories from women in astronomy in Africa,2025-10,2510.05195
Intrinsically Quantum Effects of Axion Dark Matter are Undetectable,2025-10,2510.05198
Testing the arrow of time at the cosmo collider,2025-10,2510.05204
A Data-Driven Prism: Multi-View Source Separation with Diffusion Model Priors,2025-10,2510.05205
Comparing LSTM-Based Sequence-to-Sequence Forecasting Strategies for 24-Hour Solar Proton Flux Profiles Using GOES Data,2025-10,2510.05399
Binary Neutron Stars from the Moon: Early Warnings and Precision Science for the Artemis Era,2025-10,2510.05400
Beyond $ρ^{2/3}$ Scaling: Microscopic Origins and Multimessengers of High-Density Nuclear Symmetry Energy,2025-10,2510.05508
Demagnifying gravitational lenses as probes of dark matter structures and nonminimal couplings to gravity,2025-10,2510.05575
Microscopic study of nuclei synthesis in pycnonuclear reaction $^{12}$C + $^{12}$C in neutron stars,2025-10,2510.05726
Adaptive and Multi-Source Entity Matching for Name Standardization of Astronomical Observation Facilities,2025-10,2510.05744
Pulsar timing array analysis in a Legendre polynomial basis,2025-10,2510.05913
"Low-energy Cross Section Measurements of ${}^{\mathsf{12}}\mathsf{C}(\mathsf{p},γ)$ Deep Underground at LUNA",2025-10,2510.05918
Limits on the Axion-Photon Coupling from Chandrayaan-2,2025-10,2510.06087
Overlap-aware segmentation for topological reconstruction of obscured objects,2025-10,2510.06194
Studying the gravitational-wave population without looking that FAR out,2025-10,2510.06220
Vision Transformer for Transient Noise Classification,2025-10,2510.06273
A comprehensive look into the accuracy of SpEC binary black hole waveforms,2025-10,2510.06393
Classification of $g$-modes for neutron stars with a strong transition: Novel universal relation including slow stable twin stars,2025-10,2510.06463
Influence of Solar Sails on Magnetic Field Measurements in Space Plasmas,2025-10,2510.06510
A Review of 10 Years of ProtoSpace: Spacecraft CAD Visualization in Collaborative Augmented Reality,2025-10,2510.06608
"Measurement of the $^{35}Cl(n, p)^{35}S$ cross-section at the CERN n\_TOF facility from subthermal energy to 120 keV",2025-10,2510.06885
When vacuum breaks: a self-consistency test for astrophysical environments in extreme mass ratio inspirals,2025-10,2510.06948
Unified Dark Matter and Dark Energy in a model of Non-Canonical Scalar-Tensor Theory,2025-10,2510.07103
GW231123: extreme spins or microglitches?,2025-10,2510.07228
Gauge Dependence of Scalar-Induced Gravitational Waves from Isocurvature Perturbations: Analytical Results,2025-10,2510.07252
Axion Perturbations: A General Analytical Treatment,2025-10,2510.07371
Probing Dark Matter Interactions with Stellar Motion near Sagittarius A*,2025-10,2510.07387
On defining astronomically meaningful Reference Frames in General Relativity,2025-10,2510.07400
Can Relativistic Effects explain Galactic Dynamics without Dark Matter?,2025-10,2510.07403
On the consistent disformal couplings to fermions,2025-10,2510.07419
Sterile neutrino dark matter from a TeV Scale Seesaw,2025-10,2510.07433
Emission of Nambu-Goldstone bosons from the semilocal string network,2025-10,2510.07894
Measuring gravitational lensing time delays with quantum information processing,2025-10,2510.07898
Atomic Observables Induced by Cosmic Fields,2025-10,2510.08007
The influence of the mean anomaly on the dynamical quantities of binary black hole mergers in eccentric orbits,2025-10,2510.08105
Iterated Agent for Symbolic Regression,2025-10,2510.08317
"Primordial Black Holes, Charge, and Dark Matter: Rethinking Evaporation Limits",2025-10,2510.08375
Effects of dark dipole radiation on eccentric supermassive black hole binary inspirals,2025-10,2510.08514
Dark matter Simplified models in the Resonance Region,2025-10,2510.08677
Hydrodynamic models of Reheating,2025-10,2510.08685
Emergence of advection-diffusion transport structure and nonlinear amplitude evolution of strongly driven instabilities,2025-10,2510.08735
Constraining the Cosmological Evolution of Post-Newtonian Parameters with Gravitational Wave Signals from Compact Binary Inspirals,2025-10,2510.08756
Effect of Finite-Temperature $β$-Decay Rates on the Rapid Neutron Capture Process,2025-10,2510.08772
Distinguishing between Black Holes and Neutron Stars within a Population of Weak Tidal Measurements,2025-10,2510.08832
When inverse seesaw meets inverse electroweak phase transition: a novel path to leptogenesis,2025-10,2510.09000
Thermal and Magnetic effects on Bulk Viscosity in Binary Neutron Star Mergers,2025-10,2510.09104
Statistics of Current and Vorticity Structures in Relativistic Turbulence,2025-10,2510.09126
Interactions between syn-rift magmatism and tectonic extension at intermediate rifted margins,2025-10,2510.09366
The Gravitational Wave Memory from Binary Neutron Star Mergers,2025-10,2510.09742
Microlensing of non-singular black holes at finite size: a ray tracing approach,2025-10,2510.10282
Cosmological Implications of Thermodynamic Split Conjecture,2025-10,2510.10441
Scattering of non-relativistic finite-size particles and puffy dark matter direct detection,2025-10,2510.10641
Big Bang Nucleosynthesis constraints on space-time noncommutativity,2025-10,2510.10685
Multimodal axion emissions from Abelian-Higgs cosmic strings,2025-10,2510.10708
Detecting gravitational waves with spin systems,2025-10,2510.11009
Interoperability From OpenTelemetry to Kieker: Demonstrated as Export from the Astronomy Shop,2025-10,2510.11179
Reconstructing and resampling: a guide to utilising posterior samples from gravitational wave observations,2025-10,2510.11197
Hydrodynamic properties in soliton field theory,2025-10,2510.11244
Hints of Dark Matter Spikes in Low-mass X-ray Binaries: a critical assessment,2025-10,2510.11635
Revisiting the limits on dark matter annihilation cross-section and decay lifetime in light of electron and positron fluxes,2025-10,2510.11700
Black Hole Ringdown Amplitudescopy,2025-10,2510.11782
Quasinormal modes from numerical relativity with Bayesian inference,2025-10,2510.11783
False Alarm Rates in Detecting Gravitational Wave Lensing from Astrophysical Coincidences: Insights with Model-Independent Technique GLANCE,2025-10,2510.11790
On the Speed-up of Wave-like Dark Matter Searches with Entangled Qubits,2025-10,2510.11795
Dynamically generated tilt of isocurvature fluctuations,2025-10,2510.11803
Impact of facility timing and coordination for next-generation gravitational-wave detectors,2025-10,2510.11861
New Tests of Low-Scale Quantum Gravity with Cosmic-Ray Collisions,2025-10,2510.11879
Gravitational Wave Signatures from Lepton Number Breaking Phase Transitions with Flat Potentials,2025-10,2510.11913
Phase space analysis of an exponential model in $f(Q)$ gravity including linear dark-sector interactions,2025-10,2510.12020
Model of deep zonal flows in giant planets,2025-10,2510.12236
Importance of being nonminimally coupled: Scalar Hawking radiation from regular black holes,2025-10,2510.12257
The probe limit in MHD and its implications for magnetic transport,2025-10,2510.12352
Observational Constraints on Chaplygin Gas Models in Non-Minimally Coupled Power Law $f(Q)$ Gravity with Quasars,2025-10,2510.12472
"High-energy photons from Gamma-Ray Bursts, but no neutrinos",2025-10,2510.12634
On the maximum compactness of neutron stars,2025-10,2510.12870
New Spallation Background Rejection Techniques to Greatly Improve the Solar Neutrino Sensitivity of JUNO,2025-10,2510.12873
Dark Matter-Electron Interactions Alter the Luminosity and Spectral Index of M87,2025-10,2510.12877
Gravity and the Hierarchy Problem,2025-10,2510.12882
Statistical properties of compressible isothermal turbulence from sub- to supersonic conditions,2025-10,2510.13141
Orbital dynamics and precession in magnetized Kerr spacetime,2025-10,2510.13569
Mass and spin coevolution of black holes inspiralling through dark matter,2025-10,2510.13604
APRIL: Auxiliary Physically-Redundant Information in Loss - A physics-informed framework for parameter estimation with a gravitational-wave case study,2025-10,2510.13677
Unified Origin of Dirac Neutrino and Asymmetric Dark Matter Masses via a Dirac-Type Leptogenesis,2025-10,2510.13723
Primordial magnetogenesis in loop quantum cosmology,2025-10,2510.13742
Probing Quadratically Coupled Ultralight Dark Matter with Pulsar Timing Arrays,2025-10,2510.13945
"Large Neutrino ""Collider""",2025-10,2510.13948
The quasinormal mode content of binary black hole ringdown,2025-10,2510.13954
No cosmological constraints on dark photon dark matter from resonant conversion: Impact of nonlinear plasma dynamics,2025-10,2510.13956
Resonant Loop Interferometers for High-Frequency Gravitational Waves,2025-10,2510.13957
MHDuet : a high-order General Relativistic Radiation MHD code for CPU and GPU architectures,2025-10,2510.13965
Quantum Damping of Cosmological Shear: A New Prediction from Loop Quantum Cosmologies,2025-10,2510.14021
Glitch noise classification in KAGRA O3GK observing data using unsupervised machine learning,2025-10,2510.14291
Recursive Target Body Approach for Low-Thrust Multiple Gravity-Assist Sequence Optimization,2025-10,2510.14402
A unified model of dark energy and inflation from the Markov-Mukhanov action,2025-10,2510.14416
The Stochastic Schwinger Effect,2025-10,2510.14468
ALP couplings to muons and electrons: a comprehensive analysis of supernova bounds,2025-10,2510.14469
Linear damping of magneto-acoustic waves in two-fluid partially ionized plasmas,2025-10,2510.14575
Toward a unified view of agnostic parametrizations for deformed black holes,2025-10,2510.14707
The predictive power of the calculated line lists of carbon monoxide,2025-10,2510.14747
Radiative Correction from Secret Neutrino Interactions and Implications for Neutrino-Scattering Experiments,2025-10,2510.15023
Atomic Quantum Sensors for High-Frequency Gravitational Wave Searches,2025-10,2510.15031
The Missing Multipole Problem: Investigating biases from model starting frequency in gravitational-wave analyses,2025-10,2510.15048
Hints for dynamical dark energy from warm inflation,2025-10,2510.15051
Effects of Radiative Corrections on Starobinsky Inflation,2025-10,2510.15137
Antikaon condensation in magnetized neutron star matter within the framework of the $σ$-cut scheme,2025-10,2510.15521
Anisotropic Dark Matter Bosonic Stars in regularized 4D Einstein$-$Gauss$-$Bonnet gravity,2025-10,2510.15549
Relativistic tidal divergences in circular orbits and the dynamics of light rings,2025-10,2510.15705
Spin-aligned inspiral waveforms from self-force and post-Newtonian theory,2025-10,2510.16112
Post-adiabatic self-force waveforms: slowly spinning primary and precessing secondary,2025-10,2510.16113
Hybrid waveform model for asymmetric spinning binaries: Self-force meets post-Newtonian theory,2025-10,2510.16114
Observational constraints on the modified cosmology inspired by string T-duality,2025-10,2510.16228
Axion condensates in neutron stars and radial oscillation modes,2025-10,2510.16245
Investigating Production of TeV-scale Muons in Extensive Air Shower at 2400 Meters Underground,2025-10,2510.16341
Characterization of the ionization response of argon to nuclear recoils at the keV scale with the ReD experiment,2025-10,2510.16404
Constraining Black Hole Shadows in Dunkl Spacetime using CUDA Numerical Computations,2025-10,2510.16460
The deep-MOND limit -- a study in Primary vs secondary predictions,2025-10,2510.16520
Structure formation in a non-canonical scalar field model of clustering dark energy,2025-10,2510.16589
Contribution from Nonlinear Quasi-normal Modes in GW250114,2025-10,2510.16903
Imprints of a Second Order Electroweak Phase Transition on the Stochastic Gravitational Wave Background,2025-10,2510.16921
The window on heavy charged dark matter was never open,2025-10,2510.17026
Gertsenshtein effect on the spacetime curved by background magnetic field with geometric optics,2025-10,2510.17094
From Stars to Waves: Non-deterministic Inference of Microlensed Gravitational Waves,2025-10,2510.17125
Hierarchical modeling of gravitational-wave populations for disentangling environmental and modified-gravity effects,2025-10,2510.17398
Observable spins in gravitational waves from compact binary mergers,2025-10,2510.17449
Robustness Analysis and Controller Design of Arm-locking System in Space-based Gravitational Wave Detectors,2025-10,2510.17468
Directional Search for Persistent Gravitational Waves: Results from the First Part of LIGO-Virgo-KAGRA's Fourth Observing Run,2025-10,2510.17487
Tilt-to-length noise subtraction with pointing jitters from closed-loop dynamics for TianQin,2025-10,2510.17499
Ionization Rate of Interstellar Neutral Helium from New Horizons/SWAP Observations,2025-10,2510.17563
Einstein gravity extended by a scale covariant scalar field with Bekenstein term and dynamical mass generation,2025-10,2510.17704
Phantom scalar field with arbitrary potential: accelerating scaling attractors,2025-10,2510.17765
Comprehensive analysis of time-domain overlapping gravitational wave transients: A Lensing Study,2025-10,2510.17787
Exorcising ghosts with gravitational waves: cases of ghostful and ghost-free fourth-order gravity,2025-10,2510.17789
Influence of Fermionic Dark Matter on the Structural and Tidal Properties of Neutron Stars,2025-10,2510.17905
Gravity with higher-curvature terms and second-order field equations: $f(\mathcal{R})$ meets Gauss-Bonnet,2025-10,2510.17965
Scalar fields around black hole binaries in LIGO-Virgo-KAGRA,2025-10,2510.17967
Constraining a de Broglie-Bohm quantum bounce cosmology with Planck data,2025-10,2510.18022
Solar Reflected Dark Matter under the Influence of Dark Magnetic Field,2025-10,2510.18028
Ultra-Strongly Self-Interacting Dark Matter: From Phenomenology to Astrophysical Observables,2025-10,2510.18142
Special Relativistic Smoothed Particle Hydrodynamics Based on Riemann Solver,2025-10,2510.18251
Non-linear evolution of the horizontal shear instability in stratified rotating fluids under the complete Coriolis acceleration,2025-10,2510.18386
Causality as a guiding principle for physics beyond General Relativity,2025-10,2510.18419
Designing trajectories in the Earth-Moon system: a Levenberg-Marquardt approach,2025-10,2510.18474
"The Muonic Portal to Vector Dark Matter:connecting precision muon physics, cosmology, and colliders",2025-10,2510.18564
"Constraints on Attractor Models of Inflation and Reheating from Planck, BICEP/Keck, ACT DR6, and SPT-3G Data",2025-10,2510.18656
Comprehensive analysis of dissipative effects in the induced gravitational waves,2025-10,2510.18663
Ultraviolet Completion of the Big Bang in Quadratic Gravity,2025-10,2510.18733
The simplest complexity: The story of the three-body problem,2025-10,2510.18848
Axion Production and Detection Using a Dual NMR-type Experiment,2025-10,2510.18944
Sensitivity forecasts for gravitational-wave detectors to dark matter decaying into gravitons,2025-10,2510.18958
Global time-frequency search for stellar-mass binary black holes in LISA,2025-10,2510.19047
Charge distribution of the gauge-mediation type Q ball,2025-10,2510.19275
Implications of $f(R)$ gravity on late-time cosmic structure growth through a complete description of density perturbations,2025-10,2510.19569
Effects of Dynamical Capture on two equal-mass non-spinning black holes,2025-10,2510.19699
Tracing Inflationary Imprints Through the Dark Ages: Implications for Early Stars and Galaxies Formation,2025-10,2510.19863
Characterising the properties of the atmospheric emission at Teide Observatory in the 10-20 GHz range with QUIJOTE data,2025-10,2510.19878
Warped Dimensions at the Cosmological Collider,2025-10,2510.19900
Detecting White Dwarf Binary Mergers with Gravitational Waves,2025-10,2510.19913
Constraining the Swift Memory Burden Effect with GW250114-like Events,2025-10,2510.19916
Dephasing in binary black hole mergers surrounded by scalar wave dark matter clouds,2025-10,2510.20037
Bound State Perturbations in the Interior of Black Holes,2025-10,2510.20305
Comparative Analysis of Thermal Models for Test Masses in Next-Generation Gravitational Wave Interferometers,2025-10,2510.20338
Data-driven exploration of the neutron $^3\text{P}_2$ pairing gap using Cassiopeia A neutron star observational data,2025-10,2510.20353
On the observation of cosmic strings via gravitational-wave lensing,2025-10,2510.20442
Symbolic Regression and Differentiable Fits in Beyond the Standard Model Physics,2025-10,2510.20453
GUT-Scale Smooth Hybrid Inflation with a Stabilized Modulus in Light of ACT and SPT Data,2025-10,2510.20478
Validation of NANOGrav 15-year data and ACT data by modified inflation in entropic cosmology,2025-10,2510.20484
Are heuristic switches necessary to control artificial viscosity in modern smoothed particle hydrodynamics ?,2025-10,2510.20534
QCD corrections to the electroweak sphaleron rate,2025-10,2510.20594
SENSEI: A Search for Diurnal Modulation in sub-GeV Dark Matter Scattering,2025-10,2510.20889
Ab uno disce omnes: Single-harmonic search for extreme mass-ratio inspirals,2025-10,2510.20891
Compact binary system dynamics at the second post-Newtonian order: analytical formula of the coordinate time for eccentric and circular orbits,2025-10,2510.20935
Grain Boundary Diffusion in Yukawa Crystals,2025-10,2510.20980
CIPHER: Scalable Time Series Analysis for Physical Sciences with Application to Solar Wind Phenomena,2025-10,2510.21022
Scalable Machine Learning Analysis of Parker Solar Probe Solar Wind Data,2025-10,2510.21066
WimPyC: an extension module of WimPyDD for the calculation of WIMP capture in celestial bodies,2025-10,2510.21185
Space waste: An update of the anthropogenic matter injection into Earth atmosphere,2025-10,2510.21328
Optimizing searches for gravitational wave bursts using coherent WaveBurst 2G,2025-10,2510.21411
Gravitational waves from the sound shell model: direct and inverse phase transitions in the early Universe,2025-10,2510.21439
A cosmological model with logarithmic f(T) gravity and H(z) quadratic expansion,2025-10,2510.21466
TES Proton Irradiation Result Analysis for Future Space Applications,2025-10,2510.21534
Exploring potential astrophysical applications of black holes in nonlinear electrodynamics,2025-10,2510.21555
Propellantless space exploration,2025-10,2510.21743
A Search for Ultra-Light Vector Dark Matter with a Rotating Torsion Balance,2025-10,2510.21764
Beyond Point Matching: Evaluating Multiscale Dubuc Distance for Time Series Similarity,2025-10,2510.21824
Electroweak Baryogenesis with BARYONET: a self-contained review of the WKB approach,2025-10,2510.21915
Superhorizon Isocurvature as a Window into Dark Matter Production,2025-10,2510.21917
Seafloor Topography Enhances KM3NeT Sensitivity to ANITA-like Events,2025-10,2510.21929
Bubble wall velocity with out-of-equilibrium corrections,2025-10,2510.21942
Zernike Mode Sorting with Vortex Phase Filters: Perfect Coronagraphs and Ideal Wavefront Sensors,2025-10,2510.21981
Inferring neutron-star Love-Q relations from gravitational waves in the hierarchical Bayesian framework,2025-10,2510.22137
The Ultra Slow-Roll Phase Of Warm Inflation In Braneworld Cosmology,2025-10,2510.22248
Symmetry principles of gravitational perturbations in thermal environments,2025-10,2510.22346
Thermodynamic Geodesics in Bardeen Regular Black Hole: Conventional vs. Modified Geometrothermodynamics Metrics,2025-10,2510.22398
Refined Low-Energy Supernova Constraints on Lepton Flavor Violating Axions,2025-10,2510.22523
Some Properties of Multi-Component Axion Dark Matter,2025-10,2510.22569
Primordial black hole formation from collapsing domain walls with full general relativity,2025-10,2510.22759
Overlapping of photon rings in black hole imaging,2025-10,2510.22804
Exploring the Landscape of Spontaneous CP Violation in Supersymmetric Theories,2025-10,2510.23033
