title,abs_journal,status
A Uniform Analysis of Gas-phase Metallicity Evolution with 1-3 Gyr Time Sampling over the Past 12 Billion Years,arXiv e-prints,success
Discovery of a new transitional type of evolved massive stars with hard ionizing flux,Nature Astronomy,success
VLT/CRIRES+ observations of warm Neptune WASP-107 b: Molecular detections and challenges in ground-based transmission spectroscopy of cooler and cloudy exoplanets,arXiv e-prints,success
Connecting The Hierarchically Merging Binary Black Hole Population To Their Host Galaxies,Monthly Notices of the Royal Astronomical Society,success
"A search for minute-time-scale flares from the transient AT\,2024wpp",The Astrophysical Journal,success
The Missing Hard Photons of Little Red Dots: Their Incident Ionizing Spectra Resemble Massive Stars,arXiv e-prints,success
Radiation pressure role in accreting massive black hole binaries,arXiv e-prints,success
Hillas meets Eddington: the case for blazars as ultra-high-energy neutrino sources,arXiv e-prints,success
The Atacama Cosmology Telescope: Release of A databaSe of millimeTeR ObservatioNs of Asteroids Using acT (ASTRONAUT),arXiv e-prints,success
Addressing Dipole Tension via Clustering in $Λ$CDM and beyond,arXiv e-prints,success
Correcting the fiber-aperture bias affecting galaxy stellar populations in the Sloan Digital Sky Survey. Aperture corrections to absorption indices based on CALIFA integral field observations,arXiv e-prints,success
Asteroseismology of Carbon-Deficient Red Giants: Merger Products of Hierarchical Triple Systems?,The Astrophysical Journal,success
On the optical emission in the mini-outburst of the black hole X-ray binary MAXI J1348-630,arXiv e-prints,success
Constraining the Cosmological Constant from Stellar Orbits Around Sgr A* Using Physics-Informed Neural Networks,arXiv e-prints,success
The Seven Dwarfs illuminated. The impact of radiation on dwarf galaxies and their circumgalactic medium,arXiv e-prints,success
Probing the HI distribution at small scales using 21-cm Intensity Mapping at large scales,arXiv e-prints,success
STCTM: a forward modeling and retrieval framework for stellar contamination and stellar spectra,arXiv e-prints,success
The mass of the Milky Way from outer halo stars measured by DESI DR1,arXiv e-prints,success
"The Impact of Radial Migration on Disk Galaxy SFHs: II. The Role of bar strength, disk thickness, and merger history",arXiv e-prints,success
Polarization aberration modeling of internal occulters for coronagraphs,arXiv e-prints,success
The Binding Energies of Atoms on Amorphous Silicate Dust: A Computational Study,arXiv e-prints,success
DIPLODOCUS I: Framework for the evaluation of relativistic transport equations with continuous forcing and discrete particle interactions,arXiv e-prints,success
Improved limits on the 21cm signal at z=6.5-7.0 with the MWA using Gaussian information,arXiv e-prints,success
A second-generation star in a relic dwarf galaxy,arXiv e-prints,success
Fast radio bursts as cosmic lightning,arXiv e-prints,success
Renzo's rule revisited: A statistical study of galaxies' baryon - dark matter coupling,Monthly Notices of the Royal Astronomical Society,success
Beta Canis Majoris: The Other Major Ionization Source of the Local Interstellar Clouds,arXiv e-prints,success
The First Radio-Bright Off-Nuclear TDE 2024tvd Reveals the Fastest-Evolving Double-Peaked Radio Emission,The Astrophysical Journal,success
"Hot springs and dust reservoirs: JWST reveals the dusty, molecular aftermath of extragalactic stellar mergers",arXiv e-prints,success
3D hydrodynamic simulations of massive main-sequence stars -- IV. Internal gravity waves matter for SLF variability,arXiv e-prints,success
Automated Spectroscopic Wavelength Calibration using Dynamic Time Warping,arXiv e-prints,success
Evidence For Turbulent Concentration In Particle-Laden Midplane Layers of Planet-Forming Disks,arXiv e-prints,success
Excavating The Ruins: an Ancient $z=2.675$ Galaxy Which Formed in the First 500 Myr,arXiv e-prints,success
The Consequences of Rubin Observatory Time-Domain Survey Design and Host-Galaxy Contamination on the Identification of Binary Supermassive Black Holes,arXiv e-prints,success
Laboratory Modeling of Supernova Remnants Collisions: Implications for Triggered Star Formation,arXiv e-prints,success
Gas Giant and Brown Dwarf Companions: Mass Ratio and Orbital Distributions From A stars to M dwarfs,arXiv e-prints,success
Supervised Machine Learning Methods with Uncertainty Quantification for Exoplanet Atmospheric Retrievals from Transmission Spectroscopy,arXiv e-prints,success
A semi-coherent search for optical pulsations from Scorpius X-1,arXiv e-prints,success
"Polarization of reflected X-ray emission from Sgr A molecular complex: multiple flares, multiple sources?",arXiv e-prints,success
Evaluating the Accuracy of Reionization Prescriptions in Semi-analytic Models of the First Stars and Galaxies,arXiv e-prints,success
Physical properties of galaxies and the UV Luminosity Function from $z\sim6$ to $z\sim14$ in COSMOS-Web,arXiv e-prints,success
CLASH-VLT: The variance of the velocity anisotropy profiles of galaxy clusters,arXiv e-prints,success
Metallicity of Active Galactic Nuclei from ultraviolet and optical emission lines-II. Revisiting the $C43$ metallicity calibration and its implications,Monthly Notices of the Royal Astronomical Society,success
Spatially resolved gas-phase metallicity at z~2-3 with JWST/NIRISS,arXiv e-prints,success
"JWST+ALMA reveal the ISM kinematics and stellar structure of MAMBO-9, a merging pair of DSFGs in an overdense environment at $z=5.85$",arXiv e-prints,success
Mapping the Distant and Metal-Poor Milky Way with SDSS-V,arXiv e-prints,success
"A Census of Variable Radio Sources at $3\,$GHz",arXiv e-prints,success
Predictive calibration for digital sun sensors using sparse submanifold convolutional neural networks,arXiv e-prints,success
CUbesat Solar Polarimeter (CUSP) Sensitivity Estimation and Performance Optimization using Geant4,arXiv e-prints,success
A normalizing flow approach for the inference of star cluster properties from unresolved broadband photometry I: Comparison to spectral energy distribution fitting,arXiv e-prints,success
Analogues of the Milky Way-Sagittarius interaction in the TNG50: effect on the Milky Way,arXiv e-prints,success
Cosmological Zoom-In Simulation of Odd Radio Circles as Merger-Driven Shocks in Galaxy Groups,arXiv e-prints,success
Star formation histories and gas content limits of three ultra-faint dwarfs on the periphery of M31,arXiv e-prints,success
Challenges to the Two-Infall Scenario by Large Stellar Age Catalogs,arXiv e-prints,success
Equation vs. AI: Predict Density and Measure Width of molecular clouds by Multiscale Decomposition,arXiv e-prints,success
Estimate of Current Mass of the Large Magellanic Cloud from the Orphan-Chenab Tidal Stream,The Astrophysical Journal,success
Disks no more: the morphology of low-mass simulated galaxies in FIREbox,Monthly Notices of the Royal Astronomical Society,success
Forming Double Neutron Stars using Detailed Binary Evolution Models with POSYDON: Comparison to the Galactic Systems,arXiv e-prints,success
Deciphering the Physical Origin of GRB 240825A: A Long GRB Lacking a Bright Supernova,arXiv e-prints,success
Towards the Habitable Worlds Observatory: 1D CNN Retrieval of Reflection Spectra from Evolving Earth Analogs,arXiv e-prints,success
The Simons Observatory: Assessing the Impact of Dust Complexity on the Recovery of Primordial $B$-modes,Journal of Cosmology and Astroparticle Physics,success
Artificial Broadcasts as Galactic Populations: III. Constraints on Radio Broadcasts from the Cosmic Population of Inhabited Galaxies,Publications of the Astronomical Society of the Pacific,success
Rapid cosmological inference with the two-loop matter power spectrum,arXiv e-prints,success
A late-time view of the progenitor candidates of the Type II-P SN 2009ib and SN 2012ec,The Astrophysical Journal,success
Development of Space Qualified Signal Processing Readout Electronics for HabWorlds and Origins Space Telescope Detector and Arrays,arXiv e-prints,success
A Joint Search for the Electromagnetic Counterpart to the Gravitational-Wave Binary Black-Hole Merger Candidate S250328ae with the Dark Energy Camera and the Prime Focus Spectrograph,arXiv e-prints,success
A Nitrogen-rich AGN Powering a Large Ionizing Bubble at z=8.63,arXiv e-prints,success
Testing Dark Matter with Generative Models for Extragalactic Stellar Streams,arXiv e-prints,success
"Optical and near-infrared nebular-phase spectroscopy of SN 2024ggi: constraints on the structure of the inner ejecta, progenitor mass, and dust",arXiv e-prints,success
X-ray Polarimetry of Accreting White Dwarfs: A Case Study of EX Hydrae,The Astrophysical Journal,success
Human vs. machine -- 1:3. Joint analysis of classical and ML-based summary statistics of the Lyman-$α$ forest,arXiv e-prints,success
Revealing a ribbon-like jet in OJ 287 with RadioAstron,Astronomy and Astrophysics,success
Using Faded Changing-Look Quasars to Unveil the Spectral Energy Distribution Evolution of Low-Luminosity Active Galactic Nuclei,arXiv e-prints,success
"HAWC, VERITAS, Fermi-LAT and XMM-Newton follow-up observations of the unidentified ultra-high-energy gamma-ray source LHAASO J2108+5157",The Astrophysical Journal,success
Energy flow and radiation efficiency in radiative GRMHD simulations of neutron star ultraluminous X-ray sources,The Astrophysical Journal,success
Pre-discovery TESS Observations of Interstellar Object 3I/ATLAS,The Astrophysical Journal,success
"Exploring the Origins of Optical Variability in AGNs: Correlations with Black Hole Properties, X-ray, and Radio Emission",arXiv e-prints,success
The Interpolation Constraint in the RV Analysis of M-Dwarfs Using Empirical Templates,The Astronomical Journal,success
The explosion jets of the core-collapse supernova remnant Circinus X-1,arXiv e-prints,success
Inside-Out Planet Formation. VIII. Onset of Planet Formation and the Transition Disk Phase,arXiv e-prints,success
Signature of the explosion mechanism of Type-Ia SNe in substructures of the remnant: the case of Tycho's SNR,arXiv e-prints,success
Population III star formation near high-redshift active galactic nuclei,arXiv e-prints,success
"A massive, evolved slow-rotating galaxy in the early Universe",arXiv e-prints,success
The Type II SN 2025pht in NGC 1637: A Red Supergiant with Carbon-rich Circumstellar Dust as the First JWST Detection of a Supernova Progenitor Star,The Astrophysical Journal,success
Pulsations change the structures of massive stars before they explode: interpreting the nearby supernova SN 2023ixf,arXiv e-prints,success
Explosions of pulsating red supergiants: a natural pathway for the diversity of Type II-P/L supernovae,Astronomy and Astrophysics,success
Not-so-heavy metal(s): Chemical Abundances in the Ultra-faint Dwarf Galaxies Eridanus IV and Centaurus I,arXiv e-prints,success
Developments on LLNL's high contrast testbed and Lick/ShaneAO,arXiv e-prints,success
SN 2021aaev: a Hydrogen-Rich Superluminous Supernova with Early Flash and Long-Lived Circumstellar Interaction in an Unusual Host Environment,arXiv e-prints,success
The AURORA Survey: High-Redshift Empirical Metallicity Calibrations from Electron Temperature Measurements at z=2-10,arXiv e-prints,success
In-orbit Spectral Calibration Prospects for the COSI Space Telescope,arXiv e-prints,success
Constraining fuzzy dark matter with the 21-cm power spectrum from Cosmic Dawn and Reionization,Physical Review D,success
"An automated, self-calibration based pipeline for high-fidelity solar imaging with LOFAR: SIMPL",Astronomy and Astrophysics,success
Arecibo Wow! II: Revised Properties of the Wow! Signal from Archival Ohio SETI Data,arXiv e-prints,success
"Thermospheric Density, Composition, and Temperature from GOES-R/SUVI Solar Occultations",Space Weather,success
Stochasticity in Stellar Yields Reflected in Theoretical Dust Masses Estimates Across all Type II Supernova Progenitors,arXiv e-prints,success
An empirical determination of the Cosmic Shoreline,arXiv e-prints,success
Energy relaxation in superthermal collisions of carbon with oxygen: the influence of isotopic substitution,Monthly Notices of the Royal Astronomical Society,success
Image Profile (IMPRO) Fitting of Massive Protostars. I. Method Development and Test Cases of Cepheus A and G35.20-0.74N,arXiv e-prints,success
A test of Ca ii H & K photometry for isolating massive globular clusters below the metallicity floor,Astronomy and Astrophysics,success
From ANN to BNN: Inferring Reionization Parameters using Uncertainty-aware Emulators of 21-cm Summaries,arXiv e-prints,success
Aligned Stellar Obliquities for Two Hot Jupiter-hosting M Dwarfs Revealed by MAROON-X: Implications for Hot Jupiter Formation,The Astronomical Journal,success
A 15 Mpc rotating galaxy filament at redshift z = 0.032,Monthly Notices of the Royal Astronomical Society,success
"The highest mass Kepler red giants -- II. Spectroscopic parameters, the amplitude-activity relation, and unexpected halo orbits",Monthly Notices of the Royal Astronomical Society,success
Late-time Hubble Space Telescope Ultraviolet Spectra of SN 2023ixf and SN 2024ggi Show Ongoing Interaction with Circumstellar Material,arXiv e-prints,success
The End of the Road for Far-infrared Reddening Maps? Evidence for Reddening Errors Driven by Changes in PAH Abundance,The Astrophysical Journal,success
Polarized Emission of Intrabinary Shocks in Spider Pulsars from Global 3D Kinetic Simulations,The Astrophysical Journal,success
The JWST Rocky Worlds DDT Program reveals GJ 3929b to likely be a bare rock,The Astrophysical Journal,success
Type IIb Supernova Progenitors in 3D: Variability and Episodic Mass Loss revealed by Radiation-Hydrodynamics Simulations,arXiv e-prints,success
How the cosmic voids contribute to stalling and quenching the giant galaxies on their surfaces,arXiv e-prints,success
"Examining AGN UV/Optical Variability Beyond the Simple Damped Random Walk. II. Insights from 22 Years Observations of SDSS, PS1 and ZTF",The Astrophysical Journal,success
The origin of extreme N-emitters in star-forming galaxies at z$<$0.5 with DESI DR1,arXiv e-prints,success
MAGAZ3NE: Far-IR and Radio Insights into the Nature and Properties of Ultramassive Galaxies at $z\gtrsim3$,arXiv e-prints,success
A Bayesian Benchmarking of GBEES Applied to Outer Planet Orbiter Estimation,arXiv e-prints,success
White dwarfs in wide binaries: the strong effects of stellar evolution and mass loss,The Astrophysical Journal,success
On bursty star formation during cosmological reionization -- influence on the metal and dust content of low-mass galaxies,arXiv e-prints,success
Universal power-law distribution functions in an electromagnetic kinetic plasma: implications for the inverted temperature profile in the solar corona,arXiv e-prints,success
JWST Discovery of Strong Lensing from a Galaxy Cluster at Cosmic Noon: Giant Arcs and a Highly Concentrated Core of XLSSC 122,The Astrophysical Journal,success
On the Origin of Neutron-capture Elements in r-I and r-II Stars: A Differential-abundance Analysis,The Astrophysical Journal,success
Multi-resolution kinematic modelling of nearby galaxies: a demonstration using MHONGOOSE observations,arXiv e-prints,success
"Additive manufacturing in aluminium of a primary mirror for a CubeSat application: manufacture, testing and evaluation",arXiv e-prints,success
Evidence for optical pulsations from a redback millisecond pulsar,Astronomy and Astrophysics,success
Pushchino multibeam pulsar search. VII. The results of the timing of 12 slow pulsars,arXiv e-prints,success
Unraveling the Secrets of the lower Solar Atmosphere: One year of Operation of the Solar Ultraviolet Imaging Telescope (SUIT) on board Aditya-L1,arXiv e-prints,success
Do Rocky Planets around M Stars Have Atmospheres? A Statistical Approach to the Cosmic Shoreline,arXiv e-prints,success
Mitigating incoherent excess variance in high-redshift 21-cm observations with multi-output cross Gaussian process regression,Astronomy and Astrophysics,success
The Three Hundred Project: deducing the stellar splashback structure of galaxy clusters from their orbiting profiles,arXiv e-prints,success
A tunable Monte Carlo method for mixing correlated-k opacities. PRAS: polynomial reconstruction and sampling,arXiv e-prints,success
Pushchino Multibeam Pulsar Search. VIII. Pulsar with a period of 40.9~s in observations of the LPA LPI,arXiv e-prints,success
Mapping Jet-Gas Coupling and energetic ionized outflows in High-Redshift Radio Galaxies with JWST/NIRSpec,arXiv e-prints,success
SN 2023ixf in M101: physical parameters from bolometric light curve modeling,The Astrophysical Journal,success
Properties of cluster red-sequence spiral galaxies,arXiv e-prints,success
Reionization in Protocluster Environments at $z>7$ with JWST/NIRSpec,arXiv e-prints,success
Gravitational Wave Signatures of Quasi-Periodic Eruptions: LISA Detection Prospects for RX J1301.9+2747,arXiv e-prints,success
A dual AGN at z = 5.4 associated with a Lyman-alpha Nebula in the Center of a Cosmic Filament,Monthly Notices of the Royal Astronomical Society,success
Tracing Large Scale Structure Morphology with Multiwavelength Line Intensity Maps,arXiv e-prints,success
Dynamical properties of high-[Mg/Fe] stars in the Milky Way bar region,Monthly Notices of the Royal Astronomical Society,success
A New Method of Deriving Doppler Velocities for Solar Orbiter SPICE,arXiv e-prints,success
Balmer series fluxes from Pop. III Stars: A-SLOTH Predictions for JWST Observability,arXiv e-prints,success
Evolution of a Long-Lived Deep-Seated Main-Sequence Magnetic Field During White Dwarf Cooling,arXiv e-prints,success
Magnetic flux ropes within reconnection exhausts close to the centers of heliospheric current sheets near the Sun,arXiv e-prints,success
"The Impact of ${}^{12} \mathrm{C}(α, γ)^{16} \mathrm{O}$ Reaction on the Evolution of He Stars",Research in Astronomy and Astrophysics,success
RX Gru: a short-period pre-main-sequence eclipsing binary with a distant circumbinary companion,arXiv e-prints,success
A novel algorithm for GPU-accelerated particle-mesh interactions implemented in the QUOKKA code,arXiv e-prints,success
Exploring the impact of AGN feedback model variations on the Lyman-$α$ Forest Flux Power Spectrum,arXiv e-prints,success
Echoes from the Dark: Galaxy Catalog Incompleteness in Standard Siren Cosmology,arXiv e-prints,success
Black Hole Collisions With Thin Accretion Disks: OJ 287 and Small-Mass-Ratio Supermassive Black Hole Binary Candidates,The Astrophysical Journal,success
DESI Strong Lens Foundry III: Keck Spectroscopy for Strong Lenses Discovered Using Residual Neural Networks,arXiv e-prints,success
DESI Strong Lens Foundry IV: Spectroscopic Confirmation of DESI Lens Candidates with VLT/MUSE,arXiv e-prints,success
Star-forming galaxies in the cosmic web in the last 11 Gyr,arXiv e-prints,success
A Decade of Transit-Timing Measurements Confirm Resonance in the K2-19 System,The Astronomical Journal,success
RAVEN: RAnking and Validation of ExoplaNets,arXiv e-prints,success
Environmental history of filament galaxies: stellar mass assembly and star-formation of filament galaxies,arXiv e-prints,success
"BepiColombo at Mercury: Three flybys, three magnetospheres",arXiv e-prints,success
eROSITA-selection of new period-bounce Cataclysmic Variables: First follow-up confirmation using TESS and SDSS,arXiv e-prints,success
Atmospheric Dispersion Measurement at Hanle Site,arXiv e-prints,success
Islands of Electromagnetic Tranquility in Our Galactic core and Little Red Dots that Shelter Molecules and Prebiotic Chemistry,arXiv e-prints,success
The Growth of Dust in Galaxies in the First Billion Years with Applications to Blue Monsters,arXiv e-prints,success
The Streaming Instability in 3D: Conditions for Strong Clumping,arXiv e-prints,success
Recalibration of the H$α$ surface brightness-radius relation for planetary nebulae using Gaia DR3: new distances and the Milky Way oxygen radial gradient,arXiv e-prints,success
Lyman-$α$ Escape through Anisotropic Media,arXiv e-prints,success
3D Macro Physics and Light Odd-Z Element Production in O-C Shell Mergers: Implications for $^{40}\mathrm{K}$ production and radiogenic heating inventories of rocky exoplanets,arXiv e-prints,success
Biasing from galaxy trough and peak profiles with the DES Y3 redMaGiC galaxies and the weak lensing mass map,arXiv e-prints,success
Searching for GEMS: TOI-5349b is a Saturn-like planet orbiting a metal-rich early M-dwarf,The Astronomical Journal,success
The evolution of velocity dispersion in the Sco-Cen OB association,arXiv e-prints,success
A self-consistent numerical model of internal wave-induced mean flow oscillations in polar geometry,arXiv e-prints,success
A Yin-Yang Galaxy Cluster Merger in Abell 1914 Revealed by XRISM,The Astrophysical Journal,success
Vacuum birefringence in the polarized X-ray emission of a radio magnetar,arXiv e-prints,success
"The Cosmic Rush Hour: Rapid Formation of Bright, Massive, Disky, Star-Forming Galaxies as Signatures of Early-Universe Physics",arXiv e-prints,success
Jittering jets promote dust formation in core-collapse supernovae,arXiv e-prints,success
Two-moment cosmic ray transport in RAMSES,arXiv e-prints,success
Southern massive stars at high angular resolution. Physical separations and mass ratios,arXiv e-prints,success
"Theory, Simulations and Observations of Stellar Mergers",arXiv e-prints,success
"Efficient Particle Acceleration in 2.5-Dimensional, Hybrid-Kinetic Simulations of Decaying, Supersonic, Plasma Turbulence",arXiv e-prints,success
An analysis and cosmological study of the propagation of gravitational radiation under a graviton of nonzero mass,Physical Review D,success
Galactic Center Gamma-Ray Emission in MHD Galaxy Formation Simulations with Full Cosmic Ray Spectra,arXiv e-prints,success
The Metallicity Dependence of PAH Emission in Galaxies II: Insights from JWST/NIRCam Imaging of the Smallest Dust Grains in M101,arXiv e-prints,success
A Comprehensive Analysis of Three Microlensing Planet Candidates with the Planet/Binary Degeneracy,Monthly Notices of the Royal Astronomical Society,success
The Timescales of Embedded Star Formation as Observed in STARFORGE,arXiv e-prints,success
Lyman-alpha emission at the end of reionization: line strengths and profiles from MMT and JWST observations at z~5-6,arXiv e-prints,success
Simulating Image Coaddition with the Nancy Grace Roman Space Telescope. IV. Hyperparameter Optimization and Experimental Features,arXiv e-prints,success
The JWST EXCELS survey: Insights into the nature of quenching at cosmic noon,arXiv e-prints,success
A multi-object approach for studying exoplanet atmospheres using high-resolution spectrographs,arXiv e-prints,success
X-ray emission of F-type stars and its analogy with G-type stars,arXiv e-prints,success
WaveDriver: a Laser Guide Star AO System for HWO,arXiv e-prints,success
TOI-2155b: a high-mass brown dwarf near the hydrogen burning mass limit from the TESS mission,arXiv e-prints,success
The Yasone catalogue: three new Milky Way satellites and 17 further hypercompact candidates,arXiv e-prints,success
Distance measurements from the internal dynamics of globular clusters: Application to the Sombrero galaxy (M 104),arXiv e-prints,success
Conditioning halos on the tidal environment for fast and accurate HI power spectra during reionization,arXiv e-prints,success
MCI: Multi-Channel Imager on the Chinese Space Station Survey Telescope,arXiv e-prints,success
Polarimeter to Unify the Corona and Heliosphere (PUNCH),arXiv e-prints,success
LOFAR 58 MHz Legacy Survey of the 3CRR Catalog,Astronomy and Astrophysics,success
"Mass Transport, Turbulent Mixing, and Inflow in Black Hole Accretion",The Astrophysical Journal,success
Searching for radio emission from radio quiet magnetars with MeerKAT,arXiv e-prints,success
A Pearl in the Shell: an ultra-compact dwarf within the tidal debris surrounding spiral galaxy NGC 7531,arXiv e-prints,success
"The Galaxy Activity, Torus, and Outflow Survey (GATOS): TBD. Unveiling physical processes in local active galaxies. Unsupervised hierarchical clustering of JWST MIRI/MRS observations",arXiv e-prints,success
"A simple, flexible method for timing cross-calibration of space missions",arXiv e-prints,success
Dichotomy in Long-Lived Radio Emission from Tidal Disruption Events AT 2020zso and AT 2021sdu: Multi-Component Outflows vs. Host Contamination,arXiv e-prints,success
"200,000+ Deep Learning Inferred Periods of Stellar Variability from The All-Sky Automated Survey for Supernovae",arXiv e-prints,success
KID Detector Readout Electronics Development for Habitable Worlds Observatory,arXiv e-prints,success
Mapping the SO2 Shoreline in Gas Giant Exoplanets,The Astrophysical Journal,success
M&M33: MUSE and M33 I. Unveiling the Diversity of HII Regions in M33 with MUSE,arXiv e-prints,success
Lensed stars in galaxy-galaxy strong lensing -- a JWST prediction for the Cosmic Horseshoe,Monthly Notices of the Royal Astronomical Society,success
Two-phase formation of galaxies: the coevolution between galaxies and dark matter halos,arXiv e-prints,success
Euclid preparation. Predicting star-forming galaxy scaling relations with the spectral stacking code SpectraPyle,arXiv e-prints,success
The Nature of High-Redshift Massive Quiescent Galaxies -- Searching for RUBIES-UDS-QG-z7 in FLARES,arXiv e-prints,success
REBELS-IFU: on the origin of the elevated [OIII]/[CII] ratios in the early Universe,arXiv e-prints,success
A New Way to Discover Strong Gravitational Lenses: Pair-wise Spectroscopic Search from DESI DR1,arXiv e-prints,success
New determination of the neutrino hadronic production cross sections from GeV to beyond PeV energies,arXiv e-prints,success
