title,abs_journal,status
From Primordial Stars to Early Galaxies: A Semi-Analytic Model Calibrated with Aeos and Renaissance,arXiv e-prints,success
Impact of Cosmic Ray Acceleration on the Early Evolution of Bow Shocks around Massive Runaway Stars,arXiv e-prints,success
Lanthanide Impact on the Infra-Red Spectra of Nebular Phase Kilonovae,arXiv e-prints,success
Infrared spectral signatures of light r-process elements in kilonovae,arXiv e-prints,success
Is Milky Way stable all the way ? A TNG50 view from cosmic noon to the present day,arXiv e-prints,success
Computational advances and challenges in simulations of turbulence and star formation,arXiv e-prints,success
Violent mergers can explain the inflated state of some of the fastest stars in the Galaxy,arXiv e-prints,success
The AURORA Survey: Ionizing Photon Production Efficiency with Minimal Nebular Dust Attenuation Systematics,arXiv e-prints,success
Beyond the Brightest: A Deep Learning Approach to Identifying Major and Minor Galaxy Mergers in CANDELS at $z \sim 1$,arXiv e-prints,success
Eternal inflation bubble collision signature on CMB remote dipole and quadrupole fields,arXiv e-prints,success
A census of quiescent galaxies across $0.5 < z < 8$ with JWST/MIRI: Mass-dependent number density evolution of quiescent galaxies in the early Universe,arXiv e-prints,success
JADES Dark Horse: demonstrating high-multiplex observations with JWST/NIRSpec dense-shutter spectroscopy in the JADES Origins Field,arXiv e-prints,success
Deep JWST spectroscopy of galaxies in a candidate ionized bubble at $z = 8.7$: probing reionization at pMpc scales with Ly$α$ emission,arXiv e-prints,success
Intrinsic alignment of disks and ellipticals across hydrodynamical simulations,arXiv e-prints,success
Argus: JAX state-space filtering for gravitational wave detection with a pulsar timing array,arXiv e-prints,success
Resonant W and Z Boson Production in FSRQ Jets: Implications for Diffuse Neutrino Fluxes,arXiv e-prints,success
On the discovery of meteoritic mineral Zolenskyite; The artificial origin should not be overlooked,arXiv e-prints,success
Deep Learning in Astrophysics,arXiv e-prints,success
Co-evolution of Nuclear Star Clusters and Massive Black Holes: Extreme Mass-Ratio Inspirals,arXiv e-prints,success
"Measuring the Evolution of Bulge, Disk and Colour Gradients in HST Observations of Galaxies with 3D Modelling",arXiv e-prints,success
Reanalysis of the eclipses of LHS 1140 c: No evidence of an atmosphere and implications for the internal structure of the planet,arXiv e-prints,success
Feeding the dead: neutral gas inflow with suppressed star formation in a long-quenched ancient massive galaxy at z~2.7 observed with JWST/NIRSpec,arXiv e-prints,success
The GAPS programme at TNG XYZ. A sub-Neptune suitable for atmospheric characterization in a multiplanet and mutually inclined system orbiting the bright K dwarf TOI-5789 (HIP 99452),arXiv e-prints,success
MANGOS II: Five new giant planets orbiting low-mass stars,arXiv e-prints,success
JWST/MIRI-MRS view of the metal-poor galaxy CGCG 007-025: the spatial location of PAHs and very highly ionized gas,arXiv e-prints,success
Locating Centers of Clusters of Galaxies with Quadruple Images: Witt's Hyperbola and a New Figure of Merit,arXiv e-prints,success
The chemodynamical memory of a major merger in a NIHAO-UHD Milky Way analogue I: A golden thread through time and space,arXiv e-prints,success
PDRs4All XVII: Formation and excitation of HD in photodissociation regions. Application to the Orion Bar,arXiv e-prints,success
MSA-3D: Uncovering Weak AGNs and Resolved Outflows in Disguise in $z\sim1$ Star-Forming Galaxies,arXiv e-prints,success
REBELS-IFU: Linking damped Lyman-$α$ absorption to [CII] emission and dust content in the EoR,arXiv e-prints,success
Revisiting FRB 20121102A: milliarcsecond localisation and a decreasing dispersion measure,arXiv e-prints,success
JWST COSMOS-3D: Spectroscopic Census and Luminosity Function of [O III] Emitters at 6.75<z<9.05 in COSMOS,arXiv e-prints,success
Habitable from the start: How initial planetary formation conditions may create habitable worlds,arXiv e-prints,success
Excitation of Inertial Modes in 3D Simulations of Rotating Convection in Planets and Stars,arXiv e-prints,success
Bayesian polarization calibration and imaging in very long baseline interferometry,arXiv e-prints,success
FQ Circini: An Ordinary Nova with a High-mass B1 V(n)(e) Companion Whose Decretion Disk Transfers Mass to the White Dwarf via Roche-Lobe Overflow,arXiv e-prints,success
Dynamical fractalization of ring systems,arXiv e-prints,success
A study of transients from ground-based surveys reveals new AM CVn stars,arXiv e-prints,success
An Investigation of Systematic Effects from Background Priors on PSR J0740$+$6620 Radius Estimates using Synthetic NICER and XMM-Newton Data,arXiv e-prints,success
Evolution mapping III: A new recipe for the halo mass function,arXiv e-prints,success
MAMMOTH-Grism: Revisiting the Mass-Metallicity Relation in Protocluster Environments at Cosmic Noon,arXiv e-prints,success
Coupled atmospHere Interior modeL Intercomparison (CHILI) Protocol Version 1.0: A CUISINES Intercomparison Project of Magma Ocean Models,arXiv e-prints,success
Analytical Solutions for Planet-Scattering Small Bodies,arXiv e-prints,success
"Aql X-1 from dawn 'til dusk: the early rise, fast state transition and decay of its 2024 outburst",arXiv e-prints,success
Accelerating Reionization Constraints: An ANN-Emulator Framework for the SCRIPT Semi-numerical Model,arXiv e-prints,success
Solar Cycle 25 Dynamics from Observational and Statistical Parameters: Characterization of the Maximum Phase and Rotational Behaviour,arXiv e-prints,success
Resonant structures in exozodiacal clouds created by exo-Earths in the habitable zone of late-type stars,arXiv e-prints,success
Broadband X-ray observations of the periodic optical source ZTF J185139.81+171430.3 and its identification as a massive intermediate polar,arXiv e-prints,success
An Overabundance of Radio-AGN in the SPT2349-56 Protocluster: Preheating the Intra-Cluster Medium,arXiv e-prints,success
Hierarchical Interferometric Bayesian Imaging,arXiv e-prints,success
Detecting the signature of helium reionization through 3HeII 3.46cm line-intensity mapping,arXiv e-prints,success
Prospects for measuring the Doppler magnification dipole with LSST and DESI,arXiv e-prints,success
Verifying the failing supernova constraint on dark photons with two-dimensional hydrodynamic simulations,arXiv e-prints,success
Comparing galaxy merger orbits in hydrodynamical simulation and in dark-matter-only simulation,arXiv e-prints,success
Constructing Earth Formation History Using Deep Mantle Noble Gas Reservoirs,arXiv e-prints,success
Discovering periodic and repeating nuclear transients in the XMM-Newton archives,arXiv e-prints,success
Deep Learning Analysis of Ions Accelerated at Shocks,arXiv e-prints,success
Deep Investigation of Neutral Gas Origins (DINGO): Options for robust Deep Spectral Line Imaging in the SKA-Era,arXiv e-prints,success
SN 2019vxm: A Shocking Coincidence between Fermi and TESS,arXiv e-prints,success
Post-Supernova Accretion of Light Elements onto a New-Born Neutron Star and NS 1987A,arXiv e-prints,success
RIOJA. Dusty outflows and density-complex ISM in the N-enhanced lensed galaxy RXCJ2248-ID at z=6.1,arXiv e-prints,success
Point-symmetric morphology in supernova remnant G11.2-0.3: the jittering jets explosion mechanism,arXiv e-prints,success
The Eddington Ratio Distribution of Narrow Line Active Galactic Nuclei,arXiv e-prints,success
Forecasting Synchrotron Spectral Parameters with QUIJOTE-MFI2 in combination with Planck and WMAP,arXiv e-prints,success
The Role of Binary Configuration in Shaping Nova Evolution via Wind Accretion in Symbiotic Systems,arXiv e-prints,success
VENUS: A Strongly Lensed Clumpy Galaxy at $z\sim11-12$ behind the Galaxy Cluster MACS J0257.1-2325,arXiv e-prints,success
Starlight-driven flared-staircase geometry in radiation hydrodynamic models of protoplanetary disks,arXiv e-prints,success
Dynamics in the Cores of Self-Interacting Dark Matter Halos: Reduced Stalling and Accelerated Core Collapse,arXiv e-prints,success
First Mid-infrared Detection and Modeling of a Flare from Sgr A*. II. Mid-IR Spectral Energy Distribution and Millimeter Polarimetry,arXiv e-prints,success
Localized Deviations from the CO-PAH Relation in PHANGS-JWST Galaxies: Faint PAH Emission or Elevated CO Emissivity?,arXiv e-prints,success
"Delayed Wind Onset in Pa 30, the Remnant of Type Iax SN 1181",arXiv e-prints,success
SN 2023taz: Implications for the UV Diversity of Superluminous Supernovae,arXiv e-prints,success
Delayed radio emission in tidal disruption events from collisions of outflows driven by disk instabilities,arXiv e-prints,success
ExoClock Project IV: A homogeneous catalogue of 620 updated exoplanet ephemerides,arXiv e-prints,success
The SRG/eROSITA all-sky survey: X-ray scaling relations of galaxy groups and clusters in the western Galactic hemisphere,arXiv e-prints,success
"Simulations of a Conducting Sphere Moving through Magnetized Plasma: Alfvén Wings, Slow Magnetosonic Wings, and Drag Force",arXiv e-prints,success
Mean Mass Density near the Sun from the Divergence Theorem and Pulsar Accelerations,arXiv e-prints,success
Methane on the temperate exo-Saturn TOI-199b,arXiv e-prints,success
The SPHEREx Image and Spectrophotometry Processing Pipeline,arXiv e-prints,success
Do z>6 quasars reside in protoclusters?,arXiv e-prints,success
A first look at a complete view of spatially resolved star formation at 1<z<1.8 with JWST NGDEEP+FRESCO slitless spectroscopy,arXiv e-prints,success
Evolution of action-space coherence in a Milky Way-like simulation,arXiv e-prints,success
Electron Cyclotron Maser Emission as the Driving Mechanism in Long-Period Radio Transients,arXiv e-prints,success
A JWST Transit of a Jupiter Analog: II. A Search for Exomoons,arXiv e-prints,success
Type Iax supernovae as a source of iron-rich silicate dust,arXiv e-prints,success
Interacting binaries on the Main Sequence as in-situ tracers of mass transfer efficiency and stability,arXiv e-prints,success
The impact of magnetic fields during tidal disruption events,arXiv e-prints,success
A Paradigm Shift in Exoplanet False Positive Identification with HIP-44302,arXiv e-prints,success
Statistical Properties of Cold Streams In Massive Star-Forming Halos in IllustrisTNG-50,arXiv e-prints,success
Effects of Resolution and Local Stability on Galactic Disks: I. Multiple Spiral Mode Formation via Swing Amplification,arXiv e-prints,success
Little Red Dots host Black Hole Stars: A unified family of gas-reddened AGN revealed by JWST/NIRSpec spectroscopy,arXiv e-prints,success
J-PAS: A value-added catalogue of optical line intensities for nebular emission galaxies (JOLINES),arXiv e-prints,success
LYRA ultra-faints: The emergence of faint dwarf galaxies in the presence of an early Lyman-Werner background,arXiv e-prints,success
Numerical implementation of flat FLRW models of cosmic expansion with Planck 2018 cosmological parameters,arXiv e-prints,success
The Atacama Cosmology Telescope: $B$-mode delensing with DR6 data and external tracers of large-scale structure,arXiv e-prints,success
The relations between dust properties and galaxy global / integrated quantities in the nearby Universe,arXiv e-prints,success
Galaxy evolution in the post-merger regime. IV - The long-term effect of mergers on galactic stellar mass growth and distribution,arXiv e-prints,success
Spectuner-D1: Spectral Line Fitting of Interstellar Molecules Using Deep Reinforcement Learning,arXiv e-prints,success
The Intermediate Mass Black Hole in Omega Centauri: Constraints on Accretion from JWST,arXiv e-prints,success
Mapping the Galaxy Color-Star Formation Rate Relation with Manifold Learning and Infrared Image Stacking,arXiv e-prints,success
Euclid preparation. Controlling angular systematics in the Euclid spectroscopic galaxy sample,arXiv e-prints,success
Impact of Cosmic Ray Distribution on the Growth and Saturation of Bell Instability,arXiv e-prints,success
Broad-band temporal and spectral study of TeV blazar TXS 0518+211,arXiv e-prints,success
Planet Migration in Protoplanetary Disks with Rims,arXiv e-prints,success
First Results from HERA Phase II,arXiv e-prints,success
Forecasting Primordial Non-Gaussianity from UNIONS Lyman-Break Galaxies and Planck CMB lensing,arXiv e-prints,success
Simulating AGN feedback in galaxy clusters with pre-existing turbulence,arXiv e-prints,success
"Bursty star formation, chemical enrichment, and star cluster formation in numerical analogues of GN-z11",arXiv e-prints,success
Predictions from $s$-process AGB models of the isotopic variations of zirconium and neodymium for comparison to bulk meteorites,arXiv e-prints,success
Properties of Core Collapse Supernovae from Binary Population Synthesis,arXiv e-prints,success
Calcium versus silicon ejecta velocities and decline rates in supernovae Ia: The role of high-velocity features,arXiv e-prints,success
The Kinematic Properties of TŻO Candidate HV 11417 with Gaia DR3,arXiv e-prints,success
Synchrotron Self-Compton Model of TeV Afterglows in Gamma-Ray Bursts,arXiv e-prints,success
Stellar streams around dwarf galaxies in the Local Universe,arXiv e-prints,success
Needle in a Poissonian haystack -- An X-ray astronomer's guide to QPE fishing,arXiv e-prints,success
Classical Cepheids in the Galactic thin disk. I. Abundance gradients through NLTE spectral analysis,arXiv e-prints,success
Vortex Dynamics in the Neutron Star Inner Crust,arXiv e-prints,success
Identifying Transient Hosts in LSST's Deep Drilling Fields with Galaxy Catalogues,arXiv e-prints,success
Age and metallicity of low-mass galaxies: from their centres to their stellar halos,arXiv e-prints,success
Limits on GeV-scale WIMP Annihilation in Dwarf Spheroidals with IceCube DeepCore,arXiv e-prints,success
The Non-universal Pseudo Phase-Space Density Profiles of Symphony Host Halos,arXiv e-prints,success
What do gravitational-wave observations tell us about Luminous Red Novae?,arXiv e-prints,success
Observing bright pulsating white dwarfs with PLATO: A new window into the late stages of stellar evolution,arXiv e-prints,success
Separating the Inseparable: Constraining Arbitrary Primordial Bispectra with Cosmic Microwave Background Data,arXiv e-prints,success
"Spectrophotometric evidence for a metal-bearing, carbonaceous, and pristine interstellar comet 3I/ATLAS",arXiv e-prints,success
Metal enrichment of galaxies in a massive node of the Cosmic Web at $z \sim 3$,arXiv e-prints,success
Connecting clustering and the cosmic web:Observational constraints on secondary halo bias,arXiv e-prints,success
Towards Reconciling Reionization with JWST: The Role of Bright Galaxies and Strong Feedback,arXiv e-prints,success
Constraining properties of dust formed in Wolf-Rayet binary WR 112 using mid-infrared and millimeter observations,arXiv e-prints,success
"SE3D: Testing the recovery of stellar population, dust and structural properties on mock-observed toy model and simulated galaxies",arXiv e-prints,success
Disc breaking and parametric instability in warped accretion discs,arXiv e-prints,success
Fast Radio Bursts from White Dwarf Binary Mergers: Isolated and Triple-Induced Channels,arXiv e-prints,success
Lost and Found - A gallery of overlooked optical nuclear transients from the ZTF archive,arXiv e-prints,success
Enhancing Fast Radio Transient Detection with Mask R-CNN Image Segmentation,arXiv e-prints,success
STORMY : A Real-time Triggering Framework using Yamagawa Solar Spectrograph for Active Solar Emission Observations with the MWA,arXiv e-prints,success
The dawn is quiet II: Gaia XP constraints on the Milky Way's proto-Galaxy from very metal-poor MDF tails,arXiv e-prints,success
SE3D: Building a radiative transfer emulator to fit panchromatic resolved galaxy observations with 3D models of dust and stars,arXiv e-prints,success
Discovery of new N-emitters over a wide redshift range,arXiv e-prints,success
Ashes of Creation: JWST Uncovers Silicate Dust in Massive Star Clusters,arXiv e-prints,success
The Effect of the Fast-Flavor Instability on Core-Collapse Supernova Models: II. Quasi-Equipartition and the Impact of Various Angular Reconstruction Methods,arXiv e-prints,success
TriPoDPy: 1D Tri-Population size distributions forDust evolution in protoplanetary disks,arXiv e-prints,success
From Observations to Simulations: A Neural-Network Approach to Intracluster Medium Kinematics,arXiv e-prints,success
ECOGAL I. Project design and the first catalogue,arXiv e-prints,success
StarEstate: A Python Package for Galactic Population Synthesis,arXiv e-prints,success
High-energy radiation from the pulsar Equatorial Current Sheet,arXiv e-prints,success
The galactic chemical evolution of carbon: Implications for stellar nucleosynthesis,arXiv e-prints,success
Tidal Heating of the Lunar Magma Ocean,arXiv e-prints,success
Observations of [O I] emission in Comets C/2014 Q2 (Lovejoy) and C/2007 N3 (Lulin): Possible Influence of Solar Activity on Oxygen Line Ratios,arXiv e-prints,success
Optical and cm follow-ups of the Changing-Look event in Mkn 590,arXiv e-prints,success
Disc growth and vertical heating of lenticular galaxies in the Fornax cluster,arXiv e-prints,success
Metal-loaded outflows in sub-Milky Way galaxies in the CIELO simulations,arXiv e-prints,success
From Empirical to Physical Model: Direct Fits of Optically Thin Inverse Compton Scattering to Prompt GRB Spectra,arXiv e-prints,success
Projection Effects in Barred Galaxies Causing Wrong Interpretation of Radial Flows,arXiv e-prints,success
Blazars as a Potential Origin of the KM3-230213A Event,arXiv e-prints,success
Combining CMB datasets with consistent foreground modelling,arXiv e-prints,success
Dark Energy Survey Year 3 results: Simulation-based $w$CDM inference from weak lensing and galaxy clustering maps with deep learning. I. Analysis design,arXiv e-prints,success
Environmental effects in stellar mass gravitational wave sources II: Joint detections of eccentricity and phase shifts in binary sub-populations,arXiv e-prints,success
The AGORA High-resolution Galaxy Simulations Comparison Project. X: Formation and Evolution of Galaxies at the High-redshift Frontier,arXiv e-prints,success
Heavy black hole seed survivors in dwarf galaxies: a case study of Leo I,arXiv e-prints,success
Micrometeoroid Impact Rate Analysis for an Artemis-Era Lunar Base,arXiv e-prints,success
SCATTER Common Envelope Formalism for Triples,arXiv e-prints,success
The Dual Nature of Solar Wind Structuring: Resonant Standing Waves and Laval Nozzle Dynamics in Coronal Streamers,arXiv e-prints,success
Empirical measures of the largest amounts of magnetically-induced radius inflation in low-mass stars,arXiv e-prints,success
FermiPhased: A tool for phase-resolved likelihood analysis of Fermi-LAT data,arXiv e-prints,success
How Low Can You Go: Constraining the Effects of Catalog Incompleteness on Dark Siren Cosmology,arXiv e-prints,success
Machine Learning-Driven Analysis of kSZ Maps to Predict CMB Optical Depth $τ$,arXiv e-prints,success
Dents in the Mirror: A Novel Probe of Dark Matter Substructure in Galaxy Clusters from the Astrometric Asymmetry of Lensed Arcs,arXiv e-prints,success
Making the most of pure parallels: Machine learning augmented photometric redshifts for sparse JWST filter sets,arXiv e-prints,success
Hot accretion onto spiral galaxies: the origin of extended and warped HI discs,arXiv e-prints,success
Probing the dawn of galaxies: star formation and feedback in the JWST era through the GAEA model,arXiv e-prints,success
Echoes of the First Stars: Massive Star Evolution in Extremely Metal-Poor Environments with the Habitable Worlds Observatory,arXiv e-prints,success
3D Full Spectrum Fitting: Algorithm Comparison,arXiv e-prints,success
Moderate Nesting and Cross-Equatorial Asymmetry of Active Regions in Solar Cycle 24,arXiv e-prints,success
Constraining gravity with the decay rate of cosmological gravitational potential,arXiv e-prints,success
"Cepheid Metallicity in the Leavitt Law (C- MetaLL) survey: IX: Spectroscopic detection of rare earth Dysprosium, Erbium, Lutetium and Thorium in Classical Cepheids",arXiv e-prints,success
Revealing an Oscillating and Contracting Compact Corona near the Event Horizon of the Supermassive Black Hole in 1ES 1927+654,The Astrophysical Journal,success
Neural Network identification of Dark Star Candidates. II. Spectroscopy,arXiv e-prints,success
Neural Network identification of Dark Star Candidates. I. Photometry,arXiv e-prints,success
Machine-Learning Estimation of Energy Fractions in MHD Turbulence Modes,arXiv e-prints,success
A JWST/NIRSpec Integral Field Unit Survey of Luminous Quasars at z ~ 5-6 (Q-IFU): Rest-frame Optical Nuclear Properties and Extended Nebulae,arXiv e-prints,success
AthenaK Simulations of Magnetized Binary Neutron Star Mergers,arXiv e-prints,success
"A TESS View of Post-Eruption Variability in the Novae V1405 Cas,V1716 Sco, and V1674 Her",arXiv e-prints,success
"APOGEE Chemical Abundances of Stars in the MW Satellites Fornax, Sextans, Draco and Carina",arXiv e-prints,success
Formation Channels of Magnetars,arXiv e-prints,success
Reviving Quadratic Inflation: Minimal Deformation for CMB Compatibility and Reheating Consistency,arXiv e-prints,success
Optimizing broadband microwave absorbers for applications in the 70-200 GHz range,arXiv e-prints,success
Co-existence of Internal Gravity Waves and Tayler-Spruit Magnetic Fields in the Radiative Core of Low-mass Stars,arXiv e-prints,success
Spatially-resolved PAH_3.3 emission and stellar ages in ram pressure stripped clumps at z~0.3,arXiv e-prints,success
Quokka-based understanding of outflows (QED) - IV. Limitations of H$α$ as an outflow diagnostic,arXiv e-prints,success
Linking Warm Dark Matter to Merger Tree Histories via Deep Learning Networks,arXiv e-prints,success
EDGE-INFERNO: How chemical enrichment assumptions impact the individual stars of a simulated ultra-faint dwarf galaxy,arXiv e-prints,success
Why Estimating $η_\oplus$ is Difficult: A Kepler-Centric Perspective,Publications of the Astronomical Society of the Pacific,success
Not all protoclusters host evolved galaxies: Evidence for reduced environmental effects in a lower halo mass protocluster at $z = 7.66$,arXiv e-prints,success
Figuring Out Gas & Galaxies In Enzo (FOGGIE). XIV. The Observability of Emission from Accretion and Feedback in the Circumgalactic Medium with Current and Future Instruments,arXiv e-prints,success
Chemical Evolution and Kilonova Implications of Post-Merger Accretion Disk Winds,arXiv e-prints,success
Double white dwarf ZTF J0538+1953 as the brightest verification binary for space laser interferometers,arXiv e-prints,success
Galaxy assembly bias in cosmological hydrodynamical simulations: a comparison between SIMBA and IllustrisTNG,arXiv e-prints,success
Addressing prior dependence in hierarchical Bayesian modeling for PTA data analysis II: Noise and SGWB inference through parameter decorrelation,arXiv e-prints,success
Improving Bayesian inference in PTA data analysis: importance nested sampling with Normalizing Flows,arXiv e-prints,success
Uncertainties in the production of iron-group nuclides in core-collapse supernovae from Monte Carlo variations of reaction rates,arXiv e-prints,success
Modeling Stellar Collisions in Galactic Nuclei Using Hydrodynamic Simulations and Machine Learning,arXiv e-prints,success
"A Possible ""Too-Many-Satellites"" Problem in the Isolated Dwarf Galaxy DDO 161",arXiv e-prints,success
High CO/H2 ratios supports an exocometary origin for a CO-rich debris disk,arXiv e-prints,success
The ALMA-QUARKS survey: Hot Molecular Cores are a long-standing phenomenon in the evolution of massive protostars,arXiv e-prints,success
The Universality of Dark Matter Density Profiles for Milky Way Analog Galaxies,arXiv e-prints,success
Photoevaporation Can Reproduce Extended $\mathrm{H_2}$ Emission from Protoplanetary Disks Imaged by JWST MIRI,arXiv e-prints,success
Tracing Multiphase Structure in the Circumgalactic Medium: Insights from Magnetohydrodynamic Turbulence Simulations,arXiv e-prints,success
Figuring Out Gas & Galaxies In Enzo (FOGGIE). XIII. On the Observability of Extended HI Disks and Warps,arXiv e-prints,success
Figuring Out Gas & Galaxies In Enzo (FOGGIE). XII. The Formation and Evolution of Extended HI Galactic Disks and Warps with a Dynamic CGM,arXiv e-prints,success
"Stellar halos of bright central galaxies II: Scaling relations, colors and metallicity evolution with redshift",arXiv e-prints,success
The Atacama Cosmology Telescope: stellar mass growth in massive galaxy clusters from DR5 over the past 7 billion years,arXiv e-prints,success
Search for GeV-scale Dark Matter from the Galactic Center with IceCube-DeepCore,arXiv e-prints,success
The CatWISE2020 Quasar dipole: A Reassessment of the Cosmic Dipole Anomaly,arXiv e-prints,success
Secondary eclipses of two brown dwarfs in the K2 fields: detection by multiple dataset merging,arXiv e-prints,success
Polarization Diagnostics Applied to Coronal Mass Ejections and the Background Solar Wind,arXiv e-prints,success
The JWST EXCELS Survey: gas-phase metallicity evolution at 2 < z < 8,arXiv e-prints,success
The lives and deaths of faint satellite galaxies around M31,arXiv e-prints,success
ODIN: Using multiplicity of Lyman-Alpha Emitters to assess star formation activity in dark matter halos,arXiv e-prints,success
Quantifying the Impact of Starspot-Crossing Events on Retrieved Parameters from Transit Lightcurves,arXiv e-prints,success
Euclid: Quick Data Release (Q1)- The connection between galaxy close encounters and radio activity,arXiv e-prints,success
The Challenge in Illuminating the Invisible: Constraining LyC Escape with Bayesian Modelling and Symbolic Regression,arXiv e-prints,success
